KEY,DATE,TARGET ROOM,ROOM EXAM CAPACITY,TOTAL STUDENTS,COURSES MERGED,UTILIZATION
02/01/2026_07g00_1,2026-01-02,B1-208,84,84,"EE2081(44), CO2011(40)",1.0
02/01/2026_07g00_1,2026-01-02,B1-306,84,78,"CH2003(43), CO2011(35)",0.9285714285714286
02/01/2026_07g00_1,2026-01-02,B1-311,80,73,"CH2003(39), TR3001(34)",0.9125
02/01/2026_07g00_1,2026-01-02,C4-301,80,79,"EE2015(33), CI2003(32), CI1003(14)",0.9875
02/01/2026_07g00_1,2026-01-02,B1-305,72,62,"CH2003(31), CH4101(31)",0.8611111111111112
02/01/2026_07g00_1,2026-01-02,B1-212,72,61,"EE2081(31), CH2003(30)",0.8472222222222222
02/01/2026_07g00_1,2026-01-02,B1-213,72,60,"EE2081(30), EE2015(30)",0.8333333333333334
02/01/2026_07g00_1,2026-01-02,B1-309,56,54,"EE2081(30), EE3117(24)",0.9642857142857143
02/01/2026_07g00_1,2026-01-02,B1-313,56,53,"EE2081(30), CI2003(23)",0.9464285714285714
02/01/2026_07g00_1,2026-01-02,B1-314,56,52,"EE2081(30), EE2015(22)",0.9285714285714286
02/01/2026_07g00_1,2026-01-02,B1-315,56,51,"EE2081(30), ME4133(21)",0.9107142857142857
02/01/2026_07g00_1,2026-01-02,B6-304,60,60,"EE3089(30), CH2003(30)",1.0
02/01/2026_07g00_1,2026-01-02,B9-201,60,60,"ME4133(30), CH2003(30)",1.0
02/01/2026_07g00_1,2026-01-02,C6-102,100,90,"CI1003(30), CO2011(30), CI2003(30)",0.9
02/01/2026_07g00_1,2026-01-02,B4-402,60,60,"CO2011(30), TR3001(30)",1.0
02/01/2026_07g00_1,2026-01-02,B4-301,60,59,"CO2011(30), EE3089(29)",0.9833333333333333
02/01/2026_07g00_1,2026-01-02,B4-302,60,59,"CO2011(30), CI2003(29)",0.9833333333333333
02/01/2026_07g00_1,2026-01-02,B4-303,60,59,"CO2011(30), CH2003(29)",0.9833333333333333
02/01/2026_07g00_1,2026-01-02,B4-305,80,79,"CO2011(30), CH2003(28), TR3001(21)",0.9875
02/01/2026_07g00_1,2026-01-02,B4-306,80,49,"CO2011(30), EE2081(19)",0.6125
02/01/2026_07g00_1,2026-01-02,B4-401,60,49,"CO2011(30), EE2081(19)",0.8166666666666667
02/01/2026_07g00_1,2026-01-02,B6-302,60,30,CO2011(30),0.5
02/01/2026_07g00_1,2026-01-02,B4-501,80,30,CO2011(30),0.375
02/01/2026_07g00_1,2026-01-02,B4-502,80,30,CO2011(30),0.375
02/01/2026_07g00_1,2026-01-02,B4-403,60,29,CO2011(29),0.48333333333333334
02/01/2026_07g00_1,2026-01-02,B6-303,60,28,CO2011(28),0.4666666666666667
02/01/2026_07g00_1,2026-01-02,B4-405,60,20,CO2011(20),0.3333333333333333
02/01/2026_07g00_1,2026-01-02,B6-301,50,19,CO2011(19),0.38
02/01/2026_07g00_2,2026-01-02,H3-301,142,140,"CH2003(50), ME4133(46), EE2015(44)",0.9859154929577465
02/01/2026_07g00_2,2026-01-02,H3-306,142,130,"CH2003(46), CO2011(42), EE2015(42)",0.9154929577464789
02/01/2026_07g00_2,2026-01-02,H2-406,156,155,"CH4101(41), CI2003(40), CO2011(40), CH2003(34)",0.9935897435897436
02/01/2026_07g00_2,2026-01-02,H2-401,156,156,"CO2011(40), CI2003(40), CH2003(40), EE2081(36)",1.0
02/01/2026_07g00_2,2026-01-02,H2-404,93,80,"CO2011(40), CH2003(40)",0.8602150537634409
02/01/2026_07g00_2,2026-01-02,H3-304,88,80,"CH2003(40), CH4101(40)",0.9090909090909091
02/01/2026_07g00_2,2026-01-02,H3-403,88,80,"EE2015(40), CO2011(40)",0.9090909090909091
02/01/2026_07g00_2,2026-01-02,H3-404,88,80,"EE2015(40), EE2081(40)",0.9090909090909091
02/01/2026_07g00_2,2026-01-02,H3-501,142,138,"EE2015(40), EE2081(40), EE3117(40), TR3001(18)",0.971830985915493
02/01/2026_07g00_2,2026-01-02,H3-503,88,80,"EE2015(40), EE2081(40)",0.9090909090909091
02/01/2026_07g00_2,2026-01-02,H6-516,114,114,"EE2081(40), CO2011(40), CI2003(34)",1.0
02/01/2026_07g00_2,2026-01-02,H6-802,120,120,"EE2081(40), CO2011(40), TR3001(40)",1.0
02/01/2026_07g00_2,2026-01-02,H6-810,120,120,"EE2081(40), CI2003(40), CO2011(40)",1.0
02/01/2026_07g00_2,2026-01-02,H6-811,150,147,"EE2081(40), CO2011(40), CI2003(40), EE3017(27)",0.98
02/01/2026_07g00_2,2026-01-02,H2-205,117,117,"CO2011(40), CI2003(40), EE2081(37)",1.0
02/01/2026_07g00_2,2026-01-02,H2-202,117,117,"CO2011(40), CI2003(40), EE2081(37)",1.0
02/01/2026_07g00_2,2026-01-02,H6-412,123,118,"CI2003(40), CO2011(40), CH2003(38)",0.959349593495935
02/01/2026_07g00_2,2026-01-02,H6-405,120,117,"CI2003(40), CO2011(39), EE2081(38)",0.975
02/01/2026_07g00_2,2026-01-02,H6-211,126,109,"CI2003(40), EE3089(26), EE2081(23), EE3117(20)",0.8650793650793651
02/01/2026_07g00_2,2026-01-02,H6-311,135,40,CI2003(40),0.2962962962962963
02/01/2026_07g00_2,2026-01-02,H6-112,80,39,CI2003(39),0.4875
02/01/2026_07g00_2,2026-01-02,H6-208,117,39,CI2003(39),0.3333333333333333
02/01/2026_07g00_2,2026-01-02,H6-206,80,38,CI2003(38),0.475
02/01/2026_07g00_2,2026-01-02,H6-210,80,37,CI2003(37),0.4625
02/01/2026_07g00_2,2026-01-02,H6-213,80,37,CI2003(37),0.4625
02/01/2026_07g00_2,2026-01-02,H6-212,80,37,CI2003(37),0.4625
02/01/2026_07g00_2,2026-01-02,H6-313,80,36,CI2003(36),0.45
02/01/2026_07g00_2,2026-01-02,H6-310,80,36,CI2003(36),0.45
02/01/2026_07g00_2,2026-01-02,H6-312,80,36,CI2003(36),0.45
02/01/2026_07g00_2,2026-01-02,H6-214,80,36,CI2003(36),0.45
02/01/2026_07g00_2,2026-01-02,H6-411,80,35,CI2003(35),0.4375
02/01/2026_07g00_2,2026-01-02,H6-413,80,35,CI2003(35),0.4375
02/01/2026_07g00_2,2026-01-02,H6-306,80,35,CI2003(35),0.4375
02/01/2026_09g30_1,2026-01-02,B4-403,60,59,"MA3019(21), MA2033(15), AS3093(13), MA4139(10)",0.9833333333333333
02/01/2026_09g30_1,2026-01-02,B4-305,80,3,AS2049(3),0.0375
02/01/2026_09g30_2,2026-01-02,H6-311,135,126,"GE3137(46), GE2053(40), MA2033(40)",0.9333333333333333
02/01/2026_09g30_2,2026-01-02,H6-211,126,120,"MA2033(40), ME4615(40), ME2113(40)",0.9523809523809523
02/01/2026_09g30_2,2026-01-02,H6-212,80,78,"MA2033(40), GE2053(38)",0.975
02/01/2026_09g30_2,2026-01-02,H6-213,80,74,"MA2033(37), ME2065(37)",0.925
02/01/2026_09g30_2,2026-01-02,H6-305,129,129,"GE2065(30), ME2113(29), ME4615(29), EN3207(28), CO3033(13)",1.0
02/01/2026_09g30_2,2026-01-02,H6-310,80,68,"MA4125(26), TR4021(22), MA2033(20)",0.85
02/01/2026_09g30_2,2026-01-02,H6-208,117,33,"ME2065(18), IM4001(15)",0.28205128205128205
02/01/2026_13g00_1,2026-01-02,B4-406,108,103,"AS1003(45), ME2089(44), EE2035(14)",0.9537037037037037
02/01/2026_13g00_1,2026-01-02,B4-305,80,73,"IM3047(41), CH3351(32)",0.9125
02/01/2026_13g00_1,2026-01-02,B4-402,60,60,"EE2035(31), ME2089(29)",1.0
02/01/2026_13g00_1,2026-01-02,B8-301,66,60,"CH3341(30), IM3047(30)",0.9090909090909091
02/01/2026_13g00_1,2026-01-02,B4-501,80,69,"ME2089(30), IM3047(26), CH3341(13)",0.8625
02/01/2026_13g00_1,2026-01-02,B4-502,80,42,"ME2089(30), CO3067(12)",0.525
02/01/2026_13g00_2,2026-01-02,H6-308,144,141,"CI4145(50), CO3067(49), CH3341(42)",0.9791666666666666
02/01/2026_13g00_2,2026-01-02,H6-305,129,122,"ME2089(41), IM3047(41), AS1003(40)",0.9457364341085271
02/01/2026_13g00_2,2026-01-02,H6-412,123,121,"ME2089(41), IM3047(40), EE2035(40)",0.983739837398374
02/01/2026_13g00_2,2026-01-02,H6-311,135,121,"ME2089(41), IM3047(40), EE2035(40)",0.8962962962962963
02/01/2026_13g00_2,2026-01-02,H6-310,80,80,"ME2089(40), IM3047(40)",1.0
02/01/2026_13g00_2,2026-01-02,H6-212,80,80,"IM3047(40), ME2089(40)",1.0
02/01/2026_13g00_2,2026-01-02,H6-211,126,120,"IM3047(40), ME2089(40), CH3351(40)",0.9523809523809523
02/01/2026_13g00_2,2026-01-02,H6-210,80,80,"IM3047(40), ME2089(40)",1.0
02/01/2026_13g00_2,2026-01-02,H6-208,117,117,"IM3047(40), EE2035(40), ME2089(37)",1.0
02/01/2026_13g00_2,2026-01-02,H6-205,117,117,"IM3047(40), AS1003(39), ME2089(38)",1.0
02/01/2026_13g00_2,2026-01-02,H6-113,129,118,"IM3047(40), EE2035(39), PH2001(39)",0.9147286821705426
02/01/2026_13g00_2,2026-01-02,H6-506,105,89,"EE2035(25), CH3351(24), IU3067(20), PH2001(20)",0.8476190476190476
02/01/2026_13g00_2,2026-01-02,H6-112,80,19,AS1003(19),0.2375
02/01/2026_15g30_1,2026-01-02,B4-306,80,35,CO3061(35),0.4375
02/01/2026_15g30_1,2026-01-02,B4-303,60,30,CO3061(30),0.5
02/01/2026_15g30_1,2026-01-02,B4-305,80,30,CO3061(30),0.375
02/01/2026_15g30_1,2026-01-02,B4-301,60,22,CO3061(22),0.36666666666666664
02/01/2026_15g30_1,2026-01-02,B4-302,60,19,CO3061(19),0.31666666666666665
02/01/2026_15g30_2,2026-01-02,H6-109,80,40,CO3061(40),0.5
02/01/2026_15g30_2,2026-01-02,H6-110,80,40,CO3061(40),0.5
02/01/2026_15g30_2,2026-01-02,H6-112,80,40,CO3061(40),0.5
02/01/2026_15g30_2,2026-01-02,H6-113,129,40,CO3061(40),0.31007751937984496
02/01/2026_18g15_1,2026-01-02,B4-406,108,101,"CO5175(41), CO5111(30), CH5711(30)",0.9351851851851852
02/01/2026_18g15_1,2026-01-02,B4-302,60,56,"CH5711(28), CH5747(28)",0.9333333333333333
02/01/2026_18g15_1,2026-01-02,B4-301,60,28,"CI5777(16), MA5071(12)",0.4666666666666667
03/01/2026_07g00_1,2026-01-03,B4-305,80,80,"MT1013(39), CO4033(30), EE3189(11)",1.0
03/01/2026_07g00_1,2026-01-03,B6-302,60,60,"CO5097(30), MT1013(30)",1.0
03/01/2026_07g00_1,2026-01-03,B6-303,60,57,"CO5097(30), IM4003(27)",0.95
03/01/2026_07g00_1,2026-01-03,B6-306,80,79,"CO5097(30), CI5239(26), TR4057(18), EE3035(5)",0.9875
03/01/2026_07g00_1,2026-01-03,B4-302,60,57,"ME3005(25), CO5097(17), CH3131(15)",0.95
03/01/2026_07g00_1,2026-01-03,B4-301,60,54,"ME3005(15), AS3031(13), MA2037(10), MA4065(7), EN5075(5), ME5091(4)",0.9
03/01/2026_07g00_2,2026-01-03,H6-412,123,123,"EE3035(58), IM4003(54), CH4063(11)",1.0
03/01/2026_07g00_2,2026-01-03,H6-208,117,117,"IU2031(51), GE4091(50), CI4159(16)",1.0
03/01/2026_07g00_2,2026-01-03,H6-205,117,117,"IU2031(43), IM4003(41), EE3101(32), GE3203(1)",1.0
03/01/2026_07g00_2,2026-01-03,H6-311,135,120,"CI3237(40), CO4033(40), CH3131(40)",0.8888888888888888
03/01/2026_07g00_2,2026-01-03,H6-110,80,80,"IM4003(40), EN2065(40)",1.0
03/01/2026_07g00_2,2026-01-03,H6-212,80,79,"EN2065(40), AS3031(39)",0.9875
03/01/2026_07g00_2,2026-01-03,H6-206,80,78,"IU2031(39), EN2065(39)",0.975
03/01/2026_07g00_2,2026-01-03,H6-312,80,76,"CH4107(38), CH3131(38)",0.95
03/01/2026_07g00_2,2026-01-03,H6-305,129,128,"MA4065(36), ME3005(35), TR3039(32), EN3211(25)",0.9922480620155039
03/01/2026_07g00_2,2026-01-03,H6-306,80,68,"MA4065(28), CI3237(20), CO4033(20)",0.85
03/01/2026_09g30_1,2026-01-03,B4-505,120,40,SP1035(40),0.3333333333333333
03/01/2026_09g30_1,2026-01-03,B4-406,108,38,SP1035(38),0.35185185185185186
03/01/2026_09g30_1,2026-01-03,B4-305,80,31,SP1035(31),0.3875
03/01/2026_09g30_1,2026-01-03,B4-302,60,30,SP1035(30),0.5
03/01/2026_09g30_1,2026-01-03,B4-504,60,30,SP1035(30),0.5
03/01/2026_09g30_1,2026-01-03,B4-502,80,30,SP1035(30),0.375
03/01/2026_09g30_1,2026-01-03,B4-501,80,30,SP1035(30),0.375
03/01/2026_09g30_1,2026-01-03,B4-405,60,30,SP1035(30),0.5
03/01/2026_09g30_1,2026-01-03,B4-403,60,30,SP1035(30),0.5
03/01/2026_09g30_1,2026-01-03,B4-402,60,30,SP1035(30),0.5
03/01/2026_09g30_1,2026-01-03,B4-401,60,30,SP1035(30),0.5
03/01/2026_09g30_1,2026-01-03,B4-306,80,30,SP1035(30),0.375
03/01/2026_09g30_1,2026-01-03,B4-303,60,30,SP1035(30),0.5
03/01/2026_09g30_1,2026-01-03,B1-208,84,30,SP1035(30),0.35714285714285715
03/01/2026_09g30_1,2026-01-03,B1-212,72,30,SP1035(30),0.4166666666666667
03/01/2026_09g30_1,2026-01-03,B1-315,56,30,SP1035(30),0.5357142857142857
03/01/2026_09g30_1,2026-01-03,B1-311,80,30,SP1035(30),0.375
03/01/2026_09g30_1,2026-01-03,B1-309,56,30,SP1035(30),0.5357142857142857
03/01/2026_09g30_1,2026-01-03,B1-306,84,30,SP1035(30),0.35714285714285715
03/01/2026_09g30_1,2026-01-03,B1-305,72,30,SP1035(30),0.4166666666666667
03/01/2026_09g30_1,2026-01-03,B1-213,72,30,SP1035(30),0.4166666666666667
03/01/2026_09g30_1,2026-01-03,B4-301,60,30,SP1035(30),0.5
03/01/2026_09g30_1,2026-01-03,B1-314,56,29,SP1035(29),0.5178571428571429
03/01/2026_09g30_1,2026-01-03,B1-313,56,29,SP1035(29),0.5178571428571429
03/01/2026_09g30_1,2026-01-03,B1-308,72,23,SP1035(23),0.3194444444444444
03/01/2026_09g30_1,2026-01-03,B1-214,48,22,SP1035(22),0.4583333333333333
03/01/2026_09g30_1,2026-01-03,B1-215,48,20,SP1035(20),0.4166666666666667
03/01/2026_09g30_2,2026-01-03,H6-113,129,44,SP1035(44),0.34108527131782945
03/01/2026_09g30_2,2026-01-03,H6-308,144,40,SP1035(40),0.2777777777777778
03/01/2026_09g30_2,2026-01-03,H6-504,106,40,SP1035(40),0.37735849056603776
03/01/2026_09g30_2,2026-01-03,H6-313,80,40,SP1035(40),0.5
03/01/2026_09g30_2,2026-01-03,H6-405,120,40,SP1035(40),0.3333333333333333
03/01/2026_09g30_2,2026-01-03,H6-411,80,40,SP1035(40),0.5
03/01/2026_09g30_2,2026-01-03,H6-412,123,40,SP1035(40),0.3252032520325203
03/01/2026_09g30_2,2026-01-03,H6-413,80,40,SP1035(40),0.5
03/01/2026_09g30_2,2026-01-03,H6-414,80,40,SP1035(40),0.5
03/01/2026_09g30_2,2026-01-03,H6-506,105,40,SP1035(40),0.38095238095238093
03/01/2026_09g30_2,2026-01-03,H6-310,80,40,SP1035(40),0.5
03/01/2026_09g30_2,2026-01-03,H6-510,102,40,SP1035(40),0.39215686274509803
03/01/2026_09g30_2,2026-01-03,H6-512,105,40,SP1035(40),0.38095238095238093
03/01/2026_09g30_2,2026-01-03,H6-514,108,40,SP1035(40),0.37037037037037035
03/01/2026_09g30_2,2026-01-03,H6-516,114,40,SP1035(40),0.3508771929824561
03/01/2026_09g30_2,2026-01-03,H6-802,120,40,SP1035(40),0.3333333333333333
03/01/2026_09g30_2,2026-01-03,H6-810,120,40,SP1035(40),0.3333333333333333
03/01/2026_09g30_2,2026-01-03,H6-312,80,40,SP1035(40),0.5
03/01/2026_09g30_2,2026-01-03,H6-811,150,40,SP1035(40),0.26666666666666666
03/01/2026_09g30_2,2026-01-03,H6-112,80,40,SP1035(40),0.5
03/01/2026_09g30_2,2026-01-03,H6-305,129,40,SP1035(40),0.31007751937984496
03/01/2026_09g30_2,2026-01-03,H6-214,80,40,SP1035(40),0.5
03/01/2026_09g30_2,2026-01-03,H6-213,80,40,SP1035(40),0.5
03/01/2026_09g30_2,2026-01-03,H6-212,80,40,SP1035(40),0.5
03/01/2026_09g30_2,2026-01-03,H6-211,126,40,SP1035(40),0.31746031746031744
03/01/2026_09g30_2,2026-01-03,H6-210,80,40,SP1035(40),0.5
03/01/2026_09g30_2,2026-01-03,H6-208,117,40,SP1035(40),0.3418803418803419
03/01/2026_09g30_2,2026-01-03,H6-110,80,40,SP1035(40),0.5
03/01/2026_09g30_2,2026-01-03,H6-206,80,40,SP1035(40),0.5
03/01/2026_09g30_2,2026-01-03,H6-205,117,40,SP1035(40),0.3418803418803419
03/01/2026_09g30_2,2026-01-03,H6-201,120,40,SP1035(40),0.3333333333333333
03/01/2026_09g30_2,2026-01-03,H6-415,80,39,SP1035(39),0.4875
03/01/2026_09g30_2,2026-01-03,H6-109,80,39,SP1035(39),0.4875
03/01/2026_09g30_2,2026-01-03,H1-101,138,39,SP1035(39),0.2826086956521739
03/01/2026_09g30_2,2026-01-03,H6-306,80,39,SP1035(39),0.4875
03/01/2026_09g30_2,2026-01-03,H6-311,135,39,SP1035(39),0.28888888888888886
03/01/2026_09g30_2,2026-01-03,H1-104,138,32,SP1035(32),0.2318840579710145
03/01/2026_09g30_2,2026-01-03,H1-103,90,31,SP1035(31),0.34444444444444444
03/01/2026_09g30_2,2026-01-03,H1-102,93,27,SP1035(27),0.2903225806451613
03/01/2026_13g00_1,2026-01-03,B4-505,120,117,"IM1019(45), TR2039(42), CH5607(30)",0.975
03/01/2026_13g00_1,2026-01-03,B4-502,80,69,"IM1019(40), CO5185(29)",0.8625
03/01/2026_13g00_1,2026-01-03,B4-501,80,69,"IM1019(30), CI5253(22), CH5607(17)",0.8625
03/01/2026_13g00_1,2026-01-03,B4-504,60,53,"IM1019(25), CH4087(16), CH5653(12)",0.8833333333333333
03/01/2026_13g00_2,2026-01-03,H6-308,144,139,"CH4087(47), IM1019(41), EN1005(40), IU1005(11)",0.9652777777777778
03/01/2026_13g00_2,2026-01-03,H6-110,80,80,"EN1005(40), IM1019(40)",1.0
03/01/2026_13g00_2,2026-01-03,H6-208,117,113,"IM1019(40), TR2039(40), EE3171(33)",0.9658119658119658
03/01/2026_13g00_2,2026-01-03,H6-210,80,80,"IM1019(40), ME2071(23), TR2039(17)",1.0
03/01/2026_13g00_2,2026-01-03,H6-211,126,40,IM1019(40),0.31746031746031744
03/01/2026_13g00_2,2026-01-03,H6-206,80,39,IM1019(39),0.4875
03/01/2026_15g30_1,2026-01-03,B4-406,108,46,CO3043(46),0.42592592592592593
03/01/2026_15g30_1,2026-01-03,B4-405,60,25,CO3043(25),0.4166666666666667
03/01/2026_15g30_2,2026-01-03,H6-113,129,50,CO3043(50),0.3875968992248062
03/01/2026_15g30_2,2026-01-03,H6-110,80,40,CO3043(40),0.5
03/01/2026_15g30_2,2026-01-03,H6-112,80,40,CO3043(40),0.5
04/01/2026_07g00_1,2026-01-04,B6-306,80,77,"TR4087(42), GK5033(35)",0.9625
04/01/2026_07g00_1,2026-01-04,B1-208,84,82,"IM1025(42), GK5033(40)",0.9761904761904762
04/01/2026_07g00_1,2026-01-04,B4-502,80,80,"GK5033(32), EE3411(31), IM1025(17)",1.0
04/01/2026_07g00_1,2026-01-04,B4-402,60,60,"IM3073(30), IM1025(30)",1.0
04/01/2026_07g00_1,2026-01-04,B1-311,80,79,"IM1025(30), AS2013(30), IM3073(19)",0.9875
04/01/2026_07g00_1,2026-01-04,B1-309,56,54,"IM1025(30), CH4111(24)",0.9642857142857143
04/01/2026_07g00_1,2026-01-04,B1-306,84,84,"IM1025(30), EE3411(30), MA4079(24)",1.0
04/01/2026_07g00_1,2026-01-04,B1-213,72,72,"IM1025(30), CI2157(21), AS3075(21)",1.0
04/01/2026_07g00_1,2026-01-04,B1-313,56,53,"IM1025(29), EE2419(18), CI3259(6)",0.9464285714285714
04/01/2026_07g00_1,2026-01-04,B1-212,72,69,"IM1025(29), PH1009(18), MA3139(17), MA4181(5)",0.9583333333333334
04/01/2026_07g00_1,2026-01-04,B1-314,56,53,"IM1025(20), PH2003(17), AS2013(16)",0.9464285714285714
04/01/2026_07g00_1,2026-01-04,B1-310,32,29,"MA3113(15), CH2109(14)",0.90625
04/01/2026_07g00_1,2026-01-04,B6-304,60,10,CH4115(10),0.16666666666666666
04/01/2026_07g00_2,2026-01-04,H6-802,120,115,"CH4115(43), IM3073(42), ME4025(30)",0.9583333333333334
04/01/2026_07g00_2,2026-01-04,H6-113,129,126,"IM1025(42), CI4139(42), CH2109(42)",0.9767441860465116
04/01/2026_07g00_2,2026-01-04,H2-206,156,152,"GE2069(42), IM1025(41), AS2013(40), TR4087(29)",0.9743589743589743
04/01/2026_07g00_2,2026-01-04,H6-306,80,80,"IM1025(40), IM3073(40)",1.0
04/01/2026_07g00_2,2026-01-04,H6-212,80,80,"IM1025(40), PH2003(40)",1.0
04/01/2026_07g00_2,2026-01-04,H6-213,80,80,"IM1025(40), AS2069(40)",1.0
04/01/2026_07g00_2,2026-01-04,H6-305,129,128,"IM1025(40), ME4025(40), AS2069(40), MA4025(8)",0.9922480620155039
04/01/2026_07g00_2,2026-01-04,H6-214,80,79,"IM1025(40), ME4025(39)",0.9875
04/01/2026_07g00_2,2026-01-04,H6-210,80,79,"IM1025(40), ME2139(39)",0.9875
04/01/2026_07g00_2,2026-01-04,H6-310,80,79,"IM1025(40), ME4025(39)",0.9875
04/01/2026_07g00_2,2026-01-04,H6-311,135,135,"IM1025(40), IU3057(36), CI3263(26), AS2013(26), MA2011(7)",1.0
04/01/2026_07g00_2,2026-01-04,H6-312,80,80,"IM1025(40), ME2139(24), MA3089(16)",1.0
04/01/2026_07g00_2,2026-01-04,H6-313,80,72,"IM1025(40), CI4147(22), GE4033(10)",0.9
04/01/2026_07g00_2,2026-01-04,H6-211,126,99,"IM1025(40), CI4155(20), PH2003(20), CI3259(19)",0.7857142857142857
04/01/2026_07g00_2,2026-01-04,H6-206,80,40,IM1025(40),0.5
04/01/2026_07g00_2,2026-01-04,H6-208,117,40,IM1025(40),0.3418803418803419
04/01/2026_07g00_2,2026-01-04,H6-201,120,40,IM1025(40),0.3333333333333333
04/01/2026_07g00_2,2026-01-04,H6-112,80,40,IM1025(40),0.5
04/01/2026_07g00_2,2026-01-04,H6-110,80,40,IM1025(40),0.5
04/01/2026_07g00_2,2026-01-04,H6-109,80,40,IM1025(40),0.5
04/01/2026_07g00_2,2026-01-04,H6-405,120,38,IM1025(38),0.31666666666666665
04/01/2026_07g00_2,2026-01-04,H6-411,80,30,IM1025(30),0.375
04/01/2026_07g00_2,2026-01-04,H6-412,123,30,IM1025(30),0.24390243902439024
04/01/2026_09g30_1,2026-01-04,B4-305,80,79,"CH5699(42), CI5405(37)",0.9875
04/01/2026_09g30_1,2026-01-04,B4-303,60,60,"CO5137(31), IM1013(29)",1.0
04/01/2026_09g30_1,2026-01-04,B6-304,60,59,"IM1013(31), IM5111(28)",0.9833333333333333
04/01/2026_09g30_1,2026-01-04,B4-302,60,59,"EE5195(27), CI5143(22), EN5147(10)",0.9833333333333333
04/01/2026_09g30_1,2026-01-04,B6-302,60,58,"IM1013(15), CI5249(14), CH5741(13), MA5067(8), ME5087(8)",0.9666666666666667
04/01/2026_09g30_1,2026-01-04,B6-301,50,14,IM1013(14),0.28
04/01/2026_09g30_2,2026-01-04,H6-109,80,40,IM1013(40),0.5
04/01/2026_09g30_2,2026-01-04,H6-113,129,40,IM1013(40),0.31007751937984496
04/01/2026_09g30_2,2026-01-04,H6-110,80,39,IM1013(39),0.4875
04/01/2026_09g30_2,2026-01-04,H6-112,80,39,IM1013(39),0.4875
04/01/2026_13g00_1,2026-01-04,B1-311,80,78,"TR3011(39), CH3329(39)",0.975
04/01/2026_13g00_1,2026-01-04,B4-305,80,71,"CO3117(37), EE3097(34)",0.8875
04/01/2026_13g00_1,2026-01-04,B4-306,80,79,"CO3117(33), CH3329(30), EN3087(16)",0.9875
04/01/2026_13g00_1,2026-01-04,B4-303,60,56,"CO3117(32), IM1031(24)",0.9333333333333333
04/01/2026_13g00_1,2026-01-04,B4-405,60,60,"CH3329(30), CO3117(30)",1.0
04/01/2026_13g00_1,2026-01-04,B4-502,80,77,"EE3097(30), ME3003(24), CO3117(23)",0.9625
04/01/2026_13g00_1,2026-01-04,B1-313,56,52,"EE2005(22), ME3003(21), EE3097(9)",0.9285714285714286
04/01/2026_13g00_1,2026-01-04,B4-402,60,49,"CH3329(20), TR3011(16), ME3003(13)",0.8166666666666667
04/01/2026_13g00_2,2026-01-04,H6-305,129,126,"EE2005(50), EN3087(50), ME2049(26)",0.9767441860465116
04/01/2026_13g00_2,2026-01-04,H6-802,120,120,"IM3077(43), EE3097(42), CI4131(35)",1.0
04/01/2026_13g00_2,2026-01-04,H6-306,80,80,"EE2005(40), ME3003(40)",1.0
04/01/2026_13g00_2,2026-01-04,H6-205,117,117,"ME3003(40), ME2049(40), IM1031(37)",1.0
04/01/2026_13g00_2,2026-01-04,H6-201,120,120,"ME3003(40), IM1031(40), EE3097(40)",1.0
04/01/2026_13g00_2,2026-01-04,H6-109,80,80,"CI4131(40), EE3011(40)",1.0
04/01/2026_13g00_2,2026-01-04,H6-208,117,116,"ME3003(40), CO3117(40), EE3097(36)",0.9914529914529915
04/01/2026_13g00_2,2026-01-04,H6-113,129,120,"CI4131(40), CH3329(40), CO3117(40)",0.9302325581395349
04/01/2026_13g00_2,2026-01-04,H6-214,80,80,"CI4131(40), CH3329(40)",1.0
04/01/2026_13g00_2,2026-01-04,H6-514,108,105,"CO3117(40), ME3003(40), EE1005(25)",0.9722222222222222
04/01/2026_13g00_2,2026-01-04,H6-506,105,104,"CO3117(40), EE1005(39), AS3061(25)",0.9904761904761905
04/01/2026_13g00_2,2026-01-04,H6-212,80,78,"ME3003(39), CH3329(39)",0.975
04/01/2026_13g00_2,2026-01-04,H6-210,80,70,"ME3003(39), EE3097(31)",0.875
04/01/2026_13g00_2,2026-01-04,H1-102,93,83,"EE3011(23), CO3117(20), CI4131(20), ME3003(20)",0.8924731182795699
04/01/2026_15g30_1,2026-01-04,B4-306,80,72,"CO5173(33), CH5647(28), TR5069(11)",0.9
04/01/2026_15g30_1,2026-01-04,B4-305,80,32,CO5173(32),0.4
04/01/2026_15g30_1,2026-01-04,B4-302,60,30,CO5173(30),0.5
04/01/2026_15g30_1,2026-01-04,B4-303,60,30,CO5173(30),0.5
15/12/2025_07g00_1,2025-12-15,B4-505,120,112,"MT2013(42), EE3093(36), MT2009(34)",0.9333333333333333
15/12/2025_07g00_1,2025-12-15,B4-305,80,74,"MT2013(42), MT2009(32)",0.925
15/12/2025_07g00_1,2025-12-15,B4-406,108,102,"MT2013(42), CO3057(30), MT2009(30)",0.9444444444444444
15/12/2025_07g00_1,2025-12-15,B4-306,80,70,"MT2013(40), EE3093(30)",0.875
15/12/2025_07g00_1,2025-12-15,B1-212,72,61,"MT2013(31), MT2009(30)",0.8472222222222222
15/12/2025_07g00_1,2025-12-15,B4-402,60,60,"MT2013(30), MT2009(30)",1.0
15/12/2025_07g00_1,2025-12-15,B4-301,60,60,"MT2013(30), MT2009(30)",1.0
15/12/2025_07g00_1,2025-12-15,B4-302,60,53,"MT2013(30), CO3057(23)",0.8833333333333333
15/12/2025_07g00_1,2025-12-15,B4-303,60,46,"MT2013(30), IM3055(16)",0.7666666666666667
15/12/2025_07g00_1,2025-12-15,B4-401,60,30,MT2013(30),0.5
15/12/2025_07g00_1,2025-12-15,B4-403,60,30,MT2013(30),0.5
15/12/2025_07g00_1,2025-12-15,B1-314,56,30,MT2013(30),0.5357142857142857
15/12/2025_07g00_1,2025-12-15,B4-502,80,30,MT2013(30),0.375
15/12/2025_07g00_1,2025-12-15,B4-504,60,30,MT2013(30),0.5
15/12/2025_07g00_1,2025-12-15,B8-301,66,30,MT2013(30),0.45454545454545453
15/12/2025_07g00_1,2025-12-15,B8-303,62,30,MT2013(30),0.4838709677419355
15/12/2025_07g00_1,2025-12-15,B1-315,56,30,MT2013(30),0.5357142857142857
15/12/2025_07g00_1,2025-12-15,B1-313,56,30,MT2013(30),0.5357142857142857
15/12/2025_07g00_1,2025-12-15,B1-308,72,30,MT2013(30),0.4166666666666667
15/12/2025_07g00_1,2025-12-15,B1-306,84,30,MT2013(30),0.35714285714285715
15/12/2025_07g00_1,2025-12-15,B1-305,72,30,MT2013(30),0.4166666666666667
15/12/2025_07g00_1,2025-12-15,B1-303,56,30,MT2013(30),0.5357142857142857
15/12/2025_07g00_1,2025-12-15,B1-208,84,30,MT2013(30),0.35714285714285715
15/12/2025_07g00_1,2025-12-15,B1-311,80,30,MT2013(30),0.375
15/12/2025_07g00_1,2025-12-15,B4-405,60,29,MT2013(29),0.48333333333333334
15/12/2025_07g00_1,2025-12-15,B8-304,62,29,MT2013(29),0.46774193548387094
15/12/2025_07g00_1,2025-12-15,B4-501,80,29,MT2013(29),0.3625
15/12/2025_07g00_1,2025-12-15,B1-302,56,29,MT2013(29),0.5178571428571429
15/12/2025_07g00_1,2025-12-15,B1-309,56,29,MT2013(29),0.5178571428571429
15/12/2025_07g00_1,2025-12-15,B1-301,56,24,MT2013(24),0.42857142857142855
15/12/2025_07g00_1,2025-12-15,B6-301,50,22,MT2013(22),0.44
15/12/2025_07g00_2,2025-12-15,H1-204,129,126,"EE3063(52), IM3055(50), EE3093(24)",0.9767441860465116
15/12/2025_07g00_2,2025-12-15,H6-811,150,123,"MT2013(42), CI4197(41), CO3057(40)",0.82
15/12/2025_07g00_2,2025-12-15,H6-201,120,95,"MT2013(41), EE3093(30), CO3057(24)",0.7916666666666666
15/12/2025_07g00_2,2025-12-15,H6-810,120,41,MT2013(41),0.3416666666666667
15/12/2025_07g00_2,2025-12-15,H6-802,120,41,MT2013(41),0.3416666666666667
15/12/2025_07g00_2,2025-12-15,H6-412,123,41,MT2013(41),0.3333333333333333
15/12/2025_07g00_2,2025-12-15,H6-405,120,41,MT2013(41),0.3416666666666667
15/12/2025_07g00_2,2025-12-15,H6-311,135,41,MT2013(41),0.3037037037037037
15/12/2025_07g00_2,2025-12-15,H3-504,88,40,MT2013(40),0.45454545454545453
15/12/2025_07g00_2,2025-12-15,H6-506,105,40,MT2013(40),0.38095238095238093
15/12/2025_07g00_2,2025-12-15,H3-506,142,40,MT2013(40),0.28169014084507044
15/12/2025_07g00_2,2025-12-15,H3-606,120,40,MT2013(40),0.3333333333333333
15/12/2025_07g00_2,2025-12-15,H6-109,80,40,MT2013(40),0.5
15/12/2025_07g00_2,2025-12-15,H6-110,80,40,MT2013(40),0.5
15/12/2025_07g00_2,2025-12-15,H2-205,117,40,MT2013(40),0.3418803418803419
15/12/2025_07g00_2,2025-12-15,H6-512,105,40,MT2013(40),0.38095238095238093
15/12/2025_07g00_2,2025-12-15,H6-510,102,40,MT2013(40),0.39215686274509803
15/12/2025_07g00_2,2025-12-15,H6-206,80,40,MT2013(40),0.5
15/12/2025_07g00_2,2025-12-15,H6-208,117,40,MT2013(40),0.3418803418803419
15/12/2025_07g00_2,2025-12-15,H6-211,126,40,MT2013(40),0.31746031746031744
15/12/2025_07g00_2,2025-12-15,H3-501,142,40,MT2013(40),0.28169014084507044
15/12/2025_07g00_2,2025-12-15,H6-212,80,40,MT2013(40),0.5
15/12/2025_07g00_2,2025-12-15,H6-214,80,40,MT2013(40),0.5
15/12/2025_07g00_2,2025-12-15,H6-305,129,40,MT2013(40),0.31007751937984496
15/12/2025_07g00_2,2025-12-15,H6-306,80,40,MT2013(40),0.5
15/12/2025_07g00_2,2025-12-15,H6-308,144,40,MT2013(40),0.2777777777777778
15/12/2025_07g00_2,2025-12-15,H6-310,80,40,MT2013(40),0.5
15/12/2025_07g00_2,2025-12-15,H6-504,106,40,MT2013(40),0.37735849056603776
15/12/2025_07g00_2,2025-12-15,H6-312,80,40,MT2013(40),0.5
15/12/2025_07g00_2,2025-12-15,H6-313,80,40,MT2013(40),0.5
15/12/2025_07g00_2,2025-12-15,H3-503,88,40,MT2013(40),0.45454545454545453
15/12/2025_07g00_2,2025-12-15,H2-406,156,40,MT2013(40),0.2564102564102564
15/12/2025_07g00_2,2025-12-15,H3-406,142,40,MT2013(40),0.28169014084507044
15/12/2025_07g00_2,2025-12-15,H2-207,135,40,MT2013(40),0.2962962962962963
15/12/2025_07g00_2,2025-12-15,H2-302,117,40,MT2013(40),0.3418803418803419
15/12/2025_07g00_2,2025-12-15,H2-304,93,40,MT2013(40),0.43010752688172044
15/12/2025_07g00_2,2025-12-15,H6-514,108,40,MT2013(40),0.37037037037037035
15/12/2025_07g00_2,2025-12-15,H2-306,156,40,MT2013(40),0.2564102564102564
15/12/2025_07g00_2,2025-12-15,H2-307,117,40,MT2013(40),0.3418803418803419
15/12/2025_07g00_2,2025-12-15,H2-403,93,40,MT2013(40),0.43010752688172044
15/12/2025_07g00_2,2025-12-15,H2-404,93,40,MT2013(40),0.43010752688172044
15/12/2025_07g00_2,2025-12-15,H2-407,84,40,MT2013(40),0.47619047619047616
15/12/2025_07g00_2,2025-12-15,H3-107,106,40,MT2013(40),0.37735849056603776
15/12/2025_07g00_2,2025-12-15,H3-201,142,40,MT2013(40),0.28169014084507044
15/12/2025_07g00_2,2025-12-15,H3-205,106,40,MT2013(40),0.37735849056603776
15/12/2025_07g00_2,2025-12-15,H3-303,88,40,MT2013(40),0.45454545454545453
15/12/2025_07g00_2,2025-12-15,H3-304,88,40,MT2013(40),0.45454545454545453
15/12/2025_07g00_2,2025-12-15,H3-306,142,40,MT2013(40),0.28169014084507044
15/12/2025_07g00_2,2025-12-15,H3-401,142,40,MT2013(40),0.28169014084507044
15/12/2025_07g00_2,2025-12-15,H3-403,88,40,MT2013(40),0.45454545454545453
15/12/2025_07g00_2,2025-12-15,H3-404,88,40,MT2013(40),0.45454545454545453
15/12/2025_07g00_2,2025-12-15,H6-516,114,40,MT2013(40),0.3508771929824561
15/12/2025_07g00_2,2025-12-15,H6-415,80,39,MT2013(39),0.4875
15/12/2025_07g00_2,2025-12-15,H6-413,80,39,MT2013(39),0.4875
15/12/2025_07g00_2,2025-12-15,H6-414,80,39,MT2013(39),0.4875
15/12/2025_07g00_2,2025-12-15,H2-202,117,39,MT2013(39),0.3333333333333333
15/12/2025_07g00_2,2025-12-15,H6-411,80,39,MT2013(39),0.4875
15/12/2025_07g00_2,2025-12-15,H1-101,138,39,MT2013(39),0.2826086956521739
15/12/2025_07g00_2,2025-12-15,H1-102,93,39,MT2013(39),0.41935483870967744
15/12/2025_07g00_2,2025-12-15,H6-205,117,39,MT2013(39),0.3333333333333333
15/12/2025_07g00_2,2025-12-15,H2-206,156,39,MT2013(39),0.25
15/12/2025_07g00_2,2025-12-15,H6-113,129,39,MT2013(39),0.3023255813953488
15/12/2025_07g00_2,2025-12-15,H6-210,80,38,MT2013(38),0.475
15/12/2025_07g00_2,2025-12-15,H1-103,90,38,MT2013(38),0.4222222222222222
15/12/2025_07g00_2,2025-12-15,H2-305,63,21,MT2013(21),0.3333333333333333
15/12/2025_09g30_1,2025-12-15,B1-306,84,79,"EE2405(40), IM1029(30), MA3153(9)",0.9404761904761905
15/12/2025_09g30_1,2025-12-15,B1-305,72,66,"EE2405(36), IM1029(30)",0.9166666666666666
15/12/2025_09g30_1,2025-12-15,B1-308,72,67,"EE2405(30), IM1029(30), MA4185(7)",0.9305555555555556
15/12/2025_09g30_1,2025-12-15,B1-309,56,53,"EE2405(30), MA3145(23)",0.9464285714285714
15/12/2025_09g30_1,2025-12-15,B1-313,56,48,"EE2405(30), MA2035(18)",0.8571428571428571
15/12/2025_09g30_1,2025-12-15,B1-314,56,47,"EE2405(30), AS3055(17)",0.8392857142857143
15/12/2025_09g30_1,2025-12-15,B1-315,56,45,"EE2405(30), CH3399(15)",0.8035714285714286
15/12/2025_09g30_1,2025-12-15,B4-302,60,58,"IM1029(30), TR4073(28)",0.9666666666666667
15/12/2025_09g30_1,2025-12-15,B4-402,60,27,IM3101(27),0.45
15/12/2025_09g30_2,2025-12-15,H6-113,129,129,"IM4035(51), GE3017(45), IM1029(20), CI3245(13)",1.0
15/12/2025_09g30_2,2025-12-15,H6-210,80,79,"IM1029(40), IU3017(13), MA3031(13), CH3399(8), CI2043(3), EN3025(2)",0.9875
15/12/2025_09g30_2,2025-12-15,H6-211,126,40,IM1029(40),0.31746031746031744
15/12/2025_09g30_2,2025-12-15,H6-212,80,40,IM1029(40),0.5
15/12/2025_09g30_2,2025-12-15,H6-213,80,39,IM1029(39),0.4875
15/12/2025_13g00_1,2025-12-15,B4-305,80,79,"CH2035(34), CI4161(30), IM1021(15)",0.9875
15/12/2025_13g00_1,2025-12-15,B4-306,80,67,"IM1021(30), CH3347(20), ME4137(17)",0.8375
15/12/2025_13g00_1,2025-12-15,B4-401,60,30,IM1021(30),0.5
15/12/2025_13g00_1,2025-12-15,B4-402,60,30,IM1021(30),0.5
15/12/2025_13g00_1,2025-12-15,B4-302,60,22,IM1021(22),0.36666666666666664
15/12/2025_13g00_1,2025-12-15,B4-405,60,19,IM1021(19),0.31666666666666665
15/12/2025_13g00_2,2025-12-15,H6-311,135,124,"CI3243(43), IM1021(41), CH3347(40)",0.9185185185185185
15/12/2025_13g00_2,2025-12-15,H6-211,126,121,"IM1021(41), CI3243(40), IM1017(40)",0.9603174603174603
15/12/2025_13g00_2,2025-12-15,H6-208,117,112,"IM1021(41), CH2035(40), ME4137(31)",0.9572649572649573
15/12/2025_13g00_2,2025-12-15,H6-205,117,111,"IM1021(41), CH3347(29), IM1017(25), CH2035(16)",0.9487179487179487
15/12/2025_13g00_2,2025-12-15,H6-201,120,54,"IM1021(41), TR2033(13)",0.45
15/12/2025_13g00_2,2025-12-15,H6-109,80,40,IM1021(40),0.5
15/12/2025_13g00_2,2025-12-15,H6-110,80,40,IM1021(40),0.5
15/12/2025_13g00_2,2025-12-15,H6-112,80,40,IM1021(40),0.5
15/12/2025_13g00_2,2025-12-15,H6-210,80,40,IM1021(40),0.5
15/12/2025_13g00_2,2025-12-15,H6-212,80,40,IM1021(40),0.5
15/12/2025_13g00_2,2025-12-15,H6-305,129,40,IM1021(40),0.31007751937984496
15/12/2025_13g00_2,2025-12-15,H6-206,80,39,IM1021(39),0.4875
15/12/2025_13g00_2,2025-12-15,H6-213,80,39,IM1021(39),0.4875
15/12/2025_13g00_2,2025-12-15,H6-214,80,39,IM1021(39),0.4875
15/12/2025_15g30_1,2025-12-15,B4-303,60,30,CO3011(30),0.5
15/12/2025_15g30_1,2025-12-15,B4-302,60,24,CO3011(24),0.4
15/12/2025_15g30_2,2025-12-15,H6-109,80,40,CO3011(40),0.5
15/12/2025_15g30_2,2025-12-15,H6-110,80,40,CO3011(40),0.5
15/12/2025_15g30_2,2025-12-15,H6-112,80,39,CO3011(39),0.4875
16/12/2025_07g00_1,2025-12-16,B4-505,120,120,"ME2113(47), CO3007(45), MT2007(28)",1.0
16/12/2025_07g00_1,2025-12-16,B4-306,80,70,"MT2007(40), ME2113(30)",0.875
16/12/2025_07g00_1,2025-12-16,B4-301,60,52,"MT2007(30), CI2135(22)",0.8666666666666667
16/12/2025_07g00_1,2025-12-16,B4-302,60,59,"MT2007(30), TR5005(18), EE5013(11)",0.9833333333333333
16/12/2025_07g00_1,2025-12-16,B4-303,60,57,"MT2007(30), ME5003(14), CO3007(13)",0.95
16/12/2025_07g00_1,2025-12-16,B4-305,80,30,MT2007(30),0.375
16/12/2025_07g00_1,2025-12-16,B4-402,60,21,MT2007(21),0.35
16/12/2025_07g00_2,2025-12-16,H6-211,126,89,"CO3007(49), TR4051(20), MA4119(12), GE1021(8)",0.7063492063492064
16/12/2025_07g00_2,2025-12-16,H6-208,117,44,CO3007(44),0.37606837606837606
16/12/2025_07g00_2,2025-12-16,H6-201,120,40,CO3007(40),0.3333333333333333
16/12/2025_07g00_2,2025-12-16,H6-205,117,40,CO3007(40),0.3418803418803419
16/12/2025_07g00_2,2025-12-16,H6-206,80,39,CO3007(39),0.4875
16/12/2025_09g30_1,2025-12-16,B4-406,108,93,"LA2017(41), MT1005(32), CO3059(20)",0.8611111111111112
16/12/2025_09g30_1,2025-12-16,B4-405,60,60,"LA2017(30), MT1005(30)",1.0
16/12/2025_09g30_1,2025-12-16,B4-302,60,55,"MT1005(29), LA2017(26)",0.9166666666666666
16/12/2025_09g30_1,2025-12-16,B4-303,60,29,MT1005(29),0.48333333333333334
16/12/2025_09g30_1,2025-12-16,B4-301,60,19,MT1005(19),0.31666666666666665
16/12/2025_09g30_2,2025-12-16,H6-205,117,112,"MT1005(42), CO3059(40), CH4139(30)",0.9572649572649573
16/12/2025_09g30_2,2025-12-16,H6-113,129,89,"MT1005(41), EE3121(27), CO3059(21)",0.689922480620155
16/12/2025_09g30_2,2025-12-16,H6-112,80,40,MT1005(40),0.5
16/12/2025_09g30_2,2025-12-16,H6-210,80,40,MT1005(40),0.5
16/12/2025_09g30_2,2025-12-16,H6-208,117,40,MT1005(40),0.3418803418803419
16/12/2025_09g30_2,2025-12-16,H6-201,120,40,MT1005(40),0.3333333333333333
16/12/2025_09g30_2,2025-12-16,H6-109,80,40,MT1005(40),0.5
16/12/2025_09g30_2,2025-12-16,H6-305,129,40,MT1005(40),0.31007751937984496
16/12/2025_09g30_2,2025-12-16,H6-110,80,39,MT1005(39),0.4875
16/12/2025_09g30_2,2025-12-16,H6-206,80,39,MT1005(39),0.4875
16/12/2025_09g30_2,2025-12-16,H6-211,126,39,MT1005(39),0.30952380952380953
16/12/2025_09g30_2,2025-12-16,H6-214,80,39,MT1005(39),0.4875
16/12/2025_09g30_2,2025-12-16,H6-212,80,38,MT1005(38),0.475
16/12/2025_09g30_2,2025-12-16,H6-213,80,38,MT1005(38),0.475
16/12/2025_13g00_1,2025-12-16,B4-406,108,88,"SP1033(44), CO3017(44)",0.8148148148148148
16/12/2025_13g00_1,2025-12-16,B4-305,80,69,"SP1033(41), CO3017(28)",0.8625
16/12/2025_13g00_1,2025-12-16,B4-501,80,38,SP1033(38),0.475
16/12/2025_13g00_1,2025-12-16,B4-502,80,34,SP1033(34),0.425
16/12/2025_13g00_1,2025-12-16,B4-306,80,30,SP1033(30),0.375
16/12/2025_13g00_1,2025-12-16,B4-405,60,30,SP1033(30),0.5
16/12/2025_13g00_1,2025-12-16,B4-301,60,30,SP1033(30),0.5
16/12/2025_13g00_1,2025-12-16,B4-302,60,30,SP1033(30),0.5
16/12/2025_13g00_1,2025-12-16,B4-303,60,30,SP1033(30),0.5
16/12/2025_13g00_1,2025-12-16,B4-401,60,30,SP1033(30),0.5
16/12/2025_13g00_1,2025-12-16,B4-402,60,30,SP1033(30),0.5
16/12/2025_13g00_1,2025-12-16,B4-504,60,29,SP1033(29),0.48333333333333334
16/12/2025_13g00_1,2025-12-16,B4-403,60,29,SP1033(29),0.48333333333333334
16/12/2025_13g00_1,2025-12-16,B1-311,80,28,SP1033(28),0.35
16/12/2025_13g00_1,2025-12-16,B1-308,72,21,SP1033(21),0.2916666666666667
16/12/2025_13g00_1,2025-12-16,B1-309,56,20,SP1033(20),0.35714285714285715
16/12/2025_13g00_2,2025-12-16,H2-202,117,112,"CI2145(47), SP1033(44), ME4533(21)",0.9572649572649573
16/12/2025_13g00_2,2025-12-16,H6-205,117,100,"SP1033(40), CI2145(40), EE3085(20)",0.8547008547008547
16/12/2025_13g00_2,2025-12-16,H6-514,108,80,"SP1033(40), CO3017(40)",0.7407407407407407
16/12/2025_13g00_2,2025-12-16,H6-512,105,80,"SP1033(40), CO3017(40)",0.7619047619047619
16/12/2025_13g00_2,2025-12-16,H6-510,102,80,"SP1033(40), EE3085(40)",0.7843137254901961
16/12/2025_13g00_2,2025-12-16,H6-506,105,80,"SP1033(40), ME4533(40)",0.7619047619047619
16/12/2025_13g00_2,2025-12-16,H6-504,106,79,"SP1033(40), CO3017(39)",0.7452830188679245
16/12/2025_13g00_2,2025-12-16,H6-412,123,40,SP1033(40),0.3252032520325203
16/12/2025_13g00_2,2025-12-16,H6-405,120,40,SP1033(40),0.3333333333333333
16/12/2025_13g00_2,2025-12-16,H6-311,135,40,SP1033(40),0.2962962962962963
16/12/2025_13g00_2,2025-12-16,H6-210,80,40,SP1033(40),0.5
16/12/2025_13g00_2,2025-12-16,H6-206,80,40,SP1033(40),0.5
16/12/2025_13g00_2,2025-12-16,H6-516,114,40,SP1033(40),0.3508771929824561
16/12/2025_13g00_2,2025-12-16,H6-201,120,40,SP1033(40),0.3333333333333333
16/12/2025_13g00_2,2025-12-16,H6-113,129,40,SP1033(40),0.31007751937984496
16/12/2025_13g00_2,2025-12-16,H6-109,80,40,SP1033(40),0.5
16/12/2025_13g00_2,2025-12-16,H6-208,117,39,SP1033(39),0.3333333333333333
16/12/2025_13g00_2,2025-12-16,H6-415,80,39,SP1033(39),0.4875
16/12/2025_13g00_2,2025-12-16,H6-212,80,39,SP1033(39),0.4875
16/12/2025_13g00_2,2025-12-16,H6-313,80,39,SP1033(39),0.4875
16/12/2025_13g00_2,2025-12-16,H6-312,80,39,SP1033(39),0.4875
16/12/2025_13g00_2,2025-12-16,H6-310,80,39,SP1033(39),0.4875
16/12/2025_13g00_2,2025-12-16,H6-110,80,39,SP1033(39),0.4875
16/12/2025_13g00_2,2025-12-16,H6-305,129,39,SP1033(39),0.3023255813953488
16/12/2025_13g00_2,2025-12-16,H6-112,80,39,SP1033(39),0.4875
16/12/2025_13g00_2,2025-12-16,H6-411,80,37,SP1033(37),0.4625
16/12/2025_13g00_2,2025-12-16,H6-413,80,36,SP1033(36),0.45
16/12/2025_15g30_1,2025-12-16,B4-406,108,93,"ME4217(45), TR4085(42), EE3009(6)",0.8611111111111112
16/12/2025_15g30_1,2025-12-16,B4-405,60,56,"ME4217(30), CH3015(26)",0.9333333333333333
16/12/2025_15g30_1,2025-12-16,B4-403,60,50,"ME4217(28), CH3015(22)",0.8333333333333334
16/12/2025_15g30_2,2025-12-16,H6-308,144,123,"EE3009(43), ME4217(40), TR4085(40)",0.8541666666666666
16/12/2025_15g30_2,2025-12-16,H6-208,117,107,"ME4217(40), TR4085(40), EE3007(27)",0.9145299145299145
16/12/2025_15g30_2,2025-12-16,H6-113,129,127,"TR4085(40), EE3009(38), CH3015(26), ME4217(23)",0.9844961240310077
16/12/2025_15g30_2,2025-12-16,H6-112,80,63,"TR4085(38), CH3015(25)",0.7875
16/12/2025_15g30_2,2025-12-16,H6-512,105,25,CH3015(25),0.23809523809523808
16/12/2025_15g30_2,2025-12-16,H6-514,108,25,CH3015(25),0.23148148148148148
16/12/2025_15g30_2,2025-12-16,H6-506,105,24,CH3015(24),0.22857142857142856
17/12/2025_07g00_1,2025-12-17,B1-208,84,83,"SP1007(43), CO3037(40)",0.9880952380952381
17/12/2025_07g00_1,2025-12-17,B1-306,84,83,"SP1007(42), EE3091(36), MA4189(5)",0.9880952380952381
17/12/2025_07g00_1,2025-12-17,B4-306,80,71,"EE3091(36), PH2005(35)",0.8875
17/12/2025_07g00_1,2025-12-17,B1-311,80,79,"SP1007(33), PH2005(31), IM4019(15)",0.9875
17/12/2025_07g00_1,2025-12-17,B1-213,72,72,"SP1007(31), TR4081(30), MA4141(11)",1.0
17/12/2025_07g00_1,2025-12-17,B1-212,72,61,"SP1007(31), TR4089(30)",0.8472222222222222
17/12/2025_07g00_1,2025-12-17,B1-313,56,55,"SP1007(30), TR4047(25)",0.9821428571428571
17/12/2025_07g00_1,2025-12-17,B1-308,72,60,"SP1007(30), CO3037(30)",0.8333333333333334
17/12/2025_07g00_1,2025-12-17,B1-314,56,52,"SP1007(30), PH2005(22)",0.9285714285714286
17/12/2025_07g00_1,2025-12-17,B1-305,72,60,"SP1007(30), PH2005(30)",0.8333333333333334
17/12/2025_07g00_1,2025-12-17,B1-303,56,51,"SP1007(30), MA2015(21)",0.9107142857142857
17/12/2025_07g00_1,2025-12-17,B1-315,56,48,"SP1007(30), EE4451(18)",0.8571428571428571
17/12/2025_07g00_1,2025-12-17,B1-302,56,45,"SP1007(30), EE3043(15)",0.8035714285714286
17/12/2025_07g00_1,2025-12-17,B1-301,56,45,"SP1007(30), TR4089(15)",0.8035714285714286
17/12/2025_07g00_1,2025-12-17,B1-309,56,44,"SP1007(30), EN3209(14)",0.7857142857142857
17/12/2025_07g00_1,2025-12-17,B6-304,60,60,"PH2005(30), EE3069(30)",1.0
17/12/2025_07g00_1,2025-12-17,B6-303,60,59,"PH2005(30), EE3091(29)",0.9833333333333333
17/12/2025_07g00_1,2025-12-17,B1-203,60,40,"SP1007(26), ME5005(14)",0.6666666666666666
17/12/2025_07g00_2,2025-12-17,H3-301,142,140,"EE3069(55), SP1007(49), IU2011(36)",0.9859154929577465
17/12/2025_07g00_2,2025-12-17,H6-412,123,121,"SP1007(49), TR4089(46), CI3067(26)",0.983739837398374
17/12/2025_07g00_2,2025-12-17,H6-305,129,129,"SP1007(48), EN3209(42), TR4089(39)",1.0
17/12/2025_07g00_2,2025-12-17,H6-311,135,129,"SP1007(48), CI3241(41), TR3017(40)",0.9555555555555556
17/12/2025_07g00_2,2025-12-17,H6-212,80,80,"SP1007(40), CI3241(40)",1.0
17/12/2025_07g00_2,2025-12-17,H6-413,80,80,"SP1007(40), TR4089(40)",1.0
17/12/2025_07g00_2,2025-12-17,H6-214,80,80,"SP1007(40), TR4089(40)",1.0
17/12/2025_07g00_2,2025-12-17,H6-306,80,80,"SP1007(40), CI3241(40)",1.0
17/12/2025_07g00_2,2025-12-17,H6-312,80,80,"SP1007(40), CH3321(40)",1.0
17/12/2025_07g00_2,2025-12-17,H6-313,80,80,"SP1007(40), EE3043(40)",1.0
17/12/2025_07g00_2,2025-12-17,H6-405,120,120,"SP1007(40), EE3043(35), ME3171(33), CH3429(12)",1.0
17/12/2025_07g00_2,2025-12-17,H6-411,80,79,"SP1007(40), MA4087(29), MA3011(10)",0.9875
17/12/2025_07g00_2,2025-12-17,H6-510,102,97,"SP1007(40), MA2015(22), IM4019(18), TR3017(17)",0.9509803921568627
17/12/2025_07g00_2,2025-12-17,H6-504,106,40,SP1007(40),0.37735849056603776
17/12/2025_07g00_2,2025-12-17,H6-506,105,40,SP1007(40),0.38095238095238093
17/12/2025_07g00_2,2025-12-17,H6-512,105,40,SP1007(40),0.38095238095238093
17/12/2025_07g00_2,2025-12-17,H6-514,108,40,SP1007(40),0.37037037037037035
17/12/2025_07g00_2,2025-12-17,H6-516,114,40,SP1007(40),0.3508771929824561
17/12/2025_07g00_2,2025-12-17,H6-802,120,40,SP1007(40),0.3333333333333333
17/12/2025_07g00_2,2025-12-17,H6-810,120,40,SP1007(40),0.3333333333333333
17/12/2025_07g00_2,2025-12-17,H6-811,150,40,SP1007(40),0.26666666666666666
17/12/2025_07g00_2,2025-12-17,H6-213,80,40,SP1007(40),0.5
17/12/2025_07g00_2,2025-12-17,H6-211,126,40,SP1007(40),0.31746031746031744
17/12/2025_07g00_2,2025-12-17,H6-208,117,40,SP1007(40),0.3418803418803419
17/12/2025_07g00_2,2025-12-17,H6-206,80,40,SP1007(40),0.5
17/12/2025_07g00_2,2025-12-17,H6-205,117,40,SP1007(40),0.3418803418803419
17/12/2025_07g00_2,2025-12-17,H6-201,120,40,SP1007(40),0.3333333333333333
17/12/2025_07g00_2,2025-12-17,H6-113,129,40,SP1007(40),0.31007751937984496
17/12/2025_07g00_2,2025-12-17,H6-112,80,40,SP1007(40),0.5
17/12/2025_07g00_2,2025-12-17,H6-110,80,40,SP1007(40),0.5
17/12/2025_07g00_2,2025-12-17,H6-109,80,40,SP1007(40),0.5
17/12/2025_07g00_2,2025-12-17,H1-102,93,40,SP1007(40),0.43010752688172044
17/12/2025_07g00_2,2025-12-17,H6-210,80,40,SP1007(40),0.5
17/12/2025_07g00_2,2025-12-17,H1-101,138,39,SP1007(39),0.2826086956521739
17/12/2025_07g00_2,2025-12-17,H6-415,80,39,SP1007(39),0.4875
17/12/2025_07g00_2,2025-12-17,H6-414,80,39,SP1007(39),0.4875
17/12/2025_07g00_2,2025-12-17,H1-103,90,39,SP1007(39),0.43333333333333335
17/12/2025_07g00_2,2025-12-17,H1-104,138,39,SP1007(39),0.2826086956521739
17/12/2025_07g00_2,2025-12-17,H6-310,80,39,SP1007(39),0.4875
17/12/2025_13g00_1,2025-12-17,B1-208,84,82,"CO2003(44), EE2417(38)",0.9761904761904762
17/12/2025_13g00_1,2025-12-17,B4-406,108,108,"CH2013(42), CO2003(39), EE2417(27)",1.0
17/12/2025_13g00_1,2025-12-17,C6-401,80,75,"ME2123(38), CI2095(37)",0.9375
17/12/2025_13g00_1,2025-12-17,B4-502,80,72,"EE2417(36), CO3027(36)",0.9
17/12/2025_13g00_1,2025-12-17,B4-505,120,101,"CO1003(35), CH2013(35), CI2095(31)",0.8416666666666667
17/12/2025_13g00_1,2025-12-17,B4-306,80,64,"CH2013(34), CO1003(30)",0.8
17/12/2025_13g00_1,2025-12-17,B1-313,56,56,"CO2003(30), CI2095(26)",1.0
17/12/2025_13g00_1,2025-12-17,B6-302,60,60,"EE2417(30), CH2013(30)",1.0
17/12/2025_13g00_1,2025-12-17,B4-402,60,60,"CH2013(30), EE2417(30)",1.0
17/12/2025_13g00_1,2025-12-17,B4-401,60,60,"CH2013(30), CO2003(30)",1.0
17/12/2025_13g00_1,2025-12-17,B1-311,80,71,"CO2003(30), IM3087(30), CH2013(11)",0.8875
17/12/2025_13g00_1,2025-12-17,B1-309,56,54,"CO2003(30), CO1003(24)",0.9642857142857143
17/12/2025_13g00_1,2025-12-17,B1-308,72,60,"CO2003(30), ME2123(30)",0.8333333333333334
17/12/2025_13g00_1,2025-12-17,B4-301,60,60,"CO1003(30), EE2417(30)",1.0
17/12/2025_13g00_1,2025-12-17,B1-213,72,60,"CO2003(30), EE2417(30)",0.8333333333333334
17/12/2025_13g00_1,2025-12-17,B4-302,60,60,"CO1003(30), CO2003(30)",1.0
17/12/2025_13g00_1,2025-12-17,C6-403,80,79,"TR3143(29), CH2013(29), ME3011(21)",0.9875
17/12/2025_13g00_1,2025-12-17,B4-501,80,80,"CO1003(29), IM3087(27), CO2003(24)",1.0
17/12/2025_13g00_1,2025-12-17,B1-210,48,48,"CO2003(24), CI1003(24)",1.0
17/12/2025_13g00_1,2025-12-17,B1-206,48,24,CO2003(24),0.5
17/12/2025_13g00_2,2025-12-17,H6-810,120,112,"ME3011(53), EE1007(48), CI1003(11)",0.9333333333333333
17/12/2025_13g00_2,2025-12-17,H6-113,129,129,"CI2095(47), CO2003(44), TR3143(38)",1.0
17/12/2025_13g00_2,2025-12-17,H6-516,114,114,"IM3087(43), CO2003(42), EE3075(29)",1.0
17/12/2025_13g00_2,2025-12-17,H6-311,135,123,"CO2003(42), CO3027(41), CH2013(40)",0.9111111111111111
17/12/2025_13g00_2,2025-12-17,H6-412,123,122,"CO2003(42), CO3027(40), CH2013(40)",0.991869918699187
17/12/2025_13g00_2,2025-12-17,H6-405,120,120,"CO2003(41), CO3027(40), CH2013(39)",1.0
17/12/2025_13g00_2,2025-12-17,H6-312,80,80,"CO2003(40), EE3075(40)",1.0
17/12/2025_13g00_2,2025-12-17,H6-414,80,80,"CO2003(40), EE3167(40)",1.0
17/12/2025_13g00_2,2025-12-17,H6-415,80,80,"CO2003(40), IM3087(40)",1.0
17/12/2025_13g00_2,2025-12-17,H6-310,80,80,"CO2003(40), IM3087(40)",1.0
17/12/2025_13g00_2,2025-12-17,H6-514,108,105,"IM3087(40), ME2123(40), TR3143(25)",0.9722222222222222
17/12/2025_13g00_2,2025-12-17,H3-506,142,141,"ME2123(40), CH2013(40), TR3143(40), EE3167(21)",0.9929577464788732
17/12/2025_13g00_2,2025-12-17,H6-214,80,80,"CO2003(40), CO1003(40)",1.0
17/12/2025_13g00_2,2025-12-17,H6-110,80,80,"CI2095(40), CO1003(40)",1.0
17/12/2025_13g00_2,2025-12-17,H6-201,120,119,"CI2095(40), CO1003(40), EE1007(39)",0.9916666666666667
17/12/2025_13g00_2,2025-12-17,H6-205,117,117,"CI2095(40), CO1003(40), TR3143(37)",1.0
17/12/2025_13g00_2,2025-12-17,H6-208,117,117,"CI2095(40), CO1003(40), ME2123(37)",1.0
17/12/2025_13g00_2,2025-12-17,H6-211,126,119,"CI2095(40), CO1003(40), ME2123(39)",0.9444444444444444
17/12/2025_13g00_2,2025-12-17,H3-303,88,79,"CO1003(40), CI2095(39)",0.8977272727272727
17/12/2025_13g00_2,2025-12-17,H2-301,156,155,"TR3143(39), CI2095(39), CO1003(39), IM3087(38)",0.9935897435897436
17/12/2025_13g00_2,2025-12-17,H6-206,80,78,"CI2095(39), CO1003(39)",0.975
17/12/2025_13g00_2,2025-12-17,H6-112,80,74,"CI2095(39), CI1003(35)",0.925
17/12/2025_13g00_2,2025-12-17,H6-213,80,72,"CI2095(37), CI1003(35)",0.9
17/12/2025_13g00_2,2025-12-17,H2-407,84,62,"CH2013(34), IM3087(28)",0.7380952380952381
17/12/2025_13g00_2,2025-12-17,H2-402,63,30,CH2013(30),0.47619047619047616
17/12/2025_15g30_1,2025-12-17,B4-305,80,35,CH2045(35),0.4375
17/12/2025_15g30_2,2025-12-17,H6-113,129,48,CH2045(48),0.37209302325581395
18/12/2025_07g00_1,2025-12-18,B4-505,120,115,"SP1039(44), ME1021(29), MA5023(22), CI4193(16), LA1027(4)",0.9583333333333334
18/12/2025_07g00_1,2025-12-18,B4-406,108,51,"SP1039(37), EE5015(14)",0.4722222222222222
18/12/2025_07g00_1,2025-12-18,B4-305,80,34,SP1039(34),0.425
18/12/2025_07g00_1,2025-12-18,B4-306,80,33,SP1039(33),0.4125
18/12/2025_07g00_1,2025-12-18,B4-502,80,30,SP1039(30),0.375
18/12/2025_07g00_1,2025-12-18,B4-501,80,30,SP1039(30),0.375
18/12/2025_07g00_1,2025-12-18,B4-301,60,30,SP1039(30),0.5
18/12/2025_07g00_1,2025-12-18,B4-302,60,30,SP1039(30),0.5
18/12/2025_07g00_1,2025-12-18,B4-303,60,30,SP1039(30),0.5
18/12/2025_07g00_1,2025-12-18,B4-405,60,30,SP1039(30),0.5
18/12/2025_07g00_1,2025-12-18,B4-401,60,30,SP1039(30),0.5
18/12/2025_07g00_1,2025-12-18,B4-402,60,30,SP1039(30),0.5
18/12/2025_07g00_1,2025-12-18,B4-403,60,29,SP1039(29),0.48333333333333334
18/12/2025_07g00_1,2025-12-18,B4-504,60,29,SP1039(29),0.48333333333333334
18/12/2025_07g00_1,2025-12-18,B1-210,48,20,SP1039(20),0.4166666666666667
18/12/2025_07g00_1,2025-12-18,B1-214,48,18,SP1039(18),0.375
18/12/2025_07g00_1,2025-12-18,B1-215,48,16,SP1039(16),0.3333333333333333
18/12/2025_07g00_2,2025-12-18,H6-802,120,115,"SP1039(48), ME2059(45), ME4083(22)",0.9583333333333334
18/12/2025_07g00_2,2025-12-18,H2-301,156,153,"CI2159(43), SP1039(40), GE1027(40), IU4021(30)",0.9807692307692307
18/12/2025_07g00_2,2025-12-18,H2-302,117,101,"CI2159(40), SP1039(40), IM3035(21)",0.8632478632478633
18/12/2025_07g00_2,2025-12-18,H6-305,129,120,"SP1039(40), GE1027(40), IM3035(40)",0.9302325581395349
18/12/2025_07g00_2,2025-12-18,H6-306,80,61,"SP1039(40), GE1027(21)",0.7625
18/12/2025_07g00_2,2025-12-18,H6-308,144,40,SP1039(40),0.2777777777777778
18/12/2025_07g00_2,2025-12-18,H6-311,135,40,SP1039(40),0.2962962962962963
18/12/2025_07g00_2,2025-12-18,H6-412,123,40,SP1039(40),0.3252032520325203
18/12/2025_07g00_2,2025-12-18,H6-211,126,40,SP1039(40),0.31746031746031744
18/12/2025_07g00_2,2025-12-18,H6-504,106,40,SP1039(40),0.37735849056603776
18/12/2025_07g00_2,2025-12-18,H6-512,105,40,SP1039(40),0.38095238095238093
18/12/2025_07g00_2,2025-12-18,H6-514,108,40,SP1039(40),0.37037037037037035
18/12/2025_07g00_2,2025-12-18,H6-516,114,40,SP1039(40),0.3508771929824561
18/12/2025_07g00_2,2025-12-18,H6-810,120,40,SP1039(40),0.3333333333333333
18/12/2025_07g00_2,2025-12-18,H6-212,80,40,SP1039(40),0.5
18/12/2025_07g00_2,2025-12-18,H6-213,80,40,SP1039(40),0.5
18/12/2025_07g00_2,2025-12-18,H6-811,150,40,SP1039(40),0.26666666666666666
18/12/2025_07g00_2,2025-12-18,H6-206,80,40,SP1039(40),0.5
18/12/2025_07g00_2,2025-12-18,H6-205,117,40,SP1039(40),0.3418803418803419
18/12/2025_07g00_2,2025-12-18,H6-201,120,40,SP1039(40),0.3333333333333333
18/12/2025_07g00_2,2025-12-18,H6-113,129,40,SP1039(40),0.31007751937984496
18/12/2025_07g00_2,2025-12-18,H6-112,80,40,SP1039(40),0.5
18/12/2025_07g00_2,2025-12-18,H6-110,80,40,SP1039(40),0.5
18/12/2025_07g00_2,2025-12-18,H6-109,80,40,SP1039(40),0.5
18/12/2025_07g00_2,2025-12-18,H6-208,117,40,SP1039(40),0.3418803418803419
18/12/2025_07g00_2,2025-12-18,H6-506,105,39,SP1039(39),0.37142857142857144
18/12/2025_07g00_2,2025-12-18,H6-510,102,39,SP1039(39),0.38235294117647056
18/12/2025_07g00_2,2025-12-18,H6-210,80,39,SP1039(39),0.4875
18/12/2025_07g00_2,2025-12-18,H6-313,80,39,SP1039(39),0.4875
18/12/2025_07g00_2,2025-12-18,H6-312,80,39,SP1039(39),0.4875
18/12/2025_07g00_2,2025-12-18,H6-310,80,39,SP1039(39),0.4875
18/12/2025_07g00_2,2025-12-18,H6-411,80,38,SP1039(38),0.475
18/12/2025_07g00_2,2025-12-18,H6-413,80,36,SP1039(36),0.45
18/12/2025_09g30_1,2025-12-18,B4-406,108,39,"IM1033(38), LA3019(1)",0.3611111111111111
18/12/2025_09g30_1,2025-12-18,B4-402,60,30,IM1033(30),0.5
18/12/2025_09g30_1,2025-12-18,B4-403,60,30,IM1033(30),0.5
18/12/2025_09g30_1,2025-12-18,B4-405,60,30,IM1033(30),0.5
18/12/2025_09g30_2,2025-12-18,H6-205,117,85,"IM1033(45), PH1005(40)",0.7264957264957265
18/12/2025_09g30_2,2025-12-18,H6-208,117,80,"IM1033(44), PH1005(36)",0.6837606837606838
18/12/2025_09g30_2,2025-12-18,H6-206,80,59,"IM1033(40), PH1005(19)",0.7375
18/12/2025_09g30_2,2025-12-18,H6-210,80,40,IM1033(40),0.5
18/12/2025_13g00_1,2025-12-18,B4-406,108,108,"EE2033(44), CO2007(43), ME3009(21)",1.0
18/12/2025_13g00_1,2025-12-18,B4-505,120,115,"EE2401(43), CO2007(42), EE2033(30)",0.9583333333333334
18/12/2025_13g00_1,2025-12-18,B1-311,80,80,"CO2007(42), CI1007(38)",1.0
18/12/2025_13g00_1,2025-12-18,C6-401,80,72,"TR1003(40), CO2007(32)",0.9
18/12/2025_13g00_1,2025-12-18,B6-306,80,62,"EE2401(32), EE2033(30)",0.775
18/12/2025_13g00_1,2025-12-18,B4-405,60,60,"EE2033(30), EE2401(30)",1.0
18/12/2025_13g00_1,2025-12-18,B4-305,80,80,"EE2033(30), EE2401(30), CO3137(20)",1.0
18/12/2025_13g00_1,2025-12-18,B6-303,60,60,"EE2401(30), EE2033(30)",1.0
18/12/2025_13g00_1,2025-12-18,B6-304,60,60,"EE2401(30), ME4021(30)",1.0
18/12/2025_13g00_1,2025-12-18,B6-305,60,60,"EE2401(30), EE2033(30)",1.0
18/12/2025_13g00_1,2025-12-18,C6-402,80,79,"TR1003(30), CO2007(30), ME3009(19)",0.9875
18/12/2025_13g00_1,2025-12-18,B4-501,80,79,"CI1007(30), CO2007(30), ME4021(19)",0.9875
18/12/2025_13g00_1,2025-12-18,B1-315,56,56,"CO2007(30), EE2033(26)",1.0
18/12/2025_13g00_1,2025-12-18,B1-314,56,52,"CO2007(30), AS2059(22)",0.9285714285714286
18/12/2025_13g00_1,2025-12-18,B1-313,56,51,"CO2007(30), CH3327(21)",0.9107142857142857
18/12/2025_13g00_1,2025-12-18,B1-309,56,51,"CO2007(30), CI1007(21)",0.9107142857142857
18/12/2025_13g00_1,2025-12-18,B1-308,72,57,"CO2007(30), ME3009(27)",0.7916666666666666
18/12/2025_13g00_1,2025-12-18,B1-303,56,30,CO2007(30),0.5357142857142857
18/12/2025_13g00_1,2025-12-18,B1-302,56,30,CO2007(30),0.5357142857142857
18/12/2025_13g00_1,2025-12-18,B4-303,60,27,EE2033(27),0.45
18/12/2025_13g00_2,2025-12-18,H2-306,156,153,"TR1003(55), ME4021(45), AS2059(41), CH3327(12)",0.9807692307692307
18/12/2025_13g00_2,2025-12-18,H6-802,120,120,"CI1007(41), EE2033(40), CO2007(39)",1.0
18/12/2025_13g00_2,2025-12-18,H6-308,144,121,"CI1007(41), EE2033(40), ME3009(40)",0.8402777777777778
18/12/2025_13g00_2,2025-12-18,H6-205,117,115,"EE2033(40), ME3009(40), CI1003(35)",0.9829059829059829
18/12/2025_13g00_2,2025-12-18,H6-206,80,80,"EE2033(40), ME4021(40)",1.0
18/12/2025_13g00_2,2025-12-18,H6-208,117,115,"EE2033(40), TR1003(40), CI1003(35)",0.9829059829059829
18/12/2025_13g00_2,2025-12-18,H6-210,80,80,"EE2033(40), CI1007(40)",1.0
18/12/2025_13g00_2,2025-12-18,H6-211,126,120,"EE2033(40), CO2007(40), CI1007(40)",0.9523809523809523
18/12/2025_13g00_2,2025-12-18,H6-212,80,80,"EE2033(40), CI1007(40)",1.0
18/12/2025_13g00_2,2025-12-18,H6-214,80,80,"EE2033(40), CI1007(40)",1.0
18/12/2025_13g00_2,2025-12-18,H6-213,80,80,"EE2033(40), CI1007(40)",1.0
18/12/2025_13g00_2,2025-12-18,H6-110,80,80,"EE2033(40), CI1007(40)",1.0
18/12/2025_13g00_2,2025-12-18,H6-305,129,120,"EE2033(40), CO2007(40), TR1003(40)",0.9302325581395349
18/12/2025_13g00_2,2025-12-18,H6-306,80,80,"EE2033(40), CO2007(40)",1.0
18/12/2025_13g00_2,2025-12-18,H6-311,135,119,"EE2033(40), CO2007(40), ME4021(39)",0.8814814814814815
18/12/2025_13g00_2,2025-12-18,H6-112,80,80,"EE2033(40), CO2007(40)",1.0
18/12/2025_13g00_2,2025-12-18,H6-109,80,80,"EE2033(40), CO2007(40)",1.0
18/12/2025_13g00_2,2025-12-18,H3-401,142,142,"CO2007(40), CI1003(35), CI1007(34), EE2033(33)",1.0
18/12/2025_13g00_2,2025-12-18,H3-504,88,73,"CO2007(39), CI1007(34)",0.8295454545454546
18/12/2025_13g00_2,2025-12-18,H3-404,88,73,"CO2007(39), CI1007(34)",0.8295454545454546
18/12/2025_13g00_2,2025-12-18,H2-205,117,113,"ME4021(33), EE2033(31), CO3137(27), CI1007(22)",0.9658119658119658
18/12/2025_13g00_2,2025-12-18,H6-313,80,27,EE2033(27),0.3375
18/12/2025_15g30_1,2025-12-18,B4-303,60,59,"CO3065(30), CI4131(29)",0.9833333333333333
18/12/2025_15g30_1,2025-12-18,B4-302,60,44,"CO3065(27), CI4131(17)",0.7333333333333333
18/12/2025_15g30_2,2025-12-18,H6-112,80,75,"CO3065(40), CI1003(35)",0.9375
18/12/2025_15g30_2,2025-12-18,H6-113,129,73,"CO3065(40), CI1003(33)",0.5658914728682171
18/12/2025_15g30_2,2025-12-18,H6-110,80,39,CO3065(39),0.4875
19/12/2025_07g00_1,2025-12-19,B4-505,120,120,"ME2141(43), IM3063(36), MA5015(27), AS3169(14)",1.0
19/12/2025_07g00_1,2025-12-19,B4-303,60,58,"IM3063(31), AS2039(22), GE2059(5)",0.9666666666666667
19/12/2025_07g00_1,2025-12-19,B4-302,60,60,"IM3063(30), ME2141(30)",1.0
19/12/2025_07g00_1,2025-12-19,B4-402,60,52,"EE3015(22), CH4113(19), MA2039(11)",0.8666666666666667
19/12/2025_07g00_2,2025-12-19,H6-201,120,104,"ME2161(53), AS3169(51)",0.8666666666666667
19/12/2025_07g00_2,2025-12-19,H6-311,135,131,"EE3205(48), AS2039(42), MA4069(41)",0.9703703703703703
19/12/2025_07g00_2,2025-12-19,H6-312,80,80,"EE3205(42), EE3015(38)",1.0
19/12/2025_07g00_2,2025-12-19,H6-306,80,80,"IM3063(40), GE3105(40)",1.0
19/12/2025_07g00_2,2025-12-19,H6-212,80,80,"IM3063(40), ME2141(40)",1.0
19/12/2025_07g00_2,2025-12-19,H6-211,126,120,"IM3063(40), ME2141(40), EE3057(40)",0.9523809523809523
19/12/2025_07g00_2,2025-12-19,H6-210,80,80,"EE3015(40), CI3269(40)",1.0
19/12/2025_07g00_2,2025-12-19,H6-208,117,116,"EE3015(40), CI3269(40), ME2141(36)",0.9914529914529915
19/12/2025_07g00_2,2025-12-19,H6-205,117,115,"EE3015(40), IM3063(40), IU3061(35)",0.9829059829059829
19/12/2025_07g00_2,2025-12-19,H6-113,129,113,"EE3015(40), ME2141(39), IM3063(34)",0.875968992248062
19/12/2025_07g00_2,2025-12-19,H6-109,80,68,"EE3015(36), GE2059(32)",0.85
19/12/2025_07g00_2,2025-12-19,H6-110,80,65,"EE3015(35), IM3063(30)",0.8125
19/12/2025_07g00_2,2025-12-19,H1-101,138,132,"EN3023(30), CH4113(29), EE3015(26), TR4001(24), ME2141(23)",0.9565217391304348
19/12/2025_07g00_2,2025-12-19,H1-104,138,80,"CI3251(22), GE3105(20), EE3057(20), MA3103(18)",0.5797101449275363
19/12/2025_09g30_1,2025-12-19,B4-505,120,77,"SP1031(45), TR3137(32)",0.6416666666666667
19/12/2025_09g30_1,2025-12-19,B4-406,108,45,"SP1031(39), TR3137(6)",0.4166666666666667
19/12/2025_09g30_1,2025-12-19,B1-208,84,37,SP1031(37),0.44047619047619047
19/12/2025_09g30_1,2025-12-19,B1-306,84,32,SP1031(32),0.38095238095238093
19/12/2025_09g30_1,2025-12-19,B4-405,60,30,SP1031(30),0.5
19/12/2025_09g30_1,2025-12-19,B6-304,60,30,SP1031(30),0.5
19/12/2025_09g30_1,2025-12-19,B4-501,80,30,SP1031(30),0.375
19/12/2025_09g30_1,2025-12-19,B4-502,80,30,SP1031(30),0.375
19/12/2025_09g30_1,2025-12-19,B4-504,60,30,SP1031(30),0.5
19/12/2025_09g30_1,2025-12-19,B1-213,72,30,SP1031(30),0.4166666666666667
19/12/2025_09g30_1,2025-12-19,B6-302,60,30,SP1031(30),0.5
19/12/2025_09g30_1,2025-12-19,B6-303,60,30,SP1031(30),0.5
19/12/2025_09g30_1,2025-12-19,B6-305,60,30,SP1031(30),0.5
19/12/2025_09g30_1,2025-12-19,B1-305,72,30,SP1031(30),0.4166666666666667
19/12/2025_09g30_1,2025-12-19,B6-306,80,30,SP1031(30),0.375
19/12/2025_09g30_1,2025-12-19,B8-301,66,30,SP1031(30),0.45454545454545453
19/12/2025_09g30_1,2025-12-19,B8-303,62,30,SP1031(30),0.4838709677419355
19/12/2025_09g30_1,2025-12-19,B8-304,62,30,SP1031(30),0.4838709677419355
19/12/2025_09g30_1,2025-12-19,C6-401,80,30,SP1031(30),0.375
19/12/2025_09g30_1,2025-12-19,C6-402,80,30,SP1031(30),0.375
19/12/2025_09g30_1,2025-12-19,B1-301,56,30,SP1031(30),0.5357142857142857
19/12/2025_09g30_1,2025-12-19,B4-402,60,30,SP1031(30),0.5
19/12/2025_09g30_1,2025-12-19,B4-403,60,30,SP1031(30),0.5
19/12/2025_09g30_1,2025-12-19,B1-212,72,30,SP1031(30),0.4166666666666667
19/12/2025_09g30_1,2025-12-19,B1-308,72,30,SP1031(30),0.4166666666666667
19/12/2025_09g30_1,2025-12-19,B1-309,56,30,SP1031(30),0.5357142857142857
19/12/2025_09g30_1,2025-12-19,B1-311,80,30,SP1031(30),0.375
19/12/2025_09g30_1,2025-12-19,B1-313,56,30,SP1031(30),0.5357142857142857
19/12/2025_09g30_1,2025-12-19,B1-314,56,30,SP1031(30),0.5357142857142857
19/12/2025_09g30_1,2025-12-19,B1-315,56,30,SP1031(30),0.5357142857142857
19/12/2025_09g30_1,2025-12-19,B4-301,60,30,SP1031(30),0.5
19/12/2025_09g30_1,2025-12-19,B4-302,60,30,SP1031(30),0.5
19/12/2025_09g30_1,2025-12-19,B4-303,60,30,SP1031(30),0.5
19/12/2025_09g30_1,2025-12-19,B4-305,80,30,SP1031(30),0.375
19/12/2025_09g30_1,2025-12-19,B4-306,80,30,SP1031(30),0.375
19/12/2025_09g30_1,2025-12-19,B4-401,60,30,SP1031(30),0.5
19/12/2025_09g30_1,2025-12-19,B1-302,56,29,SP1031(29),0.5178571428571429
19/12/2025_09g30_1,2025-12-19,B1-303,56,29,SP1031(29),0.5178571428571429
19/12/2025_09g30_2,2025-12-19,H1-101,138,137,"TR3137(49), EE3099(48), SP1031(40)",0.9927536231884058
19/12/2025_09g30_2,2025-12-19,H6-210,80,40,SP1031(40),0.5
19/12/2025_09g30_2,2025-12-19,H2-205,117,40,SP1031(40),0.3418803418803419
19/12/2025_09g30_2,2025-12-19,H6-305,129,40,SP1031(40),0.31007751937984496
19/12/2025_09g30_2,2025-12-19,H6-306,80,40,SP1031(40),0.5
19/12/2025_09g30_2,2025-12-19,H6-308,144,40,SP1031(40),0.2777777777777778
19/12/2025_09g30_2,2025-12-19,H6-310,80,40,SP1031(40),0.5
19/12/2025_09g30_2,2025-12-19,H6-311,135,40,SP1031(40),0.2962962962962963
19/12/2025_09g30_2,2025-12-19,H6-312,80,40,SP1031(40),0.5
19/12/2025_09g30_2,2025-12-19,H6-313,80,40,SP1031(40),0.5
19/12/2025_09g30_2,2025-12-19,H6-405,120,40,SP1031(40),0.3333333333333333
19/12/2025_09g30_2,2025-12-19,H6-411,80,40,SP1031(40),0.5
19/12/2025_09g30_2,2025-12-19,H6-412,123,40,SP1031(40),0.3252032520325203
19/12/2025_09g30_2,2025-12-19,H6-504,106,40,SP1031(40),0.37735849056603776
19/12/2025_09g30_2,2025-12-19,H6-506,105,40,SP1031(40),0.38095238095238093
19/12/2025_09g30_2,2025-12-19,H6-510,102,40,SP1031(40),0.39215686274509803
19/12/2025_09g30_2,2025-12-19,H6-512,105,40,SP1031(40),0.38095238095238093
19/12/2025_09g30_2,2025-12-19,H6-514,108,40,SP1031(40),0.37037037037037035
19/12/2025_09g30_2,2025-12-19,H6-516,114,40,SP1031(40),0.3508771929824561
19/12/2025_09g30_2,2025-12-19,H6-211,126,40,SP1031(40),0.31746031746031744
19/12/2025_09g30_2,2025-12-19,H6-214,80,40,SP1031(40),0.5
19/12/2025_09g30_2,2025-12-19,H6-208,117,40,SP1031(40),0.3418803418803419
19/12/2025_09g30_2,2025-12-19,H2-407,84,40,SP1031(40),0.47619047619047616
19/12/2025_09g30_2,2025-12-19,H2-207,135,40,SP1031(40),0.2962962962962963
19/12/2025_09g30_2,2025-12-19,H2-302,117,40,SP1031(40),0.3418803418803419
19/12/2025_09g30_2,2025-12-19,H2-304,93,40,SP1031(40),0.43010752688172044
19/12/2025_09g30_2,2025-12-19,H2-307,117,40,SP1031(40),0.3418803418803419
19/12/2025_09g30_2,2025-12-19,H2-404,93,40,SP1031(40),0.43010752688172044
19/12/2025_09g30_2,2025-12-19,H2-406,156,40,SP1031(40),0.2564102564102564
19/12/2025_09g30_2,2025-12-19,H2-403,93,40,SP1031(40),0.43010752688172044
19/12/2025_09g30_2,2025-12-19,H6-109,80,40,SP1031(40),0.5
19/12/2025_09g30_2,2025-12-19,H6-110,80,40,SP1031(40),0.5
19/12/2025_09g30_2,2025-12-19,H6-112,80,40,SP1031(40),0.5
19/12/2025_09g30_2,2025-12-19,H6-113,129,40,SP1031(40),0.31007751937984496
19/12/2025_09g30_2,2025-12-19,H6-205,117,40,SP1031(40),0.3418803418803419
19/12/2025_09g30_2,2025-12-19,H6-206,80,40,SP1031(40),0.5
19/12/2025_09g30_2,2025-12-19,H6-213,80,40,SP1031(40),0.5
19/12/2025_09g30_2,2025-12-19,H6-413,80,39,SP1031(39),0.4875
19/12/2025_09g30_2,2025-12-19,H6-414,80,39,SP1031(39),0.4875
19/12/2025_09g30_2,2025-12-19,H6-415,80,39,SP1031(39),0.4875
19/12/2025_09g30_2,2025-12-19,H6-802,120,39,SP1031(39),0.325
19/12/2025_09g30_2,2025-12-19,H6-810,120,37,SP1031(37),0.30833333333333335
19/12/2025_09g30_2,2025-12-19,H1-106,66,35,SP1031(35),0.5303030303030303
19/12/2025_09g30_2,2025-12-19,H2-305,63,34,SP1031(34),0.5396825396825397
19/12/2025_09g30_2,2025-12-19,H2-402,63,33,SP1031(33),0.5238095238095238
19/12/2025_09g30_2,2025-12-19,H2-405,63,27,SP1031(27),0.42857142857142855
19/12/2025_13g00_1,2025-12-19,B4-505,120,120,"CO3053(46), IM2017(43), TR3145(31)",1.0
19/12/2025_13g00_1,2025-12-19,B1-311,80,78,"IM2017(40), EE2021(38)",0.975
19/12/2025_13g00_1,2025-12-19,B4-306,80,78,"CH2051(35), ME2009(34), CI2133(9)",0.975
19/12/2025_13g00_1,2025-12-19,B4-501,80,76,"ME2009(32), CH2051(32), CO3053(12)",0.95
19/12/2025_13g00_1,2025-12-19,B6-305,60,60,"EE2021(31), ME2009(29)",1.0
19/12/2025_13g00_1,2025-12-19,B4-504,60,60,"ME2009(30), IM2017(30)",1.0
19/12/2025_13g00_1,2025-12-19,B4-405,60,60,"ME2009(30), EE2021(30)",1.0
19/12/2025_13g00_1,2025-12-19,B6-303,60,60,"EE2021(30), CH2051(30)",1.0
19/12/2025_13g00_1,2025-12-19,B4-302,60,56,"CH2051(30), ME2009(26)",0.9333333333333333
19/12/2025_13g00_1,2025-12-19,B4-301,60,52,"CH2051(29), CI2133(23)",0.8666666666666667
19/12/2025_13g00_1,2025-12-19,B4-403,60,48,"CH2051(26), EE2021(22)",0.8
19/12/2025_13g00_1,2025-12-19,C6-102,100,18,CI1033(18),0.18
19/12/2025_13g00_2,2025-12-19,H3-306,142,140,"TR3145(45), CI2133(44), IM2017(40), CI1033(11)",0.9859154929577465
19/12/2025_13g00_2,2025-12-19,H1-104,138,122,"CI2133(41), TR3145(41), EE2021(40)",0.8840579710144928
19/12/2025_13g00_2,2025-12-19,H6-504,106,106,"CI2133(41), EE2021(40), ME2009(25)",1.0
19/12/2025_13g00_2,2025-12-19,H6-506,105,100,"CI2133(41), EE2021(40), TR3145(19)",0.9523809523809523
19/12/2025_13g00_2,2025-12-19,H1-101,138,138,"EE3041(40), IM2017(40), ME2009(40), CO3053(18)",1.0
19/12/2025_13g00_2,2025-12-19,H6-802,120,120,"IM2017(40), ME2009(40), EE2021(40)",1.0
19/12/2025_13g00_2,2025-12-19,H6-308,144,138,"ME2009(40), TR3145(40), EE2021(40), EE3041(18)",0.9583333333333334
19/12/2025_13g00_2,2025-12-19,H6-405,120,120,"ME2009(40), EE2021(40), CH2051(40)",1.0
19/12/2025_13g00_2,2025-12-19,H6-412,123,120,"ME2009(40), CH2051(40), CI2133(40)",0.975609756097561
19/12/2025_13g00_2,2025-12-19,H2-302,117,115,"CH2051(40), CO3053(40), CI1033(35)",0.9829059829059829
19/12/2025_13g00_2,2025-12-19,H2-207,135,119,"CH2051(40), CO3053(40), CI2133(39)",0.8814814814814815
19/12/2025_13g00_2,2025-12-19,H2-404,93,79,"CO3053(40), CI2133(39)",0.8494623655913979
19/12/2025_13g00_2,2025-12-19,H2-406,156,155,"CO3053(40), ME2009(39), TR3145(38), IM2017(38)",0.9935897435897436
19/12/2025_13g00_2,2025-12-19,H2-407,84,75,"CO3053(38), CH2051(37)",0.8928571428571429
19/12/2025_13g00_2,2025-12-19,H6-313,80,70,"ME2009(35), CI1033(35)",0.875
19/12/2025_13g00_2,2025-12-19,H6-110,80,64,"EE2021(32), ME2009(32)",0.8
19/12/2025_13g00_2,2025-12-19,H6-112,80,62,"EE2021(32), CH2051(30)",0.775
19/12/2025_13g00_2,2025-12-19,H6-212,80,59,"EE2021(31), ME2009(28)",0.7375
19/12/2025_13g00_2,2025-12-19,H6-210,80,31,EE2021(31),0.3875
19/12/2025_13g00_2,2025-12-19,H6-206,80,31,EE2021(31),0.3875
19/12/2025_13g00_2,2025-12-19,H6-213,80,20,EE2021(20),0.25
19/12/2025_15g30_1,2025-12-19,B4-403,60,32,CO3015(32),0.5333333333333333
19/12/2025_15g30_1,2025-12-19,B4-402,60,30,CO3015(30),0.5
19/12/2025_15g30_2,2025-12-19,H6-109,80,40,CO3015(40),0.5
19/12/2025_15g30_2,2025-12-19,H6-110,80,40,CO3015(40),0.5
19/12/2025_15g30_2,2025-12-19,H6-113,129,40,CO3015(40),0.31007751937984496
19/12/2025_15g30_2,2025-12-19,H6-112,80,37,CO3015(37),0.4625
20/12/2025_07g00_2,2025-12-20,H6-112,80,66,"LA1057(38), LA1041(28)",0.825
20/12/2025_09g30_1,2025-12-20,B4-303,60,19,LA1043(19),0.31666666666666665
20/12/2025_09g30_2,2025-12-20,H6-112,80,25,LA1043(25),0.3125
20/12/2025_09g30_2,2025-12-20,H6-113,129,25,LA1043(25),0.1937984496124031
22/12/2025_07g00_1,2025-12-22,B4-406,108,95,"PH1003(46), PH1011(38), CI2139(11)",0.8796296296296297
22/12/2025_07g00_1,2025-12-22,B4-501,80,72,"PH1003(42), PH1011(30)",0.9
22/12/2025_07g00_1,2025-12-22,B4-502,80,71,"PH1003(41), PH1011(30)",0.8875
22/12/2025_07g00_1,2025-12-22,B1-306,84,69,"PH1003(39), PH1011(30)",0.8214285714285714
22/12/2025_07g00_1,2025-12-22,B4-505,120,99,"PH1003(39), PH1011(30), IM3021(30)",0.825
22/12/2025_07g00_1,2025-12-22,B1-208,84,66,"PH1003(39), PH1011(27)",0.7857142857142857
22/12/2025_07g00_1,2025-12-22,B4-305,80,64,"PH1003(39), CI2139(25)",0.8
22/12/2025_07g00_1,2025-12-22,B4-306,80,39,PH1003(39),0.4875
22/12/2025_07g00_1,2025-12-22,B1-311,80,39,PH1003(39),0.4875
22/12/2025_07g00_1,2025-12-22,B1-305,72,38,PH1003(38),0.5277777777777778
22/12/2025_07g00_1,2025-12-22,B1-212,72,37,PH1003(37),0.5138888888888888
22/12/2025_07g00_1,2025-12-22,B1-213,72,36,PH1003(36),0.5
22/12/2025_07g00_1,2025-12-22,B6-306,80,35,PH1003(35),0.4375
22/12/2025_07g00_1,2025-12-22,C4-301,80,35,PH1003(35),0.4375
22/12/2025_07g00_1,2025-12-22,C4-502,80,35,PH1003(35),0.4375
22/12/2025_07g00_1,2025-12-22,C4-402,80,34,PH1003(34),0.425
22/12/2025_07g00_1,2025-12-22,C4-304,80,34,PH1003(34),0.425
22/12/2025_07g00_1,2025-12-22,C4-403,80,34,PH1003(34),0.425
22/12/2025_07g00_1,2025-12-22,C5-303,80,32,PH1003(32),0.4
22/12/2025_07g00_1,2025-12-22,C5-401,80,31,PH1003(31),0.3875
22/12/2025_07g00_1,2025-12-22,C5-403,80,31,PH1003(31),0.3875
22/12/2025_07g00_1,2025-12-22,B6-304,60,30,PH1003(30),0.5
22/12/2025_07g00_1,2025-12-22,C5-502,80,30,PH1003(30),0.375
22/12/2025_07g00_1,2025-12-22,B8-304,62,30,PH1003(30),0.4838709677419355
22/12/2025_07g00_1,2025-12-22,B8-303,62,30,PH1003(30),0.4838709677419355
22/12/2025_07g00_1,2025-12-22,C5-503,80,30,PH1003(30),0.375
22/12/2025_07g00_1,2025-12-22,B8-301,66,30,PH1003(30),0.45454545454545453
22/12/2025_07g00_1,2025-12-22,B6-305,60,30,PH1003(30),0.5
22/12/2025_07g00_1,2025-12-22,B6-303,60,30,PH1003(30),0.5
22/12/2025_07g00_1,2025-12-22,B6-302,60,30,PH1003(30),0.5
22/12/2025_07g00_1,2025-12-22,B1-301,56,30,PH1003(30),0.5357142857142857
22/12/2025_07g00_1,2025-12-22,B1-302,56,30,PH1003(30),0.5357142857142857
22/12/2025_07g00_1,2025-12-22,B1-303,56,30,PH1003(30),0.5357142857142857
22/12/2025_07g00_1,2025-12-22,B1-308,72,30,PH1003(30),0.4166666666666667
22/12/2025_07g00_1,2025-12-22,B1-309,56,30,PH1003(30),0.5357142857142857
22/12/2025_07g00_1,2025-12-22,B1-313,56,30,PH1003(30),0.5357142857142857
22/12/2025_07g00_1,2025-12-22,B1-314,56,30,PH1003(30),0.5357142857142857
22/12/2025_07g00_1,2025-12-22,B1-315,56,30,PH1003(30),0.5357142857142857
22/12/2025_07g00_1,2025-12-22,B4-401,60,30,PH1003(30),0.5
22/12/2025_07g00_1,2025-12-22,B4-402,60,30,PH1003(30),0.5
22/12/2025_07g00_1,2025-12-22,B4-403,60,30,PH1003(30),0.5
22/12/2025_07g00_1,2025-12-22,B4-405,60,30,PH1003(30),0.5
22/12/2025_07g00_1,2025-12-22,B4-504,60,30,PH1003(30),0.5
22/12/2025_07g00_1,2025-12-22,B4-301,60,29,PH1003(29),0.48333333333333334
22/12/2025_07g00_1,2025-12-22,B4-302,60,29,PH1003(29),0.48333333333333334
22/12/2025_07g00_1,2025-12-22,B4-303,60,29,PH1003(29),0.48333333333333334
22/12/2025_07g00_2,2025-12-22,H6-811,150,148,"PH1003(53), CI2139(48), IM3021(47)",0.9866666666666667
22/12/2025_07g00_2,2025-12-22,H6-810,120,115,"PH1003(49), CI2139(46), IM3021(20)",0.9583333333333334
22/12/2025_07g00_2,2025-12-22,H6-802,120,90,"PH1003(45), CI2139(45)",0.75
22/12/2025_07g00_2,2025-12-22,H6-412,123,84,"PH1003(44), IM3021(40)",0.6829268292682927
22/12/2025_07g00_2,2025-12-22,H6-201,120,120,"PH1003(42), CI2139(40), IM3021(38)",1.0
22/12/2025_07g00_2,2025-12-22,H6-311,135,82,"PH1003(42), CI2139(40)",0.6074074074074074
22/12/2025_07g00_2,2025-12-22,H6-208,117,80,"PH1003(40), CI2139(40)",0.6837606837606838
22/12/2025_07g00_2,2025-12-22,H6-211,126,40,PH1003(40),0.31746031746031744
22/12/2025_07g00_2,2025-12-22,H6-212,80,40,PH1003(40),0.5
22/12/2025_07g00_2,2025-12-22,H6-214,80,40,PH1003(40),0.5
22/12/2025_07g00_2,2025-12-22,H6-305,129,40,PH1003(40),0.31007751937984496
22/12/2025_07g00_2,2025-12-22,H6-306,80,40,PH1003(40),0.5
22/12/2025_07g00_2,2025-12-22,H6-308,144,40,PH1003(40),0.2777777777777778
22/12/2025_07g00_2,2025-12-22,H6-405,120,40,PH1003(40),0.3333333333333333
22/12/2025_07g00_2,2025-12-22,H6-205,117,40,PH1003(40),0.3418803418803419
22/12/2025_07g00_2,2025-12-22,H6-504,106,40,PH1003(40),0.37735849056603776
22/12/2025_07g00_2,2025-12-22,H6-506,105,40,PH1003(40),0.38095238095238093
22/12/2025_07g00_2,2025-12-22,H6-510,102,40,PH1003(40),0.39215686274509803
22/12/2025_07g00_2,2025-12-22,H6-512,105,40,PH1003(40),0.38095238095238093
22/12/2025_07g00_2,2025-12-22,H6-514,108,40,PH1003(40),0.37037037037037035
22/12/2025_07g00_2,2025-12-22,H6-516,114,40,PH1003(40),0.3508771929824561
22/12/2025_07g00_2,2025-12-22,H6-206,80,40,PH1003(40),0.5
22/12/2025_07g00_2,2025-12-22,H6-210,80,40,PH1003(40),0.5
22/12/2025_07g00_2,2025-12-22,H2-205,117,40,PH1003(40),0.3418803418803419
22/12/2025_07g00_2,2025-12-22,H2-207,135,40,PH1003(40),0.2962962962962963
22/12/2025_07g00_2,2025-12-22,H2-301,156,40,PH1003(40),0.2564102564102564
22/12/2025_07g00_2,2025-12-22,H2-302,117,40,PH1003(40),0.3418803418803419
22/12/2025_07g00_2,2025-12-22,H2-202,117,40,PH1003(40),0.3418803418803419
22/12/2025_07g00_2,2025-12-22,H2-201,156,40,PH1003(40),0.2564102564102564
22/12/2025_07g00_2,2025-12-22,H2-304,93,40,PH1003(40),0.43010752688172044
22/12/2025_07g00_2,2025-12-22,H2-306,156,40,PH1003(40),0.2564102564102564
22/12/2025_07g00_2,2025-12-22,H6-113,129,40,PH1003(40),0.31007751937984496
22/12/2025_07g00_2,2025-12-22,H2-307,117,40,PH1003(40),0.3418803418803419
22/12/2025_07g00_2,2025-12-22,H2-401,156,40,PH1003(40),0.2564102564102564
22/12/2025_07g00_2,2025-12-22,H2-403,93,40,PH1003(40),0.43010752688172044
22/12/2025_07g00_2,2025-12-22,H2-404,93,40,PH1003(40),0.43010752688172044
22/12/2025_07g00_2,2025-12-22,H2-406,156,40,PH1003(40),0.2564102564102564
22/12/2025_07g00_2,2025-12-22,H2-407,84,40,PH1003(40),0.47619047619047616
22/12/2025_07g00_2,2025-12-22,H6-109,80,40,PH1003(40),0.5
22/12/2025_07g00_2,2025-12-22,H6-110,80,40,PH1003(40),0.5
22/12/2025_07g00_2,2025-12-22,H6-112,80,40,PH1003(40),0.5
22/12/2025_07g00_2,2025-12-22,H2-206,156,40,PH1003(40),0.2564102564102564
22/12/2025_07g00_2,2025-12-22,H6-310,80,39,PH1003(39),0.4875
22/12/2025_07g00_2,2025-12-22,H6-312,80,39,PH1003(39),0.4875
22/12/2025_07g00_2,2025-12-22,H6-213,80,39,PH1003(39),0.4875
22/12/2025_07g00_2,2025-12-22,H6-313,80,37,PH1003(37),0.4625
22/12/2025_07g00_2,2025-12-22,H6-411,80,37,PH1003(37),0.4625
22/12/2025_07g00_2,2025-12-22,H6-413,80,35,PH1003(35),0.4375
22/12/2025_07g00_2,2025-12-22,H6-414,80,32,PH1003(32),0.4
22/12/2025_09g30_1,2025-12-22,B6-306,80,76,"PH1003(39), IM1003(37)",0.95
22/12/2025_09g30_1,2025-12-22,B4-305,80,62,"IM1003(31), PH1003(31)",0.775
22/12/2025_09g30_1,2025-12-22,B6-303,60,60,"PH1003(31), IM1003(29)",1.0
22/12/2025_09g30_1,2025-12-22,B4-302,60,60,"IM1003(30), PH1003(30)",1.0
22/12/2025_09g30_1,2025-12-22,B6-305,60,53,"PH1003(30), IM1003(23)",0.8833333333333333
22/12/2025_09g30_1,2025-12-22,B6-301,50,17,PH1003(17),0.34
22/12/2025_09g30_2,2025-12-22,H3-301,142,133,"IM1003(52), PH1003(46), CI1003(35)",0.9366197183098591
22/12/2025_09g30_2,2025-12-22,H3-306,142,107,"IM1003(49), PH1003(46), CI1003(12)",0.7535211267605634
22/12/2025_09g30_2,2025-12-22,H2-205,117,85,"PH1003(45), IM1003(40)",0.7264957264957265
22/12/2025_09g30_2,2025-12-22,H2-206,156,43,PH1003(43),0.27564102564102566
22/12/2025_09g30_2,2025-12-22,H2-207,135,43,PH1003(43),0.31851851851851853
22/12/2025_09g30_2,2025-12-22,H6-112,80,40,PH1003(40),0.5
22/12/2025_09g30_2,2025-12-22,H6-308,144,40,PH1003(40),0.2777777777777778
22/12/2025_09g30_2,2025-12-22,H6-201,120,40,PH1003(40),0.3333333333333333
22/12/2025_09g30_2,2025-12-22,H6-205,117,40,PH1003(40),0.3418803418803419
22/12/2025_09g30_2,2025-12-22,H6-206,80,40,PH1003(40),0.5
22/12/2025_09g30_2,2025-12-22,H6-208,117,40,PH1003(40),0.3418803418803419
22/12/2025_09g30_2,2025-12-22,H6-211,126,40,PH1003(40),0.31746031746031744
22/12/2025_09g30_2,2025-12-22,H6-305,129,40,PH1003(40),0.31007751937984496
22/12/2025_09g30_2,2025-12-22,H6-504,106,40,PH1003(40),0.37735849056603776
22/12/2025_09g30_2,2025-12-22,H6-311,135,40,PH1003(40),0.2962962962962963
22/12/2025_09g30_2,2025-12-22,H6-312,80,40,PH1003(40),0.5
22/12/2025_09g30_2,2025-12-22,H6-313,80,40,PH1003(40),0.5
22/12/2025_09g30_2,2025-12-22,H6-110,80,40,PH1003(40),0.5
22/12/2025_09g30_2,2025-12-22,H6-506,105,40,PH1003(40),0.38095238095238093
22/12/2025_09g30_2,2025-12-22,H6-512,105,40,PH1003(40),0.38095238095238093
22/12/2025_09g30_2,2025-12-22,H6-514,108,40,PH1003(40),0.37037037037037035
22/12/2025_09g30_2,2025-12-22,H6-113,129,40,PH1003(40),0.31007751937984496
22/12/2025_09g30_2,2025-12-22,H6-516,114,40,PH1003(40),0.3508771929824561
22/12/2025_09g30_2,2025-12-22,H2-401,156,40,PH1003(40),0.2564102564102564
22/12/2025_09g30_2,2025-12-22,H2-403,93,40,PH1003(40),0.43010752688172044
22/12/2025_09g30_2,2025-12-22,H2-306,156,40,PH1003(40),0.2564102564102564
22/12/2025_09g30_2,2025-12-22,H6-109,80,40,PH1003(40),0.5
22/12/2025_09g30_2,2025-12-22,H2-301,156,40,PH1003(40),0.2564102564102564
22/12/2025_09g30_2,2025-12-22,H2-304,93,40,PH1003(40),0.43010752688172044
22/12/2025_09g30_2,2025-12-22,H2-302,117,40,PH1003(40),0.3418803418803419
22/12/2025_09g30_2,2025-12-22,H2-404,93,40,PH1003(40),0.43010752688172044
22/12/2025_09g30_2,2025-12-22,H2-406,156,40,PH1003(40),0.2564102564102564
22/12/2025_09g30_2,2025-12-22,H2-407,84,40,PH1003(40),0.47619047619047616
22/12/2025_09g30_2,2025-12-22,H6-210,80,39,PH1003(39),0.4875
22/12/2025_09g30_2,2025-12-22,H6-212,80,39,PH1003(39),0.4875
22/12/2025_09g30_2,2025-12-22,H6-213,80,39,PH1003(39),0.4875
22/12/2025_09g30_2,2025-12-22,H6-306,80,39,PH1003(39),0.4875
22/12/2025_09g30_2,2025-12-22,H6-310,80,39,PH1003(39),0.4875
22/12/2025_09g30_2,2025-12-22,H2-307,117,39,PH1003(39),0.3333333333333333
22/12/2025_09g30_2,2025-12-22,H6-510,102,39,PH1003(39),0.38235294117647056
22/12/2025_09g30_2,2025-12-22,H6-405,120,39,PH1003(39),0.325
22/12/2025_09g30_2,2025-12-22,H6-214,80,39,PH1003(39),0.4875
22/12/2025_09g30_2,2025-12-22,H6-411,80,32,PH1003(32),0.4
22/12/2025_09g30_2,2025-12-22,H2-402,63,29,PH1003(29),0.4603174603174603
22/12/2025_09g30_2,2025-12-22,H2-405,63,28,PH1003(28),0.4444444444444444
22/12/2025_09g30_2,2025-12-22,H2-305,63,10,PH1003(10),0.15873015873015872
22/12/2025_13g00_1,2025-12-22,B1-306,84,84,"EE3413(45), ME4631(39)",1.0
22/12/2025_13g00_1,2025-12-22,B1-208,84,84,"ME3015(44), CO3045(40)",1.0
22/12/2025_13g00_1,2025-12-22,B4-505,120,120,"AS2071(38), EE4441(34), CH4051(33), MA3111(15)",1.0
22/12/2025_13g00_1,2025-12-22,B4-406,108,97,"AS2071(37), CH4051(30), EE3413(30)",0.8981481481481481
22/12/2025_13g00_1,2025-12-22,B4-502,80,66,"AS2071(36), CH4051(30)",0.825
22/12/2025_13g00_1,2025-12-22,B4-501,80,76,"AS2071(35), CH4051(26), MA4169(15)",0.95
22/12/2025_13g00_1,2025-12-22,B4-301,60,47,"TR3003(24), CH4051(23)",0.7833333333333333
22/12/2025_13g00_1,2025-12-22,B4-504,60,49,"AS2071(19), ME3015(15), CH3021(15)",0.8166666666666667
22/12/2025_13g00_2,2025-12-22,H6-802,120,120,"ME3015(52), CH4051(49), MA4091(19)",1.0
22/12/2025_13g00_2,2025-12-22,H6-208,117,117,"CH4051(47), EE3203(44), MA2013(26)",1.0
22/12/2025_13g00_2,2025-12-22,H6-305,129,124,"CH3021(44), AS2071(40), CH4051(40)",0.9612403100775194
22/12/2025_13g00_2,2025-12-22,H6-412,123,120,"ME3299(40), MA4091(40), EE3071(40)",0.975609756097561
22/12/2025_13g00_2,2025-12-22,H6-110,80,80,"EE3071(40), CH4051(40)",1.0
22/12/2025_13g00_2,2025-12-22,H6-112,80,80,"EE3071(40), CH4051(40)",1.0
22/12/2025_13g00_2,2025-12-22,H6-306,80,80,"CH3021(40), CO3045(40)",1.0
22/12/2025_13g00_2,2025-12-22,H6-312,80,79,"CO3045(40), AS2071(39)",0.9875
22/12/2025_13g00_2,2025-12-22,H6-405,120,113,"IM3029(39), EE3027(37), CI1069(37)",0.9416666666666667
22/12/2025_13g00_2,2025-12-22,H6-310,80,80,"EE3203(36), ME3299(36), ME3031(8)",1.0
22/12/2025_13g00_2,2025-12-22,H6-313,80,79,"GE3219(34), CH4051(30), CI3301(15)",0.9875
22/12/2025_13g00_2,2025-12-22,H6-504,106,104,"ME3215(29), TR3061(29), IU4025(27), IM3029(19)",0.9811320754716981
22/12/2025_13g00_2,2025-12-22,H6-214,80,69,"AS2071(27), IM2031(24), CI1069(18)",0.8625
22/12/2025_15g30_1,2025-12-22,B4-305,80,33,LA1007(33),0.4125
22/12/2025_15g30_1,2025-12-22,B4-306,80,31,LA1007(31),0.3875
22/12/2025_15g30_1,2025-12-22,B4-303,60,29,LA1007(29),0.48333333333333334
22/12/2025_15g30_2,2025-12-22,H6-311,135,46,LA1007(46),0.34074074074074073
22/12/2025_15g30_2,2025-12-22,H6-305,129,45,LA1007(45),0.3488372093023256
22/12/2025_15g30_2,2025-12-22,H6-211,126,45,LA1007(45),0.35714285714285715
22/12/2025_15g30_2,2025-12-22,H6-113,129,43,LA1007(43),0.3333333333333333
22/12/2025_15g30_2,2025-12-22,H6-308,144,40,LA1007(40),0.2777777777777778
22/12/2025_15g30_2,2025-12-22,H6-514,108,40,LA1007(40),0.37037037037037035
22/12/2025_15g30_2,2025-12-22,H6-510,102,40,LA1007(40),0.39215686274509803
22/12/2025_15g30_2,2025-12-22,H6-506,105,40,LA1007(40),0.38095238095238093
22/12/2025_15g30_2,2025-12-22,H6-504,106,40,LA1007(40),0.37735849056603776
22/12/2025_15g30_2,2025-12-22,H6-516,114,40,LA1007(40),0.3508771929824561
22/12/2025_15g30_2,2025-12-22,H6-208,117,40,LA1007(40),0.3418803418803419
22/12/2025_15g30_2,2025-12-22,H6-205,117,40,LA1007(40),0.3418803418803419
22/12/2025_15g30_2,2025-12-22,H6-512,105,39,LA1007(39),0.37142857142857144
22/12/2025_15g30_2,2025-12-22,H6-110,80,38,LA1007(38),0.475
22/12/2025_15g30_2,2025-12-22,H6-109,80,38,LA1007(38),0.475
22/12/2025_15g30_2,2025-12-22,H6-210,80,36,LA1007(36),0.45
22/12/2025_15g30_2,2025-12-22,H6-206,80,36,LA1007(36),0.45
22/12/2025_15g30_2,2025-12-22,H6-112,80,35,LA1007(35),0.4375
22/12/2025_15g30_2,2025-12-22,H6-212,80,34,LA1007(34),0.425
22/12/2025_15g30_2,2025-12-22,H6-214,80,33,LA1007(33),0.4125
22/12/2025_15g30_2,2025-12-22,H6-213,80,32,LA1007(32),0.4
22/12/2025_15g30_2,2025-12-22,H6-306,80,32,LA1007(32),0.4
22/12/2025_15g30_2,2025-12-22,H6-312,80,31,LA1007(31),0.3875
22/12/2025_15g30_2,2025-12-22,H6-310,80,30,LA1007(30),0.375
22/12/2025_18g15_1,2025-12-22,B4-406,108,103,"CO5087(41), EE5191(32), CI5403(30)",0.9537037037037037
22/12/2025_18g15_1,2025-12-22,B4-305,80,79,"CH5703(30), IM5127(28), CI5251(21)",0.9875
22/12/2025_18g15_1,2025-12-22,B4-306,80,74,"CH5703(27), ME5269(24), CH5407(14), CO5161(9)",0.925
22/12/2025_18g15_1,2025-12-22,B4-504,60,17,"TR5063(9), MA5097(8)",0.2833333333333333
23/12/2025_07g00_1,2025-12-23,B4-505,120,103,"MT1019(41), MT1003(41), IM3109(21)",0.8583333333333333
23/12/2025_07g00_1,2025-12-23,B4-306,80,71,"MT1003(41), MT1019(30)",0.8875
23/12/2025_07g00_1,2025-12-23,B6-306,80,70,"MT1003(40), MT1019(30)",0.875
23/12/2025_07g00_1,2025-12-23,C4-301,80,70,"MT1003(40), MT1019(30)",0.875
23/12/2025_07g00_1,2025-12-23,C4-304,80,68,"MT1003(40), MT1019(28)",0.85
23/12/2025_07g00_1,2025-12-23,C4-402,80,64,"MT1003(40), MT1019(24)",0.8
23/12/2025_07g00_1,2025-12-23,C4-403,80,39,MT1003(39),0.4875
23/12/2025_07g00_1,2025-12-23,C4-502,80,39,MT1003(39),0.4875
23/12/2025_07g00_1,2025-12-23,C5-403,80,38,MT1003(38),0.475
23/12/2025_07g00_1,2025-12-23,C5-303,80,38,MT1003(38),0.475
23/12/2025_07g00_1,2025-12-23,C5-401,80,38,MT1003(38),0.475
23/12/2025_07g00_1,2025-12-23,C5-503,80,37,MT1003(37),0.4625
23/12/2025_07g00_1,2025-12-23,C5-502,80,36,MT1003(36),0.45
23/12/2025_07g00_1,2025-12-23,C6-401,80,36,MT1003(36),0.45
23/12/2025_07g00_1,2025-12-23,C6-402,80,34,MT1003(34),0.425
23/12/2025_07g00_1,2025-12-23,C6-403,80,33,MT1003(33),0.4125
23/12/2025_07g00_1,2025-12-23,B1-208,84,33,MT1003(33),0.39285714285714285
23/12/2025_07g00_1,2025-12-23,B1-306,84,31,MT1003(31),0.36904761904761907
23/12/2025_07g00_1,2025-12-23,B6-303,60,30,MT1003(30),0.5
23/12/2025_07g00_1,2025-12-23,B8-303,62,30,MT1003(30),0.4838709677419355
23/12/2025_07g00_1,2025-12-23,B8-301,66,30,MT1003(30),0.45454545454545453
23/12/2025_07g00_1,2025-12-23,B6-305,60,30,MT1003(30),0.5
23/12/2025_07g00_1,2025-12-23,B6-304,60,30,MT1003(30),0.5
23/12/2025_07g00_1,2025-12-23,B1-313,56,30,MT1003(30),0.5357142857142857
23/12/2025_07g00_1,2025-12-23,B1-305,72,30,MT1003(30),0.4166666666666667
23/12/2025_07g00_1,2025-12-23,B1-309,56,30,MT1003(30),0.5357142857142857
23/12/2025_07g00_1,2025-12-23,B1-311,80,30,MT1003(30),0.375
23/12/2025_07g00_1,2025-12-23,B6-302,60,30,MT1003(30),0.5
23/12/2025_07g00_1,2025-12-23,B1-314,56,30,MT1003(30),0.5357142857142857
23/12/2025_07g00_1,2025-12-23,B1-315,56,30,MT1003(30),0.5357142857142857
23/12/2025_07g00_1,2025-12-23,B4-301,60,30,MT1003(30),0.5
23/12/2025_07g00_1,2025-12-23,B4-302,60,30,MT1003(30),0.5
23/12/2025_07g00_1,2025-12-23,B1-303,56,30,MT1003(30),0.5357142857142857
23/12/2025_07g00_1,2025-12-23,B4-303,60,30,MT1003(30),0.5
23/12/2025_07g00_1,2025-12-23,B1-301,56,30,MT1003(30),0.5357142857142857
23/12/2025_07g00_1,2025-12-23,B1-213,72,30,MT1003(30),0.4166666666666667
23/12/2025_07g00_1,2025-12-23,B4-305,80,30,MT1003(30),0.375
23/12/2025_07g00_1,2025-12-23,B4-401,60,30,MT1003(30),0.5
23/12/2025_07g00_1,2025-12-23,B1-212,72,30,MT1003(30),0.4166666666666667
23/12/2025_07g00_1,2025-12-23,B1-308,72,30,MT1003(30),0.4166666666666667
23/12/2025_07g00_1,2025-12-23,B1-302,56,29,MT1003(29),0.5178571428571429
23/12/2025_07g00_1,2025-12-23,B10-203,70,29,MT1003(29),0.4142857142857143
23/12/2025_07g00_1,2025-12-23,B9-201,60,29,MT1003(29),0.48333333333333334
23/12/2025_07g00_1,2025-12-23,B8-304,62,29,MT1003(29),0.46774193548387094
23/12/2025_07g00_1,2025-12-23,B4-402,60,29,MT1003(29),0.48333333333333334
23/12/2025_07g00_1,2025-12-23,B9-202,54,27,MT1003(27),0.5
23/12/2025_07g00_1,2025-12-23,B1-203,60,27,MT1003(27),0.45
23/12/2025_07g00_1,2025-12-23,C4-303,50,26,MT1003(26),0.52
23/12/2025_07g00_2,2025-12-23,H3-301,142,140,"EE3025(51), MT1003(49), CH2019(40)",0.9859154929577465
23/12/2025_07g00_2,2025-12-23,H3-306,142,123,"EE3025(51), MT1003(46), IM3109(26)",0.8661971830985915
23/12/2025_07g00_2,2025-12-23,H2-205,117,106,"MT1003(44), EE3025(41), CH2019(21)",0.905982905982906
23/12/2025_07g00_2,2025-12-23,H2-206,156,84,"MT1003(44), EE3025(40)",0.5384615384615384
23/12/2025_07g00_2,2025-12-23,H6-113,129,80,"MT1003(40), EE3025(40)",0.6201550387596899
23/12/2025_07g00_2,2025-12-23,H6-214,80,70,"MT1003(40), EE3025(30)",0.875
23/12/2025_07g00_2,2025-12-23,H6-212,80,40,MT1003(40),0.5
23/12/2025_07g00_2,2025-12-23,H6-211,126,40,MT1003(40),0.31746031746031744
23/12/2025_07g00_2,2025-12-23,H6-210,80,40,MT1003(40),0.5
23/12/2025_07g00_2,2025-12-23,H6-308,144,40,MT1003(40),0.2777777777777778
23/12/2025_07g00_2,2025-12-23,H6-208,117,40,MT1003(40),0.3418803418803419
23/12/2025_07g00_2,2025-12-23,H6-206,80,40,MT1003(40),0.5
23/12/2025_07g00_2,2025-12-23,H6-205,117,40,MT1003(40),0.3418803418803419
23/12/2025_07g00_2,2025-12-23,H6-305,129,40,MT1003(40),0.31007751937984496
23/12/2025_07g00_2,2025-12-23,H6-504,106,40,MT1003(40),0.37735849056603776
23/12/2025_07g00_2,2025-12-23,H6-311,135,40,MT1003(40),0.2962962962962963
23/12/2025_07g00_2,2025-12-23,H6-405,120,40,MT1003(40),0.3333333333333333
23/12/2025_07g00_2,2025-12-23,H6-412,123,40,MT1003(40),0.3252032520325203
23/12/2025_07g00_2,2025-12-23,H6-506,105,40,MT1003(40),0.38095238095238093
23/12/2025_07g00_2,2025-12-23,H6-510,102,40,MT1003(40),0.39215686274509803
23/12/2025_07g00_2,2025-12-23,H6-512,105,40,MT1003(40),0.38095238095238093
23/12/2025_07g00_2,2025-12-23,H6-514,108,40,MT1003(40),0.37037037037037035
23/12/2025_07g00_2,2025-12-23,H6-201,120,40,MT1003(40),0.3333333333333333
23/12/2025_07g00_2,2025-12-23,H6-516,114,40,MT1003(40),0.3508771929824561
23/12/2025_07g00_2,2025-12-23,H6-112,80,40,MT1003(40),0.5
23/12/2025_07g00_2,2025-12-23,H2-307,117,40,MT1003(40),0.3418803418803419
23/12/2025_07g00_2,2025-12-23,H2-207,135,40,MT1003(40),0.2962962962962963
23/12/2025_07g00_2,2025-12-23,H2-301,156,40,MT1003(40),0.2564102564102564
23/12/2025_07g00_2,2025-12-23,H2-302,117,40,MT1003(40),0.3418803418803419
23/12/2025_07g00_2,2025-12-23,H6-110,80,40,MT1003(40),0.5
23/12/2025_07g00_2,2025-12-23,H2-306,156,40,MT1003(40),0.2564102564102564
23/12/2025_07g00_2,2025-12-23,H2-304,93,40,MT1003(40),0.43010752688172044
23/12/2025_07g00_2,2025-12-23,H2-404,93,40,MT1003(40),0.43010752688172044
23/12/2025_07g00_2,2025-12-23,H2-406,156,40,MT1003(40),0.2564102564102564
23/12/2025_07g00_2,2025-12-23,H6-109,80,40,MT1003(40),0.5
23/12/2025_07g00_2,2025-12-23,H2-401,156,40,MT1003(40),0.2564102564102564
23/12/2025_07g00_2,2025-12-23,H2-403,93,40,MT1003(40),0.43010752688172044
23/12/2025_07g00_2,2025-12-23,H2-407,84,40,MT1003(40),0.47619047619047616
23/12/2025_07g00_2,2025-12-23,H6-310,80,39,MT1003(39),0.4875
23/12/2025_07g00_2,2025-12-23,H6-312,80,39,MT1003(39),0.4875
23/12/2025_07g00_2,2025-12-23,H6-313,80,39,MT1003(39),0.4875
23/12/2025_07g00_2,2025-12-23,H6-306,80,39,MT1003(39),0.4875
23/12/2025_07g00_2,2025-12-23,H6-213,80,38,MT1003(38),0.475
23/12/2025_07g00_2,2025-12-23,H6-411,80,38,MT1003(38),0.475
23/12/2025_07g00_2,2025-12-23,H6-413,80,37,MT1003(37),0.4625
23/12/2025_07g00_2,2025-12-23,H6-414,80,31,MT1003(31),0.3875
23/12/2025_07g00_2,2025-12-23,H6-415,80,29,MT1003(29),0.3625
23/12/2025_07g00_2,2025-12-23,H2-305,63,28,MT1003(28),0.4444444444444444
23/12/2025_09g30_1,2025-12-23,B4-406,108,107,"MT1003(44), MT1017(38), MT1015(25)",0.9907407407407407
23/12/2025_09g30_1,2025-12-23,B6-306,80,80,"MT1015(33), TR3055(32), CO3071(15)",1.0
23/12/2025_09g30_1,2025-12-23,B4-306,80,79,"MT1017(31), MT1015(31), MT1003(17)",0.9875
23/12/2025_09g30_1,2025-12-23,B4-401,60,60,"MT1003(31), MT1017(29)",1.0
23/12/2025_09g30_1,2025-12-23,B4-403,60,60,"MT1003(30), ME4645(30)",1.0
23/12/2025_09g30_1,2025-12-23,B4-402,60,60,"MT1003(30), MT1015(30)",1.0
23/12/2025_09g30_1,2025-12-23,B6-304,60,60,"MT1015(30), MT1017(30)",1.0
23/12/2025_09g30_1,2025-12-23,B8-304,62,58,"ME4645(30), MT1015(28)",0.9354838709677419
23/12/2025_09g30_1,2025-12-23,B4-504,60,41,"MT1017(24), MT1003(17)",0.6833333333333333
23/12/2025_09g30_2,2025-12-23,H2-201,156,135,"MT1003(49), ME4645(45), CO3071(41)",0.8653846153846154
23/12/2025_09g30_2,2025-12-23,H2-202,117,85,"MT1003(45), MT1017(40)",0.7264957264957265
23/12/2025_09g30_2,2025-12-23,H2-205,117,83,"MT1003(43), MT1017(40)",0.7094017094017094
23/12/2025_09g30_2,2025-12-23,H6-510,102,80,"MT1003(40), MT1017(40)",0.7843137254901961
23/12/2025_09g30_2,2025-12-23,H6-211,126,116,"MT1003(40), ME4645(40), CO3071(36)",0.9206349206349206
23/12/2025_09g30_2,2025-12-23,H6-305,129,66,"MT1003(40), MT1017(26)",0.5116279069767442
23/12/2025_09g30_2,2025-12-23,H6-308,144,40,MT1003(40),0.2777777777777778
23/12/2025_09g30_2,2025-12-23,H6-311,135,40,MT1003(40),0.2962962962962963
23/12/2025_09g30_2,2025-12-23,H6-405,120,40,MT1003(40),0.3333333333333333
23/12/2025_09g30_2,2025-12-23,H6-412,123,40,MT1003(40),0.3252032520325203
23/12/2025_09g30_2,2025-12-23,H6-504,106,40,MT1003(40),0.37735849056603776
23/12/2025_09g30_2,2025-12-23,H6-506,105,40,MT1003(40),0.38095238095238093
23/12/2025_09g30_2,2025-12-23,H6-514,108,40,MT1003(40),0.37037037037037035
23/12/2025_09g30_2,2025-12-23,H6-512,105,40,MT1003(40),0.38095238095238093
23/12/2025_09g30_2,2025-12-23,H6-201,120,40,MT1003(40),0.3333333333333333
23/12/2025_09g30_2,2025-12-23,H6-516,114,40,MT1003(40),0.3508771929824561
23/12/2025_09g30_2,2025-12-23,H6-802,120,40,MT1003(40),0.3333333333333333
23/12/2025_09g30_2,2025-12-23,H6-810,120,40,MT1003(40),0.3333333333333333
23/12/2025_09g30_2,2025-12-23,H6-811,150,40,MT1003(40),0.26666666666666666
23/12/2025_09g30_2,2025-12-23,H6-205,117,40,MT1003(40),0.3418803418803419
23/12/2025_09g30_2,2025-12-23,H6-113,129,40,MT1003(40),0.31007751937984496
23/12/2025_09g30_2,2025-12-23,H2-406,156,40,MT1003(40),0.2564102564102564
23/12/2025_09g30_2,2025-12-23,H2-206,156,40,MT1003(40),0.2564102564102564
23/12/2025_09g30_2,2025-12-23,H2-207,135,40,MT1003(40),0.2962962962962963
23/12/2025_09g30_2,2025-12-23,H2-301,156,40,MT1003(40),0.2564102564102564
23/12/2025_09g30_2,2025-12-23,H2-302,117,40,MT1003(40),0.3418803418803419
23/12/2025_09g30_2,2025-12-23,H2-304,93,40,MT1003(40),0.43010752688172044
23/12/2025_09g30_2,2025-12-23,H2-306,156,40,MT1003(40),0.2564102564102564
23/12/2025_09g30_2,2025-12-23,H2-307,117,40,MT1003(40),0.3418803418803419
23/12/2025_09g30_2,2025-12-23,H2-401,156,40,MT1003(40),0.2564102564102564
23/12/2025_09g30_2,2025-12-23,H2-403,93,40,MT1003(40),0.43010752688172044
23/12/2025_09g30_2,2025-12-23,H2-404,93,40,MT1003(40),0.43010752688172044
23/12/2025_09g30_2,2025-12-23,H6-109,80,40,MT1003(40),0.5
23/12/2025_09g30_2,2025-12-23,H6-110,80,40,MT1003(40),0.5
23/12/2025_09g30_2,2025-12-23,H2-407,84,40,MT1003(40),0.47619047619047616
23/12/2025_09g30_2,2025-12-23,H6-214,80,39,MT1003(39),0.4875
23/12/2025_09g30_2,2025-12-23,H6-206,80,39,MT1003(39),0.4875
23/12/2025_09g30_2,2025-12-23,H6-210,80,39,MT1003(39),0.4875
23/12/2025_09g30_2,2025-12-23,H6-212,80,39,MT1003(39),0.4875
23/12/2025_09g30_2,2025-12-23,H6-208,117,39,MT1003(39),0.3333333333333333
23/12/2025_09g30_2,2025-12-23,H6-306,80,39,MT1003(39),0.4875
23/12/2025_09g30_2,2025-12-23,H6-112,80,39,MT1003(39),0.4875
23/12/2025_09g30_2,2025-12-23,H6-213,80,37,MT1003(37),0.4625
23/12/2025_09g30_2,2025-12-23,H6-310,80,37,MT1003(37),0.4625
23/12/2025_09g30_2,2025-12-23,H6-312,80,35,MT1003(35),0.4375
23/12/2025_09g30_2,2025-12-23,H6-313,80,35,MT1003(35),0.4375
23/12/2025_09g30_2,2025-12-23,H6-411,80,32,MT1003(32),0.4
23/12/2025_09g30_2,2025-12-23,H2-305,63,31,MT1003(31),0.49206349206349204
23/12/2025_09g30_2,2025-12-23,H2-402,63,27,MT1003(27),0.42857142857142855
23/12/2025_13g00_1,2025-12-23,B4-406,108,107,"TR3135(42), CH4085(37), CI1003(28)",0.9907407407407407
23/12/2025_13g00_1,2025-12-23,B4-305,80,65,"CO3143(34), CH3049(31)",0.8125
23/12/2025_13g00_1,2025-12-23,B4-302,60,50,"ME4201(31), EE3403(19)",0.8333333333333334
23/12/2025_13g00_1,2025-12-23,B4-303,60,60,"CO3143(30), EE3403(30)",1.0
23/12/2025_13g00_1,2025-12-23,B4-401,60,50,"LA1009(30), ME4201(20)",0.8333333333333334
23/12/2025_13g00_1,2025-12-23,B4-405,60,52,"LA1009(18), AS3105(17), EE4053(17)",0.8666666666666667
23/12/2025_13g00_2,2025-12-23,H6-811,150,150,"EE3077(56), AS3105(55), LA1009(39)",1.0
23/12/2025_13g00_2,2025-12-23,H6-516,114,99,"CI4165(54), ME4201(45)",0.868421052631579
23/12/2025_13g00_2,2025-12-23,H6-506,105,102,"TR3135(43), LA1009(43), IM1015(16)",0.9714285714285714
23/12/2025_13g00_2,2025-12-23,H6-208,117,111,"LA1009(43), CH4085(40), AS3015(28)",0.9487179487179487
23/12/2025_13g00_2,2025-12-23,H6-308,144,130,"LA1009(41), CH4085(40), EE3133(26), ME3207(23)",0.9027777777777778
23/12/2025_13g00_2,2025-12-23,H6-311,135,115,"LA1009(40), CH4085(34), CH3049(21), CH3403(20)",0.8518518518518519
23/12/2025_13g00_2,2025-12-23,H6-305,129,40,LA1009(40),0.31007751937984496
23/12/2025_13g00_2,2025-12-23,H6-210,80,40,LA1009(40),0.5
23/12/2025_13g00_2,2025-12-23,H6-206,80,40,LA1009(40),0.5
23/12/2025_13g00_2,2025-12-23,H6-201,120,40,LA1009(40),0.3333333333333333
23/12/2025_13g00_2,2025-12-23,H6-205,117,40,LA1009(40),0.3418803418803419
23/12/2025_13g00_2,2025-12-23,H6-110,80,40,LA1009(40),0.5
23/12/2025_13g00_2,2025-12-23,H6-109,80,40,LA1009(40),0.5
23/12/2025_13g00_2,2025-12-23,H6-212,80,38,LA1009(38),0.475
23/12/2025_13g00_2,2025-12-23,H6-213,80,32,LA1009(32),0.4
23/12/2025_13g00_2,2025-12-23,H6-214,80,28,LA1009(28),0.35
23/12/2025_13g00_2,2025-12-23,H6-306,80,28,LA1009(28),0.35
23/12/2025_13g00_2,2025-12-23,H6-310,80,24,LA1009(24),0.3
23/12/2025_13g00_2,2025-12-23,H6-312,80,24,LA1009(24),0.3
23/12/2025_13g00_2,2025-12-23,H6-313,80,21,LA1009(21),0.2625
23/12/2025_15g30_1,2025-12-23,B4-406,108,45,ME2151(45),0.4166666666666667
23/12/2025_15g30_1,2025-12-23,B4-405,60,30,ME2151(30),0.5
23/12/2025_15g30_2,2025-12-23,H6-112,80,40,EE2017(40),0.5
23/12/2025_15g30_2,2025-12-23,H6-113,129,39,EE2017(39),0.3023255813953488
23/12/2025_15g30_2,2025-12-23,H6-110,80,36,EE2017(36),0.45
23/12/2025_15g30_2,2025-12-23,H6-109,80,21,EE2017(21),0.2625
23/12/2025_18g15_1,2025-12-23,B4-305,80,79,"GK5025(40), CI5407(31), TR5067(8)",0.9875
23/12/2025_18g15_1,2025-12-23,B4-403,60,60,"CH5603(30), GK5025(30)",1.0
23/12/2025_18g15_1,2025-12-23,B4-302,60,57,"GK5025(30), IM5067(27)",0.95
23/12/2025_18g15_1,2025-12-23,B4-303,60,55,"GK5025(30), EE5193(25)",0.9166666666666666
23/12/2025_18g15_1,2025-12-23,B4-402,60,36,"CH5603(16), CI5137(14), TR5089(6)",0.6
24/12/2025_07g00_1,2025-12-24,B4-406,108,107,"CH2113(44), CO1005(42), ME3281(21)",0.9907407407407407
24/12/2025_07g00_1,2025-12-24,B4-305,80,78,"CH2113(39), CI2135(39)",0.975
24/12/2025_07g00_1,2025-12-24,C5-303,80,76,"EE2409(39), ME2179(37)",0.95
24/12/2025_07g00_1,2025-12-24,B4-306,80,79,"CH2113(33), CO1005(31), EE1009(15)",0.9875
24/12/2025_07g00_1,2025-12-24,B6-302,60,60,"EE1009(30), CH2113(30)",1.0
24/12/2025_07g00_1,2025-12-24,B4-505,120,120,"EE1009(30), ME2179(30), IM2019(30), CH2113(30)",1.0
24/12/2025_07g00_1,2025-12-24,B4-504,60,60,"EE1009(30), CH2113(30)",1.0
24/12/2025_07g00_1,2025-12-24,B4-502,80,80,"EE1009(30), IM2019(30), CO3049(20)",1.0
24/12/2025_07g00_1,2025-12-24,B4-501,80,80,"EE1009(30), CH2113(30), CO1005(20)",1.0
24/12/2025_07g00_1,2025-12-24,B6-303,60,60,"EE1009(30), CO1005(30)",1.0
24/12/2025_07g00_1,2025-12-24,B6-306,80,78,"EE1009(30), CO1005(30), ME2179(18)",0.975
24/12/2025_07g00_1,2025-12-24,C4-403,80,79,"ME2179(30), CO1005(30), EE1009(19)",0.9875
24/12/2025_07g00_1,2025-12-24,B1-302,56,56,"CO1005(30), IM2019(26)",1.0
24/12/2025_07g00_1,2025-12-24,B1-305,72,70,"CO1005(30), CO3049(30), CI2135(10)",0.9722222222222222
24/12/2025_07g00_1,2025-12-24,B1-309,56,56,"CO1005(30), CH2113(26)",1.0
24/12/2025_07g00_1,2025-12-24,B1-308,72,60,"CO1005(30), ME2179(30)",0.8333333333333334
24/12/2025_07g00_1,2025-12-24,B1-313,56,55,"CO1005(30), EE1009(25)",0.9821428571428571
24/12/2025_07g00_1,2025-12-24,B1-314,56,55,"CO1005(30), EE1009(25)",0.9821428571428571
24/12/2025_07g00_1,2025-12-24,B1-315,56,54,"CO1005(30), IM2019(24)",0.9642857142857143
24/12/2025_07g00_1,2025-12-24,B4-301,60,59,"CH2113(30), CO1005(29)",0.9833333333333333
24/12/2025_07g00_1,2025-12-24,B4-403,60,50,"CH2113(29), ME3281(21)",0.8333333333333334
24/12/2025_07g00_1,2025-12-24,B1-210,48,40,"CO1005(21), EE1009(19)",0.8333333333333334
24/12/2025_07g00_2,2025-12-24,H3-501,142,142,"ME2103(57), ME2179(53), EE1009(32)",1.0
24/12/2025_07g00_2,2025-12-24,H6-113,129,125,"EE1009(49), CO1005(48), CO3083(28)",0.9689922480620154
24/12/2025_07g00_2,2025-12-24,H2-201,156,156,"CH2113(45), EE1009(45), ME3281(41), IM3095(25)",1.0
24/12/2025_07g00_2,2025-12-24,H3-504,88,82,"ME2179(41), ME2103(41)",0.9318181818181818
24/12/2025_07g00_2,2025-12-24,H2-306,156,156,"CI2135(40), EE1009(40), IM2019(40), CH2113(36)",1.0
24/12/2025_07g00_2,2025-12-24,H6-212,80,80,"EE1009(40), CI2135(40)",1.0
24/12/2025_07g00_2,2025-12-24,H6-211,126,120,"EE1009(40), IM2019(40), IM3095(40)",0.9523809523809523
24/12/2025_07g00_2,2025-12-24,H6-208,117,117,"EE1009(40), IM2019(40), ME3281(37)",1.0
24/12/2025_07g00_2,2025-12-24,H6-206,80,80,"EE1009(40), ME3281(40)",1.0
24/12/2025_07g00_2,2025-12-24,H6-214,80,80,"EE1009(40), CO3049(40)",1.0
24/12/2025_07g00_2,2025-12-24,H6-213,80,80,"EE1009(40), CI2135(40)",1.0
24/12/2025_07g00_2,2025-12-24,H6-311,135,120,"EE1009(40), CI2135(40), CO1005(40)",0.8888888888888888
24/12/2025_07g00_2,2025-12-24,H6-305,129,120,"EE1009(40), CI2135(40), CO1005(40)",0.9302325581395349
24/12/2025_07g00_2,2025-12-24,H6-306,80,80,"EE1009(40), CO1005(40)",1.0
24/12/2025_07g00_2,2025-12-24,H6-310,80,80,"EE1009(40), CO1005(40)",1.0
24/12/2025_07g00_2,2025-12-24,H6-110,80,80,"EE1009(40), CO1005(40)",1.0
24/12/2025_07g00_2,2025-12-24,H6-405,120,120,"EE1009(40), CO1005(40), ME3281(40)",1.0
24/12/2025_07g00_2,2025-12-24,H6-412,123,120,"EE1009(40), CO1005(40), CH2113(40)",0.975609756097561
24/12/2025_07g00_2,2025-12-24,H6-112,80,80,"EE1009(40), CH2113(40)",1.0
24/12/2025_07g00_2,2025-12-24,H6-201,120,120,"EE1009(40), CH2113(40), CO3049(40)",1.0
24/12/2025_07g00_2,2025-12-24,H6-109,80,80,"EE1009(40), CH2113(40)",1.0
24/12/2025_07g00_2,2025-12-24,H2-301,156,153,"CH2113(40), CO1005(39), EE1009(39), CO3049(35)",0.9807692307692307
24/12/2025_07g00_2,2025-12-24,H6-516,114,113,"CO1005(39), ME3281(39), CO3049(35)",0.9912280701754386
24/12/2025_07g00_2,2025-12-24,H2-307,117,113,"CH2113(39), CI2135(39), EE1009(35)",0.9658119658119658
24/12/2025_07g00_2,2025-12-24,H2-302,117,114,"CH2113(39), ME2015(26), ME3281(25), IM2019(24)",0.9743589743589743
24/12/2025_07g00_2,2025-12-24,H2-405,63,18,CH3421(18),0.2857142857142857
24/12/2025_09g30_1,2025-12-24,B4-406,108,89,"TR1005(42), MT1011(36), EN3005(7), MA3163(4)",0.8240740740740741
24/12/2025_09g30_1,2025-12-24,B1-311,80,68,"EE4455(35), MT1011(33)",0.85
24/12/2025_09g30_1,2025-12-24,B4-403,60,58,"CH3371(31), TR1005(27)",0.9666666666666667
24/12/2025_09g30_1,2025-12-24,B4-303,60,31,MT1011(31),0.5166666666666667
24/12/2025_09g30_1,2025-12-24,B4-301,60,30,MT1011(30),0.5
24/12/2025_09g30_1,2025-12-24,B4-302,60,30,MT1011(30),0.5
24/12/2025_09g30_1,2025-12-24,B4-401,60,17,MT1011(17),0.2833333333333333
24/12/2025_09g30_2,2025-12-24,H6-201,120,117,"ME2159(51), ME3105(51), CI3013(15)",0.975
24/12/2025_09g30_2,2025-12-24,H6-205,117,115,"EN3005(43), GE2035(43), TR1005(29)",0.9829059829059829
24/12/2025_09g30_2,2025-12-24,H6-113,129,112,"CH3371(40), TR1005(40), MA4081(32)",0.8682170542635659
24/12/2025_09g30_2,2025-12-24,H6-210,80,64,"AS2001(23), IU4019(21), CH3371(20)",0.8
24/12/2025_09g30_2,2025-12-24,H6-214,80,40,"EN3069(20), MA3021(20)",0.5
24/12/2025_13g00_1,2025-12-24,B4-505,120,94,"MT1007(42), ME4625(30), EE3031(22)",0.7833333333333333
24/12/2025_13g00_1,2025-12-24,B4-406,108,71,"MT1007(42), ME4625(29)",0.6574074074074074
24/12/2025_13g00_1,2025-12-24,B4-305,80,41,MT1007(41),0.5125
24/12/2025_13g00_1,2025-12-24,B4-306,80,40,MT1007(40),0.5
24/12/2025_13g00_1,2025-12-24,B4-501,80,40,MT1007(40),0.5
24/12/2025_13g00_1,2025-12-24,B4-502,80,35,MT1007(35),0.4375
24/12/2025_13g00_1,2025-12-24,B6-306,80,33,MT1007(33),0.4125
24/12/2025_13g00_1,2025-12-24,B1-208,84,33,MT1007(33),0.39285714285714285
24/12/2025_13g00_1,2025-12-24,B4-301,60,32,MT1007(32),0.5333333333333333
24/12/2025_13g00_1,2025-12-24,B1-311,80,31,MT1007(31),0.3875
24/12/2025_13g00_1,2025-12-24,B4-303,60,31,MT1007(31),0.5166666666666667
24/12/2025_13g00_1,2025-12-24,B1-306,84,30,MT1007(30),0.35714285714285715
24/12/2025_13g00_1,2025-12-24,B4-402,60,30,MT1007(30),0.5
24/12/2025_13g00_1,2025-12-24,B6-305,60,30,MT1007(30),0.5
24/12/2025_13g00_1,2025-12-24,B6-303,60,30,MT1007(30),0.5
24/12/2025_13g00_1,2025-12-24,B4-504,60,30,MT1007(30),0.5
24/12/2025_13g00_1,2025-12-24,B4-405,60,30,MT1007(30),0.5
24/12/2025_13g00_1,2025-12-24,B4-401,60,30,MT1007(30),0.5
24/12/2025_13g00_1,2025-12-24,B4-302,60,30,MT1007(30),0.5
24/12/2025_13g00_1,2025-12-24,B4-403,60,29,MT1007(29),0.48333333333333334
24/12/2025_13g00_1,2025-12-24,B1-212,72,29,MT1007(29),0.4027777777777778
24/12/2025_13g00_1,2025-12-24,B6-302,60,29,MT1007(29),0.48333333333333334
24/12/2025_13g00_1,2025-12-24,B6-304,60,29,MT1007(29),0.48333333333333334
24/12/2025_13g00_1,2025-12-24,B1-213,72,27,MT1007(27),0.375
24/12/2025_13g00_1,2025-12-24,B1-305,72,27,MT1007(27),0.375
24/12/2025_13g00_1,2025-12-24,B1-308,72,26,MT1007(26),0.3611111111111111
24/12/2025_13g00_1,2025-12-24,B6-301,50,23,MT1007(23),0.46
24/12/2025_13g00_1,2025-12-24,B1-309,56,18,MT1007(18),0.32142857142857145
24/12/2025_13g00_2,2025-12-24,H1-101,138,125,"EE3131(57), MT1007(48), ME4625(20)",0.9057971014492754
24/12/2025_13g00_2,2025-12-24,H6-802,120,109,"MT1007(47), EE3107(43), EE3031(19)",0.9083333333333333
24/12/2025_13g00_2,2025-12-24,H6-810,120,85,"MT1007(45), EE3031(40)",0.7083333333333334
24/12/2025_13g00_2,2025-12-24,H6-412,123,84,"MT1007(44), ME4625(40)",0.6829268292682927
24/12/2025_13g00_2,2025-12-24,H6-211,126,80,"MT1007(40), ME4625(40)",0.6349206349206349
