KEY,DATE_ONLY,CAMPUS,TARGET ROOM,ROOM EXAM CAPACITY,TOTAL STUDENTS,COURSES MERGED,UTILIZATION
02/01/2026_07g00_1,2026-01-02,CS1,B5-GD,130,127,"EE2081(44), CH2003(43), CO2011(40)",0.9769230769230769
02/01/2026_07g00_1,2026-01-02,CS1,B1-311,80,74,"CH2003(39), CO2011(35)",0.925
02/01/2026_07g00_1,2026-01-02,CS1,C4-402,80,67,"TR3001(34), EE2015(33)",0.8375
02/01/2026_07g00_1,2026-01-02,CS1,B8-301,66,63,"CI2003(32), CH2003(31)",0.9545454545454546
02/01/2026_07g00_1,2026-01-02,CS1,B10-203,70,62,"CH4101(31), EE2081(31)",0.8857142857142857
02/01/2026_07g00_1,2026-01-02,CS1,C6-102,100,90,"CI1003(30), CI2003(30), CO2011(30)",0.9
02/01/2026_07g00_1,2026-01-02,CS1,B4-302,60,60,"CO2011(30), CH2003(30)",1.0
02/01/2026_07g00_1,2026-01-02,CS1,B4-303,60,60,"CO2011(30), CH2003(30)",1.0
02/01/2026_07g00_1,2026-01-02,CS1,B4-305,80,79,"CO2011(30), CH2003(30), EE2081(19)",0.9875
02/01/2026_07g00_1,2026-01-02,CS1,B4-306,80,79,"CO2011(30), EE2015(30), EE2081(19)",0.9875
02/01/2026_07g00_1,2026-01-02,CS1,B4-401,60,60,"CO2011(30), EE2081(30)",1.0
02/01/2026_07g00_1,2026-01-02,CS1,B4-402,60,60,"CO2011(30), EE2081(30)",1.0
02/01/2026_07g00_1,2026-01-02,CS1,B4-501,80,74,"CO2011(30), EE2081(30), CI1003(14)",0.925
02/01/2026_07g00_1,2026-01-02,CS1,B4-502,80,60,"CO2011(30), EE2081(30)",0.75
02/01/2026_07g00_1,2026-01-02,CS1,B6-302,60,60,"CO2011(30), EE2081(30)",1.0
02/01/2026_07g00_1,2026-01-02,CS1,B6-306,80,60,"CO2011(30), EE3089(30)",0.75
02/01/2026_07g00_1,2026-01-02,CS1,B9-201,60,60,"ME4133(30), TR3001(30)",1.0
02/01/2026_07g00_1,2026-01-02,CS1,B8-304,62,58,"CI2003(29), CO2011(29)",0.9354838709677419
02/01/2026_07g00_1,2026-01-02,CS1,B1-303,56,53,"CH2003(29), EE3117(24)",0.9464285714285714
02/01/2026_07g00_1,2026-01-02,CS1,B6-305,60,57,"EE3089(29), CO2011(28)",0.95
02/01/2026_07g00_1,2026-01-02,CS1,B4-504,60,51,"CH2003(28), CI2003(23)",0.85
02/01/2026_07g00_1,2026-01-02,CS1,C4-302,50,43,"EE2015(22), ME4133(21)",0.86
02/01/2026_07g00_1,2026-01-02,CS1,C4-401,50,41,"TR3001(21), CO2011(20)",0.82
02/01/2026_07g00_1,2026-01-02,CS1,B6-301,50,19,CO2011(19),0.38
02/01/2026_07g00_2,2026-01-02,CS2,H6-GD,250,250,"CH2003(50), ME4133(46), EE2015(44), CO2011(42), CH4101(41), EE3017(27)",1.0
02/01/2026_07g00_2,2026-01-02,CS2,H3-306,142,128,"CH2003(46), EE2015(42), CI2003(40)",0.9014084507042254
02/01/2026_07g00_2,2026-01-02,CS2,H6-110,80,80,"CI2003(40), CO2011(40)",1.0
02/01/2026_07g00_2,2026-01-02,CS2,H6-113,129,120,"CI2003(40), CO2011(40), CH2003(40)",0.9302325581395349
02/01/2026_07g00_2,2026-01-02,CS2,H6-201,120,120,"CI2003(40), CO2011(40), CH2003(40)",1.0
02/01/2026_07g00_2,2026-01-02,CS2,H6-205,117,117,"CI2003(40), CO2011(40), EE2081(37)",1.0
02/01/2026_07g00_2,2026-01-02,CS2,H6-211,126,120,"CI2003(40), CO2011(40), CH2003(40)",0.9523809523809523
02/01/2026_07g00_2,2026-01-02,CS2,H6-305,129,120,"CI2003(40), CO2011(40), CH4101(40)",0.9302325581395349
02/01/2026_07g00_2,2026-01-02,CS2,H6-311,135,120,"CI2003(40), CO2011(40), EE2015(40)",0.8888888888888888
02/01/2026_07g00_2,2026-01-02,CS2,H6-405,120,120,"CI2003(40), CO2011(40), EE2015(40)",1.0
02/01/2026_07g00_2,2026-01-02,CS2,H6-412,123,120,"CI2003(40), CO2011(40), EE2015(40)",0.975609756097561
02/01/2026_07g00_2,2026-01-02,CS2,H2-403,93,80,"CO2011(40), EE2015(40)",0.8602150537634409
02/01/2026_07g00_2,2026-01-02,CS2,H2-404,93,80,"CO2011(40), EE2081(40)",0.8602150537634409
02/01/2026_07g00_2,2026-01-02,CS2,H6-504,106,106,"EE2081(40), EE3117(40), EE3089(26)",1.0
02/01/2026_07g00_2,2026-01-02,CS2,H6-506,105,100,"EE2081(40), TR3001(40), EE3117(20)",0.9523809523809523
02/01/2026_07g00_2,2026-01-02,CS2,H6-516,114,113,"EE2081(40), CI2003(39), CH2003(34)",0.9912280701754386
02/01/2026_07g00_2,2026-01-02,CS2,H6-802,120,118,"EE2081(40), CI2003(39), CO2011(39)",0.9833333333333333
02/01/2026_07g00_2,2026-01-02,CS2,H6-810,120,116,"EE2081(40), CI2003(38), CH2003(38)",0.9666666666666667
02/01/2026_07g00_2,2026-01-02,CS2,H6-811,150,95,"EE2081(40), CI2003(37), TR3001(18)",0.6333333333333333
02/01/2026_07g00_2,2026-01-02,CS2,H6-510,102,75,"EE2081(38), CI2003(37)",0.7352941176470589
02/01/2026_07g00_2,2026-01-02,CS2,H6-213,80,74,"CI2003(37), EE2081(37)",0.925
02/01/2026_07g00_2,2026-01-02,CS2,H6-214,80,72,"CI2003(36), EE2081(36)",0.9
02/01/2026_07g00_2,2026-01-02,CS2,H6-310,80,59,"CI2003(36), EE2081(23)",0.7375
02/01/2026_07g00_2,2026-01-02,CS2,H6-312,80,36,CI2003(36),0.45
02/01/2026_07g00_2,2026-01-02,CS2,H6-313,80,36,CI2003(36),0.45
02/01/2026_07g00_2,2026-01-02,CS2,H6-306,80,35,CI2003(35),0.4375
02/01/2026_07g00_2,2026-01-02,CS2,H6-411,80,35,CI2003(35),0.4375
02/01/2026_07g00_2,2026-01-02,CS2,H6-413,80,35,CI2003(35),0.4375
02/01/2026_07g00_2,2026-01-02,CS2,H6-414,80,34,CI2003(34),0.425
02/01/2026_09g30_1,2026-01-02,CS1,B5-GD,130,62,"MA3019(21), MA2033(15), AS3093(13), MA4139(10), AS2049(3)",0.47692307692307695
02/01/2026_09g30_2,2026-01-02,CS2,H6-GD,250,243,"GE3137(46), GE2053(40), MA2033(40), ME2113(40), ME4615(40), ME2065(37)",0.972
02/01/2026_09g30_2,2026-01-02,CS2,H6-211,126,126,"MA2033(40), GE2053(38), GE2065(30), ME2065(18)",1.0
02/01/2026_09g30_2,2026-01-02,CS2,H6-212,80,69,"MA2033(40), ME2113(29)",0.8625
02/01/2026_09g30_2,2026-01-02,CS2,H6-213,80,79,"MA2033(37), ME4615(29), CO3033(13)",0.9875
02/01/2026_09g30_2,2026-01-02,CS2,H6-306,80,76,"EN3207(28), MA4125(26), TR4021(22)",0.95
02/01/2026_09g30_2,2026-01-02,CS2,H6-214,80,35,"MA2033(20), IM4001(15)",0.4375
02/01/2026_13g00_1,2026-01-02,CS1,B5-GD,130,130,"AS1003(45), ME2089(44), IM3047(41)",1.0
02/01/2026_13g00_1,2026-01-02,CS1,B4-306,80,76,"CH3351(32), EE2035(31), CH3341(13)",0.95
02/01/2026_13g00_1,2026-01-02,CS1,B8-301,66,60,"CH3341(30), IM3047(30)",0.9090909090909091
02/01/2026_13g00_1,2026-01-02,CS1,B4-501,80,70,"ME2089(30), IM3047(26), EE2035(14)",0.875
02/01/2026_13g00_1,2026-01-02,CS1,B4-502,80,42,"ME2089(30), CO3067(12)",0.525
02/01/2026_13g00_1,2026-01-02,CS1,B4-504,60,29,ME2089(29),0.48333333333333334
02/01/2026_13g00_2,2026-01-02,CS2,H6-GD,250,248,"CI4145(50), CO3067(49), CH3341(42), IM3047(41), ME2089(41), EE2035(25)",0.992
02/01/2026_13g00_2,2026-01-02,CS2,H6-311,135,121,"ME2089(41), AS1003(40), CH3351(40)",0.8962962962962963
02/01/2026_13g00_2,2026-01-02,CS2,H6-412,123,121,"ME2089(41), EE2035(40), IM3047(40)",0.983739837398374
02/01/2026_13g00_2,2026-01-02,CS2,H6-512,105,104,"EE2035(40), IM3047(40), CH3351(24)",0.9904761904761905
02/01/2026_13g00_2,2026-01-02,CS2,H6-516,114,100,"EE2035(40), IM3047(40), IU3067(20)",0.8771929824561403
02/01/2026_13g00_2,2026-01-02,CS2,H6-208,117,100,"IM3047(40), ME2089(40), PH2001(20)",0.8547008547008547
02/01/2026_13g00_2,2026-01-02,CS2,H6-210,80,80,"IM3047(40), ME2089(40)",1.0
02/01/2026_13g00_2,2026-01-02,CS2,H6-211,126,119,"IM3047(40), ME2089(40), AS1003(39)",0.9444444444444444
02/01/2026_13g00_2,2026-01-02,CS2,H6-212,80,80,"IM3047(40), ME2089(40)",1.0
02/01/2026_13g00_2,2026-01-02,CS2,H6-213,80,79,"IM3047(40), EE2035(39)",0.9875
02/01/2026_13g00_2,2026-01-02,CS2,H6-214,80,79,"IM3047(40), PH2001(39)",0.9875
02/01/2026_13g00_2,2026-01-02,CS2,H6-313,80,57,"ME2089(38), AS1003(19)",0.7125
02/01/2026_13g00_2,2026-01-02,CS2,H6-411,80,37,ME2089(37),0.4625
02/01/2026_15g30_1,2026-01-02,CS1,B5-GD,130,35,CO3061(35),0.2692307692307692
02/01/2026_15g30_1,2026-01-02,CS1,B4-303,60,30,CO3061(30),0.5
02/01/2026_15g30_1,2026-01-02,CS1,B4-305,80,30,CO3061(30),0.375
02/01/2026_15g30_1,2026-01-02,CS1,B4-301,60,22,CO3061(22),0.36666666666666664
02/01/2026_15g30_1,2026-01-02,CS1,B4-302,60,19,CO3061(19),0.31666666666666665
02/01/2026_15g30_2,2026-01-02,CS2,H6-GD,250,40,CO3061(40),0.16
02/01/2026_15g30_2,2026-01-02,CS2,H6-110,80,40,CO3061(40),0.5
02/01/2026_15g30_2,2026-01-02,CS2,H6-112,80,40,CO3061(40),0.5
02/01/2026_15g30_2,2026-01-02,CS2,H6-113,129,40,CO3061(40),0.31007751937984496
02/01/2026_18g15_1,2026-01-02,CS1,B5-GD,130,129,"CO5175(41), CO5111(30), CH5711(30), CH5747(28)",0.9923076923076923
02/01/2026_18g15_1,2026-01-02,CS1,B4-302,60,56,"CH5711(28), CI5777(16), MA5071(12)",0.9333333333333333
03/01/2026_07g00_1,2026-01-03,CS1,B5-GD,130,130,"MT1013(39), CO4033(30), CO5097(30), IM4003(27), ME5091(4)",1.0
03/01/2026_07g00_1,2026-01-03,CS1,B6-303,60,60,"CO5097(30), MT1013(30)",1.0
03/01/2026_07g00_1,2026-01-03,CS1,B6-306,80,79,"CO5097(30), CI5239(26), TR4057(18), EE3035(5)",0.9875
03/01/2026_07g00_1,2026-01-03,CS1,B4-302,60,57,"ME3005(25), CO5097(17), CH3131(15)",0.95
03/01/2026_07g00_1,2026-01-03,CS1,B4-301,60,56,"ME3005(15), AS3031(13), EE3189(11), MA2037(10), MA4065(7)",0.9333333333333333
03/01/2026_07g00_1,2026-01-03,CS1,B4-505,120,5,EN5075(5),0.041666666666666664
03/01/2026_07g00_2,2026-01-03,CS2,H6-GD,250,250,"EE3035(58), IM4003(54), IU2031(51), GE4091(50), MA4065(36), GE3203(1)",1.0
03/01/2026_07g00_2,2026-01-03,CS2,H6-205,117,116,"IU2031(43), IM4003(41), EE3101(32)",0.9914529914529915
03/01/2026_07g00_2,2026-01-03,CS2,H6-311,135,131,"CI3237(40), CO4033(40), CH3131(40), CH4063(11)",0.9703703703703703
03/01/2026_07g00_2,2026-01-03,CS2,H6-211,126,119,"EN2065(40), IM4003(40), AS3031(39)",0.9444444444444444
03/01/2026_07g00_2,2026-01-03,CS2,H6-212,80,79,"EN2065(40), IU2031(39)",0.9875
03/01/2026_07g00_2,2026-01-03,CS2,H6-213,80,77,"EN2065(39), CH3131(38)",0.9625
03/01/2026_07g00_2,2026-01-03,CS2,H6-312,80,73,"CH4107(38), ME3005(35)",0.9125
03/01/2026_07g00_2,2026-01-03,CS2,H6-510,102,101,"TR3039(32), MA4065(28), EN3211(25), CI4159(16)",0.9901960784313726
03/01/2026_07g00_2,2026-01-03,CS2,H6-310,80,40,"CI3237(20), CO4033(20)",0.5
03/01/2026_09g30_1,2026-01-03,CS1,B5-GD,130,40,SP1035(40),0.3076923076923077
03/01/2026_09g30_1,2026-01-03,CS1,B4-406,108,38,SP1035(38),0.35185185185185186
03/01/2026_09g30_1,2026-01-03,CS1,B4-305,80,31,SP1035(31),0.3875
03/01/2026_09g30_1,2026-01-03,CS1,B1-208,84,30,SP1035(30),0.35714285714285715
03/01/2026_09g30_1,2026-01-03,CS1,B1-212,72,30,SP1035(30),0.4166666666666667
03/01/2026_09g30_1,2026-01-03,CS1,B1-213,72,30,SP1035(30),0.4166666666666667
03/01/2026_09g30_1,2026-01-03,CS1,B1-305,72,30,SP1035(30),0.4166666666666667
03/01/2026_09g30_1,2026-01-03,CS1,B1-306,84,30,SP1035(30),0.35714285714285715
03/01/2026_09g30_1,2026-01-03,CS1,B1-309,56,30,SP1035(30),0.5357142857142857
03/01/2026_09g30_1,2026-01-03,CS1,B1-311,80,30,SP1035(30),0.375
03/01/2026_09g30_1,2026-01-03,CS1,B1-315,56,30,SP1035(30),0.5357142857142857
03/01/2026_09g30_1,2026-01-03,CS1,B4-301,60,30,SP1035(30),0.5
03/01/2026_09g30_1,2026-01-03,CS1,B4-302,60,30,SP1035(30),0.5
03/01/2026_09g30_1,2026-01-03,CS1,B4-303,60,30,SP1035(30),0.5
03/01/2026_09g30_1,2026-01-03,CS1,B4-306,80,30,SP1035(30),0.375
03/01/2026_09g30_1,2026-01-03,CS1,B4-401,60,30,SP1035(30),0.5
03/01/2026_09g30_1,2026-01-03,CS1,B4-402,60,30,SP1035(30),0.5
03/01/2026_09g30_1,2026-01-03,CS1,B4-403,60,30,SP1035(30),0.5
03/01/2026_09g30_1,2026-01-03,CS1,B4-405,60,30,SP1035(30),0.5
03/01/2026_09g30_1,2026-01-03,CS1,B4-501,80,30,SP1035(30),0.375
03/01/2026_09g30_1,2026-01-03,CS1,B4-502,80,30,SP1035(30),0.375
03/01/2026_09g30_1,2026-01-03,CS1,B4-504,60,30,SP1035(30),0.5
03/01/2026_09g30_1,2026-01-03,CS1,B1-313,56,29,SP1035(29),0.5178571428571429
03/01/2026_09g30_1,2026-01-03,CS1,B1-314,56,29,SP1035(29),0.5178571428571429
03/01/2026_09g30_1,2026-01-03,CS1,B1-308,72,23,SP1035(23),0.3194444444444444
03/01/2026_09g30_1,2026-01-03,CS1,B1-214,48,22,SP1035(22),0.4583333333333333
03/01/2026_09g30_1,2026-01-03,CS1,B1-215,48,20,SP1035(20),0.4166666666666667
03/01/2026_09g30_2,2026-01-03,CS2,H6-GD,250,44,SP1035(44),0.176
03/01/2026_09g30_2,2026-01-03,CS2,H6-110,80,40,SP1035(40),0.5
03/01/2026_09g30_2,2026-01-03,CS2,H6-112,80,40,SP1035(40),0.5
03/01/2026_09g30_2,2026-01-03,CS2,H6-201,120,40,SP1035(40),0.3333333333333333
03/01/2026_09g30_2,2026-01-03,CS2,H6-205,117,40,SP1035(40),0.3418803418803419
03/01/2026_09g30_2,2026-01-03,CS2,H6-206,80,40,SP1035(40),0.5
03/01/2026_09g30_2,2026-01-03,CS2,H6-208,117,40,SP1035(40),0.3418803418803419
03/01/2026_09g30_2,2026-01-03,CS2,H6-210,80,40,SP1035(40),0.5
03/01/2026_09g30_2,2026-01-03,CS2,H6-211,126,40,SP1035(40),0.31746031746031744
03/01/2026_09g30_2,2026-01-03,CS2,H6-212,80,40,SP1035(40),0.5
03/01/2026_09g30_2,2026-01-03,CS2,H6-213,80,40,SP1035(40),0.5
03/01/2026_09g30_2,2026-01-03,CS2,H6-214,80,40,SP1035(40),0.5
03/01/2026_09g30_2,2026-01-03,CS2,H6-305,129,40,SP1035(40),0.31007751937984496
03/01/2026_09g30_2,2026-01-03,CS2,H6-308,144,40,SP1035(40),0.2777777777777778
03/01/2026_09g30_2,2026-01-03,CS2,H6-310,80,40,SP1035(40),0.5
03/01/2026_09g30_2,2026-01-03,CS2,H6-312,80,40,SP1035(40),0.5
03/01/2026_09g30_2,2026-01-03,CS2,H6-313,80,40,SP1035(40),0.5
03/01/2026_09g30_2,2026-01-03,CS2,H6-405,120,40,SP1035(40),0.3333333333333333
03/01/2026_09g30_2,2026-01-03,CS2,H6-411,80,40,SP1035(40),0.5
03/01/2026_09g30_2,2026-01-03,CS2,H6-412,123,40,SP1035(40),0.3252032520325203
03/01/2026_09g30_2,2026-01-03,CS2,H6-413,80,40,SP1035(40),0.5
03/01/2026_09g30_2,2026-01-03,CS2,H6-414,80,40,SP1035(40),0.5
03/01/2026_09g30_2,2026-01-03,CS2,H6-504,106,40,SP1035(40),0.37735849056603776
03/01/2026_09g30_2,2026-01-03,CS2,H6-506,105,40,SP1035(40),0.38095238095238093
03/01/2026_09g30_2,2026-01-03,CS2,H6-510,102,40,SP1035(40),0.39215686274509803
03/01/2026_09g30_2,2026-01-03,CS2,H6-512,105,40,SP1035(40),0.38095238095238093
03/01/2026_09g30_2,2026-01-03,CS2,H6-514,108,40,SP1035(40),0.37037037037037035
03/01/2026_09g30_2,2026-01-03,CS2,H6-516,114,40,SP1035(40),0.3508771929824561
03/01/2026_09g30_2,2026-01-03,CS2,H6-802,120,40,SP1035(40),0.3333333333333333
03/01/2026_09g30_2,2026-01-03,CS2,H6-810,120,40,SP1035(40),0.3333333333333333
03/01/2026_09g30_2,2026-01-03,CS2,H6-811,150,40,SP1035(40),0.26666666666666666
03/01/2026_09g30_2,2026-01-03,CS2,H1-101,138,39,SP1035(39),0.2826086956521739
03/01/2026_09g30_2,2026-01-03,CS2,H6-109,80,39,SP1035(39),0.4875
03/01/2026_09g30_2,2026-01-03,CS2,H6-306,80,39,SP1035(39),0.4875
03/01/2026_09g30_2,2026-01-03,CS2,H6-311,135,39,SP1035(39),0.28888888888888886
03/01/2026_09g30_2,2026-01-03,CS2,H6-415,80,39,SP1035(39),0.4875
03/01/2026_09g30_2,2026-01-03,CS2,H1-104,138,32,SP1035(32),0.2318840579710145
03/01/2026_09g30_2,2026-01-03,CS2,H1-103,90,31,SP1035(31),0.34444444444444444
03/01/2026_09g30_2,2026-01-03,CS2,H1-102,93,27,SP1035(27),0.2903225806451613
03/01/2026_13g00_1,2026-01-03,CS1,B5-GD,130,129,"IM1019(45), TR2039(42), CH5607(30), CH5653(12)",0.9923076923076923
03/01/2026_13g00_1,2026-01-03,CS1,B4-502,80,69,"IM1019(40), CO5185(29)",0.8625
03/01/2026_13g00_1,2026-01-03,CS1,B4-501,80,69,"IM1019(30), CI5253(22), CH5607(17)",0.8625
03/01/2026_13g00_1,2026-01-03,CS1,B4-504,60,41,"IM1019(25), CH4087(16)",0.6833333333333333
03/01/2026_13g00_2,2026-01-03,CS2,H6-GD,250,235,"CH4087(47), IM1019(41), EN1005(40), TR2039(40), EE3171(33), ME2071(23), IU1005(11)",0.94
03/01/2026_13g00_2,2026-01-03,CS2,H6-110,80,80,"EN1005(40), IM1019(40)",1.0
03/01/2026_13g00_2,2026-01-03,CS2,H6-208,117,57,"IM1019(40), TR2039(17)",0.48717948717948717
03/01/2026_13g00_2,2026-01-03,CS2,H6-210,80,40,IM1019(40),0.5
03/01/2026_13g00_2,2026-01-03,CS2,H6-211,126,40,IM1019(40),0.31746031746031744
03/01/2026_13g00_2,2026-01-03,CS2,H6-206,80,39,IM1019(39),0.4875
03/01/2026_15g30_1,2026-01-03,CS1,B5-GD,130,46,CO3043(46),0.35384615384615387
03/01/2026_15g30_1,2026-01-03,CS1,B4-405,60,25,CO3043(25),0.4166666666666667
03/01/2026_15g30_2,2026-01-03,CS2,H6-GD,250,50,CO3043(50),0.2
03/01/2026_15g30_2,2026-01-03,CS2,H6-110,80,40,CO3043(40),0.5
03/01/2026_15g30_2,2026-01-03,CS2,H6-112,80,40,CO3043(40),0.5
04/01/2026_07g00_1,2026-01-04,CS1,B5-GD,130,130,"IM1025(42), TR4087(42), GK5033(40), CI3259(6)",1.0
04/01/2026_07g00_1,2026-01-04,CS1,B4-501,80,80,"GK5033(35), EE3411(31), CH2109(14)",1.0
04/01/2026_07g00_1,2026-01-04,CS1,B4-502,80,80,"GK5033(32), AS2013(30), EE2419(18)",1.0
04/01/2026_07g00_1,2026-01-04,CS1,B4-302,60,60,"EE3411(30), IM1025(30)",1.0
04/01/2026_07g00_1,2026-01-04,CS1,B1-306,84,84,"IM1025(30), IM3073(30), CH4111(24)",1.0
04/01/2026_07g00_1,2026-01-04,CS1,B1-309,56,54,"IM1025(30), MA4079(24)",0.9642857142857143
04/01/2026_07g00_1,2026-01-04,CS1,B1-311,80,77,"IM1025(30), AS3075(21), CI2157(21), MA4181(5)",0.9625
04/01/2026_07g00_1,2026-01-04,CS1,B1-315,56,49,"IM1025(30), IM3073(19)",0.875
04/01/2026_07g00_1,2026-01-04,CS1,B1-212,72,64,"IM1025(29), PH1009(18), MA3139(17)",0.8888888888888888
04/01/2026_07g00_1,2026-01-04,CS1,B1-313,56,56,"IM1025(29), PH2003(17), CH4115(10)",1.0
04/01/2026_07g00_1,2026-01-04,CS1,B1-314,56,51,"IM1025(20), AS2013(16), MA3113(15)",0.9107142857142857
04/01/2026_07g00_1,2026-01-04,CS1,B1-210,48,17,IM1025(17),0.3541666666666667
04/01/2026_07g00_2,2026-01-04,CS2,H6-GD,250,250,"CH4115(43), CI4139(42), CH2109(42), GE2069(42), IM1025(42), ME2139(39)",1.0
04/01/2026_07g00_2,2026-01-04,CS2,H6-811,150,149,"IM3073(42), IM1025(41), AS2013(40), CI3263(26)",0.9933333333333333
04/01/2026_07g00_2,2026-01-04,CS2,H6-504,106,106,"AS2069(40), IM1025(40), AS2013(26)",1.0
04/01/2026_07g00_2,2026-01-04,CS2,H6-506,105,104,"AS2069(40), IM1025(40), ME2139(24)",0.9904761904761905
04/01/2026_07g00_2,2026-01-04,CS2,H6-112,80,80,"IM1025(40), IM3073(40)",1.0
04/01/2026_07g00_2,2026-01-04,CS2,H6-201,120,120,"IM1025(40), ME4025(40), PH2003(40)",1.0
04/01/2026_07g00_2,2026-01-04,CS2,H6-206,80,79,"IM1025(40), ME4025(39)",0.9875
04/01/2026_07g00_2,2026-01-04,CS2,H6-208,117,115,"IM1025(40), ME4025(39), IU3057(36)",0.9829059829059829
04/01/2026_07g00_2,2026-01-04,CS2,H6-210,80,80,"IM1025(40), ME4025(30), GE4033(10)",1.0
04/01/2026_07g00_2,2026-01-04,CS2,H6-211,126,126,"IM1025(40), TR4087(29), CI4147(22), CI4155(20), MA4025(8), MA2011(7)",1.0
04/01/2026_07g00_2,2026-01-04,CS2,H6-212,80,79,"IM1025(40), PH2003(20), CI3259(19)",0.9875
04/01/2026_07g00_2,2026-01-04,CS2,H6-213,80,56,"IM1025(40), MA3089(16)",0.7
04/01/2026_07g00_2,2026-01-04,CS2,H6-214,80,40,IM1025(40),0.5
04/01/2026_07g00_2,2026-01-04,CS2,H6-305,129,40,IM1025(40),0.31007751937984496
04/01/2026_07g00_2,2026-01-04,CS2,H6-306,80,40,IM1025(40),0.5
04/01/2026_07g00_2,2026-01-04,CS2,H6-310,80,40,IM1025(40),0.5
04/01/2026_07g00_2,2026-01-04,CS2,H6-311,135,40,IM1025(40),0.2962962962962963
04/01/2026_07g00_2,2026-01-04,CS2,H6-312,80,40,IM1025(40),0.5
04/01/2026_07g00_2,2026-01-04,CS2,H6-313,80,40,IM1025(40),0.5
04/01/2026_07g00_2,2026-01-04,CS2,H6-405,120,38,IM1025(38),0.31666666666666665
04/01/2026_07g00_2,2026-01-04,CS2,H6-411,80,30,IM1025(30),0.375
04/01/2026_07g00_2,2026-01-04,CS2,H6-412,123,30,IM1025(30),0.24390243902439024
04/01/2026_09g30_1,2026-01-04,CS1,B5-GD,130,125,"CH5699(42), CI5405(37), CO5137(31), IM1013(15)",0.9615384615384616
04/01/2026_09g30_1,2026-01-04,CS1,B6-304,60,59,"IM1013(31), IM5111(28)",0.9833333333333333
04/01/2026_09g30_1,2026-01-04,CS1,B6-303,60,56,"IM1013(29), EE5195(27)",0.9333333333333333
04/01/2026_09g30_1,2026-01-04,CS1,B4-301,60,60,"CI5143(22), CI5249(14), IM1013(14), EN5147(10)",1.0
04/01/2026_09g30_1,2026-01-04,CS1,B4-402,60,29,"CH5741(13), MA5067(8), ME5087(8)",0.48333333333333334
04/01/2026_09g30_2,2026-01-04,CS2,H6-GD,250,40,IM1013(40),0.16
04/01/2026_09g30_2,2026-01-04,CS2,H6-113,129,40,IM1013(40),0.31007751937984496
04/01/2026_09g30_2,2026-01-04,CS2,H6-110,80,39,IM1013(39),0.4875
04/01/2026_09g30_2,2026-01-04,CS2,H6-112,80,39,IM1013(39),0.4875
04/01/2026_13g00_1,2026-01-04,CS1,B5-GD,130,128,"CH3329(39), TR3011(39), CO3117(37), ME3003(13)",0.9846153846153847
04/01/2026_13g00_1,2026-01-04,CS1,B4-501,80,67,"EE3097(34), CO3117(33)",0.8375
04/01/2026_13g00_1,2026-01-04,CS1,B4-303,60,56,"CO3117(32), IM1031(24)",0.9333333333333333
04/01/2026_13g00_1,2026-01-04,CS1,B4-302,60,60,"CO3117(30), CH3329(30)",1.0
04/01/2026_13g00_1,2026-01-04,CS1,B4-405,60,60,"CH3329(30), EE3097(30)",1.0
04/01/2026_13g00_1,2026-01-04,CS1,B1-210,48,47,"ME3003(24), CO3117(23)",0.9791666666666666
04/01/2026_13g00_1,2026-01-04,CS1,B1-313,56,52,"EE2005(22), ME3003(21), EE3097(9)",0.9285714285714286
04/01/2026_13g00_1,2026-01-04,CS1,B4-402,60,52,"CH3329(20), EN3087(16), TR3011(16)",0.8666666666666667
04/01/2026_13g00_2,2026-01-04,CS2,H6-GD,250,250,"EE2005(50), EN3087(50), IM3077(43), EE3097(42), CI4131(40), AS3061(25)",1.0
04/01/2026_13g00_2,2026-01-04,CS2,H6-113,129,120,"CI4131(40), CO3117(40), CH3329(40)",0.9302325581395349
04/01/2026_13g00_2,2026-01-04,CS2,H6-214,80,80,"CI4131(40), CO3117(40)",1.0
04/01/2026_13g00_2,2026-01-04,CS2,H6-514,108,106,"CO3117(40), CH3329(40), ME2049(26)",0.9814814814814815
04/01/2026_13g00_2,2026-01-04,CS2,H6-516,114,111,"CO3117(40), EE2005(40), EE3097(31)",0.9736842105263158
04/01/2026_13g00_2,2026-01-04,CS2,H1-101,138,120,"EE3011(40), EE3097(40), IM1031(40)",0.8695652173913043
04/01/2026_13g00_2,2026-01-04,CS2,H6-811,150,144,"ME2049(40), ME3003(40), CH3329(39), EE1005(25)",0.96
04/01/2026_13g00_2,2026-01-04,CS2,H6-205,117,116,"ME3003(40), EE1005(39), IM1031(37)",0.9914529914529915
04/01/2026_13g00_2,2026-01-04,CS2,H6-206,80,76,"ME3003(40), EE3097(36)",0.95
04/01/2026_13g00_2,2026-01-04,CS2,H6-208,117,98,"ME3003(40), CI4131(35), EE3011(23)",0.8376068376068376
04/01/2026_13g00_2,2026-01-04,CS2,H6-211,126,80,"ME3003(40), CI4131(20), CO3117(20)",0.6349206349206349
04/01/2026_13g00_2,2026-01-04,CS2,H6-210,80,39,ME3003(39),0.4875
04/01/2026_13g00_2,2026-01-04,CS2,H6-212,80,39,ME3003(39),0.4875
04/01/2026_13g00_2,2026-01-04,CS2,H6-213,80,20,ME3003(20),0.25
04/01/2026_15g30_1,2026-01-04,CS1,B5-GD,130,72,"CO5173(33), CH5647(28), TR5069(11)",0.5538461538461539
04/01/2026_15g30_1,2026-01-04,CS1,B4-305,80,32,CO5173(32),0.4
04/01/2026_15g30_1,2026-01-04,CS1,B4-302,60,30,CO5173(30),0.5
04/01/2026_15g30_1,2026-01-04,CS1,B4-303,60,30,CO5173(30),0.5
15/12/2025_07g00_1,2025-12-15,CS1,B5-GD,130,128,"MT2013(42), EE3093(36), MT2009(34), IM3055(16)",0.9846153846153847
15/12/2025_07g00_1,2025-12-15,CS1,B4-406,108,104,"MT2013(42), MT2009(32), CO3057(30)",0.9629629629629629
15/12/2025_07g00_1,2025-12-15,CS1,B4-505,120,102,"MT2013(42), EE3093(30), MT2009(30)",0.85
15/12/2025_07g00_1,2025-12-15,CS1,B4-306,80,70,"MT2013(40), MT2009(30)",0.875
15/12/2025_07g00_1,2025-12-15,CS1,B1-212,72,61,"MT2013(31), MT2009(30)",0.8472222222222222
15/12/2025_07g00_1,2025-12-15,CS1,B6-305,60,60,"MT2009(30), MT2013(30)",1.0
15/12/2025_07g00_1,2025-12-15,CS1,B1-303,56,53,"MT2013(30), CO3057(23)",0.9464285714285714
15/12/2025_07g00_1,2025-12-15,CS1,B1-305,72,30,MT2013(30),0.4166666666666667
15/12/2025_07g00_1,2025-12-15,CS1,B1-306,84,30,MT2013(30),0.35714285714285715
15/12/2025_07g00_1,2025-12-15,CS1,B1-308,72,30,MT2013(30),0.4166666666666667
15/12/2025_07g00_1,2025-12-15,CS1,B1-311,80,30,MT2013(30),0.375
15/12/2025_07g00_1,2025-12-15,CS1,B1-313,56,30,MT2013(30),0.5357142857142857
15/12/2025_07g00_1,2025-12-15,CS1,B1-314,56,30,MT2013(30),0.5357142857142857
15/12/2025_07g00_1,2025-12-15,CS1,B1-315,56,30,MT2013(30),0.5357142857142857
15/12/2025_07g00_1,2025-12-15,CS1,B4-301,60,30,MT2013(30),0.5
15/12/2025_07g00_1,2025-12-15,CS1,B4-302,60,30,MT2013(30),0.5
15/12/2025_07g00_1,2025-12-15,CS1,B4-303,60,30,MT2013(30),0.5
15/12/2025_07g00_1,2025-12-15,CS1,B4-401,60,30,MT2013(30),0.5
15/12/2025_07g00_1,2025-12-15,CS1,B4-402,60,30,MT2013(30),0.5
15/12/2025_07g00_1,2025-12-15,CS1,B4-403,60,30,MT2013(30),0.5
15/12/2025_07g00_1,2025-12-15,CS1,B4-502,80,30,MT2013(30),0.375
15/12/2025_07g00_1,2025-12-15,CS1,B4-504,60,30,MT2013(30),0.5
15/12/2025_07g00_1,2025-12-15,CS1,B8-301,66,30,MT2013(30),0.45454545454545453
15/12/2025_07g00_1,2025-12-15,CS1,B8-303,62,30,MT2013(30),0.4838709677419355
15/12/2025_07g00_1,2025-12-15,CS1,B1-302,56,29,MT2013(29),0.5178571428571429
15/12/2025_07g00_1,2025-12-15,CS1,B1-309,56,29,MT2013(29),0.5178571428571429
15/12/2025_07g00_1,2025-12-15,CS1,B4-405,60,29,MT2013(29),0.48333333333333334
15/12/2025_07g00_1,2025-12-15,CS1,B4-501,80,29,MT2013(29),0.3625
15/12/2025_07g00_1,2025-12-15,CS1,B8-304,62,29,MT2013(29),0.46774193548387094
15/12/2025_07g00_1,2025-12-15,CS1,B1-301,56,24,MT2013(24),0.42857142857142855
15/12/2025_07g00_1,2025-12-15,CS1,B6-301,50,22,MT2013(22),0.44
15/12/2025_07g00_2,2025-12-15,CS2,H6-GD,250,249,"EE3063(52), IM3055(50), MT2013(42), CI4197(41), CO3057(40), EE3093(24)",0.996
15/12/2025_07g00_2,2025-12-15,CS2,H6-201,120,95,"MT2013(41), EE3093(30), CO3057(24)",0.7916666666666666
15/12/2025_07g00_2,2025-12-15,CS2,H6-311,135,41,MT2013(41),0.3037037037037037
15/12/2025_07g00_2,2025-12-15,CS2,H6-405,120,41,MT2013(41),0.3416666666666667
15/12/2025_07g00_2,2025-12-15,CS2,H6-412,123,41,MT2013(41),0.3333333333333333
15/12/2025_07g00_2,2025-12-15,CS2,H6-802,120,41,MT2013(41),0.3416666666666667
15/12/2025_07g00_2,2025-12-15,CS2,H6-810,120,41,MT2013(41),0.3416666666666667
15/12/2025_07g00_2,2025-12-15,CS2,H2-205,117,40,MT2013(40),0.3418803418803419
15/12/2025_07g00_2,2025-12-15,CS2,H2-207,135,40,MT2013(40),0.2962962962962963
15/12/2025_07g00_2,2025-12-15,CS2,H2-302,117,40,MT2013(40),0.3418803418803419
15/12/2025_07g00_2,2025-12-15,CS2,H2-304,93,40,MT2013(40),0.43010752688172044
15/12/2025_07g00_2,2025-12-15,CS2,H2-306,156,40,MT2013(40),0.2564102564102564
15/12/2025_07g00_2,2025-12-15,CS2,H2-307,117,40,MT2013(40),0.3418803418803419
15/12/2025_07g00_2,2025-12-15,CS2,H2-403,93,40,MT2013(40),0.43010752688172044
15/12/2025_07g00_2,2025-12-15,CS2,H2-404,93,40,MT2013(40),0.43010752688172044
15/12/2025_07g00_2,2025-12-15,CS2,H2-406,156,40,MT2013(40),0.2564102564102564
15/12/2025_07g00_2,2025-12-15,CS2,H2-407,84,40,MT2013(40),0.47619047619047616
15/12/2025_07g00_2,2025-12-15,CS2,H3-107,106,40,MT2013(40),0.37735849056603776
15/12/2025_07g00_2,2025-12-15,CS2,H3-201,142,40,MT2013(40),0.28169014084507044
15/12/2025_07g00_2,2025-12-15,CS2,H3-205,106,40,MT2013(40),0.37735849056603776
15/12/2025_07g00_2,2025-12-15,CS2,H3-303,88,40,MT2013(40),0.45454545454545453
15/12/2025_07g00_2,2025-12-15,CS2,H3-304,88,40,MT2013(40),0.45454545454545453
15/12/2025_07g00_2,2025-12-15,CS2,H3-306,142,40,MT2013(40),0.28169014084507044
15/12/2025_07g00_2,2025-12-15,CS2,H3-401,142,40,MT2013(40),0.28169014084507044
15/12/2025_07g00_2,2025-12-15,CS2,H3-403,88,40,MT2013(40),0.45454545454545453
15/12/2025_07g00_2,2025-12-15,CS2,H3-404,88,40,MT2013(40),0.45454545454545453
15/12/2025_07g00_2,2025-12-15,CS2,H3-406,142,40,MT2013(40),0.28169014084507044
15/12/2025_07g00_2,2025-12-15,CS2,H3-501,142,40,MT2013(40),0.28169014084507044
15/12/2025_07g00_2,2025-12-15,CS2,H3-503,88,40,MT2013(40),0.45454545454545453
15/12/2025_07g00_2,2025-12-15,CS2,H3-504,88,40,MT2013(40),0.45454545454545453
15/12/2025_07g00_2,2025-12-15,CS2,H3-506,142,40,MT2013(40),0.28169014084507044
15/12/2025_07g00_2,2025-12-15,CS2,H3-606,120,40,MT2013(40),0.3333333333333333
15/12/2025_07g00_2,2025-12-15,CS2,H6-109,80,40,MT2013(40),0.5
15/12/2025_07g00_2,2025-12-15,CS2,H6-110,80,40,MT2013(40),0.5
15/12/2025_07g00_2,2025-12-15,CS2,H6-206,80,40,MT2013(40),0.5
15/12/2025_07g00_2,2025-12-15,CS2,H6-208,117,40,MT2013(40),0.3418803418803419
15/12/2025_07g00_2,2025-12-15,CS2,H6-211,126,40,MT2013(40),0.31746031746031744
15/12/2025_07g00_2,2025-12-15,CS2,H6-212,80,40,MT2013(40),0.5
15/12/2025_07g00_2,2025-12-15,CS2,H6-214,80,40,MT2013(40),0.5
15/12/2025_07g00_2,2025-12-15,CS2,H6-305,129,40,MT2013(40),0.31007751937984496
15/12/2025_07g00_2,2025-12-15,CS2,H6-306,80,40,MT2013(40),0.5
15/12/2025_07g00_2,2025-12-15,CS2,H6-308,144,40,MT2013(40),0.2777777777777778
15/12/2025_07g00_2,2025-12-15,CS2,H6-310,80,40,MT2013(40),0.5
15/12/2025_07g00_2,2025-12-15,CS2,H6-312,80,40,MT2013(40),0.5
15/12/2025_07g00_2,2025-12-15,CS2,H6-313,80,40,MT2013(40),0.5
15/12/2025_07g00_2,2025-12-15,CS2,H6-504,106,40,MT2013(40),0.37735849056603776
15/12/2025_07g00_2,2025-12-15,CS2,H6-506,105,40,MT2013(40),0.38095238095238093
15/12/2025_07g00_2,2025-12-15,CS2,H6-510,102,40,MT2013(40),0.39215686274509803
15/12/2025_07g00_2,2025-12-15,CS2,H6-512,105,40,MT2013(40),0.38095238095238093
15/12/2025_07g00_2,2025-12-15,CS2,H6-514,108,40,MT2013(40),0.37037037037037035
15/12/2025_07g00_2,2025-12-15,CS2,H6-516,114,40,MT2013(40),0.3508771929824561
15/12/2025_07g00_2,2025-12-15,CS2,H1-101,138,39,MT2013(39),0.2826086956521739
15/12/2025_07g00_2,2025-12-15,CS2,H1-102,93,39,MT2013(39),0.41935483870967744
15/12/2025_07g00_2,2025-12-15,CS2,H2-202,117,39,MT2013(39),0.3333333333333333
15/12/2025_07g00_2,2025-12-15,CS2,H2-206,156,39,MT2013(39),0.25
15/12/2025_07g00_2,2025-12-15,CS2,H6-113,129,39,MT2013(39),0.3023255813953488
15/12/2025_07g00_2,2025-12-15,CS2,H6-205,117,39,MT2013(39),0.3333333333333333
15/12/2025_07g00_2,2025-12-15,CS2,H6-411,80,39,MT2013(39),0.4875
15/12/2025_07g00_2,2025-12-15,CS2,H6-413,80,39,MT2013(39),0.4875
15/12/2025_07g00_2,2025-12-15,CS2,H6-414,80,39,MT2013(39),0.4875
15/12/2025_07g00_2,2025-12-15,CS2,H6-415,80,39,MT2013(39),0.4875
15/12/2025_07g00_2,2025-12-15,CS2,H1-103,90,38,MT2013(38),0.4222222222222222
15/12/2025_07g00_2,2025-12-15,CS2,H6-210,80,38,MT2013(38),0.475
15/12/2025_07g00_2,2025-12-15,CS2,H2-305,63,21,MT2013(21),0.3333333333333333
15/12/2025_09g30_1,2025-12-15,CS1,B5-GD,130,125,"EE2405(40), IM1029(30), TR4073(28), IM3101(27)",0.9615384615384616
15/12/2025_09g30_1,2025-12-15,CS1,B1-305,72,66,"EE2405(36), IM1029(30)",0.9166666666666666
15/12/2025_09g30_1,2025-12-15,CS1,B1-308,72,69,"EE2405(30), IM1029(30), MA3153(9)",0.9583333333333334
15/12/2025_09g30_1,2025-12-15,CS1,B1-309,56,53,"EE2405(30), MA3145(23)",0.9464285714285714
15/12/2025_09g30_1,2025-12-15,CS1,B1-313,56,55,"EE2405(30), MA2035(18), MA4185(7)",0.9821428571428571
15/12/2025_09g30_1,2025-12-15,CS1,B1-314,56,47,"EE2405(30), AS3055(17)",0.8392857142857143
15/12/2025_09g30_1,2025-12-15,CS1,B1-315,56,45,"EE2405(30), CH3399(15)",0.8035714285714286
15/12/2025_09g30_1,2025-12-15,CS1,B4-305,80,30,IM1029(30),0.375
15/12/2025_09g30_2,2025-12-15,CS2,H6-GD,250,188,"IM4035(51), GE3017(45), IM1029(40), CI3245(13), IU3017(13), MA3031(13), CH3399(8), CI2043(3), EN3025(2)",0.752
15/12/2025_09g30_2,2025-12-15,CS2,H6-211,126,40,IM1029(40),0.31746031746031744
15/12/2025_09g30_2,2025-12-15,CS2,H6-212,80,40,IM1029(40),0.5
15/12/2025_09g30_2,2025-12-15,CS2,H6-213,80,39,IM1029(39),0.4875
15/12/2025_09g30_2,2025-12-15,CS2,H6-214,80,20,IM1029(20),0.25
15/12/2025_13g00_1,2025-12-15,CS1,B5-GD,130,114,"CH2035(34), CI4161(30), IM1021(30), CH3347(20)",0.8769230769230769
15/12/2025_13g00_1,2025-12-15,CS1,B4-401,60,47,"IM1021(30), ME4137(17)",0.7833333333333333
15/12/2025_13g00_1,2025-12-15,CS1,B4-402,60,30,IM1021(30),0.5
15/12/2025_13g00_1,2025-12-15,CS1,B4-302,60,22,IM1021(22),0.36666666666666664
15/12/2025_13g00_1,2025-12-15,CS1,B4-405,60,19,IM1021(19),0.31666666666666665
15/12/2025_13g00_1,2025-12-15,CS1,B4-301,60,15,IM1021(15),0.25
15/12/2025_13g00_2,2025-12-15,CS2,H6-GD,250,248,"CI3243(43), IM1021(41), CH2035(40), CH3347(40), IM1017(40), ME4137(31), TR2033(13)",0.992
15/12/2025_13g00_2,2025-12-15,CS2,H6-201,120,110,"IM1021(41), CI3243(40), CH3347(29)",0.9166666666666666
15/12/2025_13g00_2,2025-12-15,CS2,H6-205,117,82,"IM1021(41), IM1017(25), CH2035(16)",0.7008547008547008
15/12/2025_13g00_2,2025-12-15,CS2,H6-208,117,41,IM1021(41),0.3504273504273504
15/12/2025_13g00_2,2025-12-15,CS2,H6-211,126,41,IM1021(41),0.3253968253968254
15/12/2025_13g00_2,2025-12-15,CS2,H6-109,80,40,IM1021(40),0.5
15/12/2025_13g00_2,2025-12-15,CS2,H6-110,80,40,IM1021(40),0.5
15/12/2025_13g00_2,2025-12-15,CS2,H6-112,80,40,IM1021(40),0.5
15/12/2025_13g00_2,2025-12-15,CS2,H6-210,80,40,IM1021(40),0.5
15/12/2025_13g00_2,2025-12-15,CS2,H6-212,80,40,IM1021(40),0.5
15/12/2025_13g00_2,2025-12-15,CS2,H6-305,129,40,IM1021(40),0.31007751937984496
15/12/2025_13g00_2,2025-12-15,CS2,H6-206,80,39,IM1021(39),0.4875
15/12/2025_13g00_2,2025-12-15,CS2,H6-213,80,39,IM1021(39),0.4875
15/12/2025_13g00_2,2025-12-15,CS2,H6-214,80,39,IM1021(39),0.4875
15/12/2025_15g30_1,2025-12-15,CS1,B5-GD,130,30,CO3011(30),0.23076923076923078
15/12/2025_15g30_1,2025-12-15,CS1,B4-302,60,24,CO3011(24),0.4
15/12/2025_15g30_2,2025-12-15,CS2,H6-GD,250,40,CO3011(40),0.16
15/12/2025_15g30_2,2025-12-15,CS2,H6-110,80,40,CO3011(40),0.5
15/12/2025_15g30_2,2025-12-15,CS2,H6-112,80,39,CO3011(39),0.4875
16/12/2025_07g00_1,2025-12-16,CS1,B5-GD,130,122,"ME2113(47), CO3007(45), MT2007(30)",0.9384615384615385
16/12/2025_07g00_1,2025-12-16,CS1,B4-306,80,70,"MT2007(40), ME2113(30)",0.875
16/12/2025_07g00_1,2025-12-16,CS1,B4-302,60,52,"MT2007(30), CI2135(22)",0.8666666666666667
16/12/2025_07g00_1,2025-12-16,CS1,B4-303,60,59,"MT2007(30), TR5005(18), EE5013(11)",0.9833333333333333
16/12/2025_07g00_1,2025-12-16,CS1,B4-305,80,57,"MT2007(30), ME5003(14), CO3007(13)",0.7125
16/12/2025_07g00_1,2025-12-16,CS1,B4-403,60,28,MT2007(28),0.4666666666666667
16/12/2025_07g00_1,2025-12-16,CS1,B4-402,60,21,MT2007(21),0.35
16/12/2025_07g00_2,2025-12-16,CS2,H6-GD,250,89,"CO3007(49), TR4051(20), MA4119(12), GE1021(8)",0.356
16/12/2025_07g00_2,2025-12-16,CS2,H6-208,117,44,CO3007(44),0.37606837606837606
16/12/2025_07g00_2,2025-12-16,CS2,H6-201,120,40,CO3007(40),0.3333333333333333
16/12/2025_07g00_2,2025-12-16,CS2,H6-205,117,40,CO3007(40),0.3418803418803419
16/12/2025_07g00_2,2025-12-16,CS2,H6-206,80,39,CO3007(39),0.4875
16/12/2025_09g30_1,2025-12-16,CS1,B5-GD,130,93,"LA2017(41), MT1005(32), CO3059(20)",0.7153846153846154
16/12/2025_09g30_1,2025-12-16,CS1,B4-405,60,60,"LA2017(30), MT1005(30)",1.0
16/12/2025_09g30_1,2025-12-16,CS1,B4-302,60,55,"MT1005(29), LA2017(26)",0.9166666666666666
16/12/2025_09g30_1,2025-12-16,CS1,B4-303,60,29,MT1005(29),0.48333333333333334
16/12/2025_09g30_1,2025-12-16,CS1,B4-301,60,19,MT1005(19),0.31666666666666665
16/12/2025_09g30_2,2025-12-16,CS2,H6-GD,250,139,"MT1005(42), CO3059(40), CH4139(30), EE3121(27)",0.556
16/12/2025_09g30_2,2025-12-16,CS2,H6-113,129,62,"MT1005(41), CO3059(21)",0.4806201550387597
16/12/2025_09g30_2,2025-12-16,CS2,H6-109,80,40,MT1005(40),0.5
16/12/2025_09g30_2,2025-12-16,CS2,H6-112,80,40,MT1005(40),0.5
16/12/2025_09g30_2,2025-12-16,CS2,H6-201,120,40,MT1005(40),0.3333333333333333
16/12/2025_09g30_2,2025-12-16,CS2,H6-208,117,40,MT1005(40),0.3418803418803419
16/12/2025_09g30_2,2025-12-16,CS2,H6-210,80,40,MT1005(40),0.5
16/12/2025_09g30_2,2025-12-16,CS2,H6-305,129,40,MT1005(40),0.31007751937984496
16/12/2025_09g30_2,2025-12-16,CS2,H6-110,80,39,MT1005(39),0.4875
16/12/2025_09g30_2,2025-12-16,CS2,H6-206,80,39,MT1005(39),0.4875
16/12/2025_09g30_2,2025-12-16,CS2,H6-211,126,39,MT1005(39),0.30952380952380953
16/12/2025_09g30_2,2025-12-16,CS2,H6-214,80,39,MT1005(39),0.4875
16/12/2025_09g30_2,2025-12-16,CS2,H6-212,80,38,MT1005(38),0.475
16/12/2025_09g30_2,2025-12-16,CS2,H6-213,80,38,MT1005(38),0.475
16/12/2025_13g00_1,2025-12-16,CS1,B5-GD,130,88,"CO3017(44), SP1033(44)",0.676923076923077
16/12/2025_13g00_1,2025-12-16,CS1,B4-305,80,69,"SP1033(41), CO3017(28)",0.8625
16/12/2025_13g00_1,2025-12-16,CS1,B4-501,80,38,SP1033(38),0.475
16/12/2025_13g00_1,2025-12-16,CS1,B4-502,80,34,SP1033(34),0.425
16/12/2025_13g00_1,2025-12-16,CS1,B4-301,60,30,SP1033(30),0.5
16/12/2025_13g00_1,2025-12-16,CS1,B4-302,60,30,SP1033(30),0.5
16/12/2025_13g00_1,2025-12-16,CS1,B4-303,60,30,SP1033(30),0.5
16/12/2025_13g00_1,2025-12-16,CS1,B4-306,80,30,SP1033(30),0.375
16/12/2025_13g00_1,2025-12-16,CS1,B4-401,60,30,SP1033(30),0.5
16/12/2025_13g00_1,2025-12-16,CS1,B4-402,60,30,SP1033(30),0.5
16/12/2025_13g00_1,2025-12-16,CS1,B4-405,60,30,SP1033(30),0.5
16/12/2025_13g00_1,2025-12-16,CS1,B4-403,60,29,SP1033(29),0.48333333333333334
16/12/2025_13g00_1,2025-12-16,CS1,B4-504,60,29,SP1033(29),0.48333333333333334
16/12/2025_13g00_1,2025-12-16,CS1,B1-311,80,28,SP1033(28),0.35
16/12/2025_13g00_1,2025-12-16,CS1,B1-308,72,21,SP1033(21),0.2916666666666667
16/12/2025_13g00_1,2025-12-16,CS1,B1-309,56,20,SP1033(20),0.35714285714285715
16/12/2025_13g00_2,2025-12-16,CS2,H6-GD,250,211,"CI2145(47), SP1033(44), CO3017(40), EE3085(40), ME4533(40)",0.844
16/12/2025_13g00_2,2025-12-16,CS2,H2-205,117,117,"CI2145(40), CO3017(40), SP1033(37)",1.0
16/12/2025_13g00_2,2025-12-16,CS2,H6-109,80,79,"SP1033(40), CO3017(39)",0.9875
16/12/2025_13g00_2,2025-12-16,CS2,H6-113,129,81,"SP1033(40), ME4533(21), EE3085(20)",0.627906976744186
16/12/2025_13g00_2,2025-12-16,CS2,H6-201,120,40,SP1033(40),0.3333333333333333
16/12/2025_13g00_2,2025-12-16,CS2,H6-205,117,40,SP1033(40),0.3418803418803419
16/12/2025_13g00_2,2025-12-16,CS2,H6-206,80,40,SP1033(40),0.5
16/12/2025_13g00_2,2025-12-16,CS2,H6-210,80,40,SP1033(40),0.5
16/12/2025_13g00_2,2025-12-16,CS2,H6-311,135,40,SP1033(40),0.2962962962962963
16/12/2025_13g00_2,2025-12-16,CS2,H6-405,120,40,SP1033(40),0.3333333333333333
16/12/2025_13g00_2,2025-12-16,CS2,H6-412,123,40,SP1033(40),0.3252032520325203
16/12/2025_13g00_2,2025-12-16,CS2,H6-504,106,40,SP1033(40),0.37735849056603776
16/12/2025_13g00_2,2025-12-16,CS2,H6-506,105,40,SP1033(40),0.38095238095238093
16/12/2025_13g00_2,2025-12-16,CS2,H6-510,102,40,SP1033(40),0.39215686274509803
16/12/2025_13g00_2,2025-12-16,CS2,H6-512,105,40,SP1033(40),0.38095238095238093
16/12/2025_13g00_2,2025-12-16,CS2,H6-514,108,40,SP1033(40),0.37037037037037035
16/12/2025_13g00_2,2025-12-16,CS2,H6-516,114,40,SP1033(40),0.3508771929824561
16/12/2025_13g00_2,2025-12-16,CS2,H6-110,80,39,SP1033(39),0.4875
16/12/2025_13g00_2,2025-12-16,CS2,H6-112,80,39,SP1033(39),0.4875
16/12/2025_13g00_2,2025-12-16,CS2,H6-208,117,39,SP1033(39),0.3333333333333333
16/12/2025_13g00_2,2025-12-16,CS2,H6-212,80,39,SP1033(39),0.4875
16/12/2025_13g00_2,2025-12-16,CS2,H6-305,129,39,SP1033(39),0.3023255813953488
16/12/2025_13g00_2,2025-12-16,CS2,H6-310,80,39,SP1033(39),0.4875
16/12/2025_13g00_2,2025-12-16,CS2,H6-312,80,39,SP1033(39),0.4875
16/12/2025_13g00_2,2025-12-16,CS2,H6-313,80,39,SP1033(39),0.4875
16/12/2025_13g00_2,2025-12-16,CS2,H6-415,80,39,SP1033(39),0.4875
16/12/2025_13g00_2,2025-12-16,CS2,H6-413,80,36,SP1033(36),0.45
16/12/2025_15g30_1,2025-12-16,CS1,B5-GD,130,119,"ME4217(45), TR4085(42), CH3015(26), EE3009(6)",0.9153846153846154
16/12/2025_15g30_1,2025-12-16,CS1,B4-405,60,52,"ME4217(30), CH3015(22)",0.8666666666666667
16/12/2025_15g30_1,2025-12-16,CS1,B4-403,60,28,ME4217(28),0.4666666666666667
16/12/2025_15g30_2,2025-12-16,CS2,H6-GD,250,176,"EE3009(43), ME4217(40), TR4085(40), EE3007(27), CH3015(26)",0.704
16/12/2025_15g30_2,2025-12-16,CS2,H6-208,117,105,"ME4217(40), TR4085(40), CH3015(25)",0.8974358974358975
16/12/2025_15g30_2,2025-12-16,CS2,H6-113,129,126,"TR4085(40), EE3009(38), CH3015(25), ME4217(23)",0.9767441860465116
16/12/2025_15g30_2,2025-12-16,CS2,H6-112,80,63,"TR4085(38), CH3015(25)",0.7875
16/12/2025_15g30_2,2025-12-16,CS2,H6-506,105,24,CH3015(24),0.22857142857142856
17/12/2025_07g00_1,2025-12-17,CS1,B5-GD,130,130,"SP1007(43), CO3037(40), EE3091(36), MA4141(11)",1.0
17/12/2025_07g00_1,2025-12-17,CS1,B1-306,84,83,"SP1007(42), EE3091(36), MA4189(5)",0.9880952380952381
17/12/2025_07g00_1,2025-12-17,CS1,B6-306,80,68,"PH2005(35), SP1007(33)",0.85
17/12/2025_07g00_1,2025-12-17,CS1,B6-302,60,60,"PH2005(31), EE3091(29)",1.0
17/12/2025_07g00_1,2025-12-17,CS1,B1-212,72,61,"SP1007(31), CO3037(30)",0.8472222222222222
17/12/2025_07g00_1,2025-12-17,CS1,B1-213,72,61,"SP1007(31), EE3069(30)",0.8472222222222222
17/12/2025_07g00_1,2025-12-17,CS1,B6-303,60,60,"PH2005(30), SP1007(30)",1.0
17/12/2025_07g00_1,2025-12-17,CS1,B6-304,60,60,"PH2005(30), SP1007(30)",1.0
17/12/2025_07g00_1,2025-12-17,CS1,B6-305,60,60,"PH2005(30), SP1007(30)",1.0
17/12/2025_07g00_1,2025-12-17,CS1,B1-305,72,60,"SP1007(30), TR4081(30)",0.8333333333333334
17/12/2025_07g00_1,2025-12-17,CS1,B1-308,72,60,"SP1007(30), TR4089(30)",0.8333333333333334
17/12/2025_07g00_1,2025-12-17,CS1,B1-309,56,55,"SP1007(30), TR4047(25)",0.9821428571428571
17/12/2025_07g00_1,2025-12-17,CS1,B1-313,56,52,"SP1007(30), PH2005(22)",0.9285714285714286
17/12/2025_07g00_1,2025-12-17,CS1,B1-314,56,51,"SP1007(30), MA2015(21)",0.9107142857142857
17/12/2025_07g00_1,2025-12-17,CS1,B1-315,56,48,"SP1007(30), EE4451(18)",0.8571428571428571
17/12/2025_07g00_1,2025-12-17,CS1,B1-203,60,56,"SP1007(26), EE3043(15), IM4019(15)",0.9333333333333333
17/12/2025_07g00_1,2025-12-17,CS1,B4-302,60,43,"TR4089(15), EN3209(14), ME5005(14)",0.7166666666666667
17/12/2025_07g00_2,2025-12-17,CS2,H6-GD,250,250,"EE3069(55), SP1007(49), TR4089(46), EN3209(42), CI3241(41), TR3017(17)",1.0
17/12/2025_07g00_2,2025-12-17,CS2,H6-412,123,122,"SP1007(49), CI3241(40), ME3171(33)",0.991869918699187
17/12/2025_07g00_2,2025-12-17,CS2,H6-305,129,128,"SP1007(48), CI3241(40), CH3321(40)",0.9922480620155039
17/12/2025_07g00_2,2025-12-17,CS2,H6-311,135,128,"SP1007(48), EE3043(40), TR3017(40)",0.9481481481481482
17/12/2025_07g00_2,2025-12-17,CS2,H1-102,93,92,"SP1007(40), TR4089(40), CH3429(12)",0.989247311827957
17/12/2025_07g00_2,2025-12-17,CS2,H6-109,80,80,"SP1007(40), TR4089(40)",1.0
17/12/2025_07g00_2,2025-12-17,CS2,H6-110,80,79,"SP1007(40), TR4089(39)",0.9875
17/12/2025_07g00_2,2025-12-17,CS2,H6-112,80,76,"SP1007(40), IU2011(36)",0.95
17/12/2025_07g00_2,2025-12-17,CS2,H6-113,129,126,"SP1007(40), EE3043(35), MA4087(29), MA2015(22)",0.9767441860465116
17/12/2025_07g00_2,2025-12-17,CS2,H6-201,120,94,"SP1007(40), CI3067(26), IM4019(18), MA3011(10)",0.7833333333333333
17/12/2025_07g00_2,2025-12-17,CS2,H6-205,117,40,SP1007(40),0.3418803418803419
17/12/2025_07g00_2,2025-12-17,CS2,H6-206,80,40,SP1007(40),0.5
17/12/2025_07g00_2,2025-12-17,CS2,H6-208,117,40,SP1007(40),0.3418803418803419
17/12/2025_07g00_2,2025-12-17,CS2,H6-210,80,40,SP1007(40),0.5
17/12/2025_07g00_2,2025-12-17,CS2,H6-211,126,40,SP1007(40),0.31746031746031744
17/12/2025_07g00_2,2025-12-17,CS2,H6-212,80,40,SP1007(40),0.5
17/12/2025_07g00_2,2025-12-17,CS2,H6-213,80,40,SP1007(40),0.5
17/12/2025_07g00_2,2025-12-17,CS2,H6-214,80,40,SP1007(40),0.5
17/12/2025_07g00_2,2025-12-17,CS2,H6-306,80,40,SP1007(40),0.5
17/12/2025_07g00_2,2025-12-17,CS2,H6-312,80,40,SP1007(40),0.5
17/12/2025_07g00_2,2025-12-17,CS2,H6-313,80,40,SP1007(40),0.5
17/12/2025_07g00_2,2025-12-17,CS2,H6-405,120,40,SP1007(40),0.3333333333333333
17/12/2025_07g00_2,2025-12-17,CS2,H6-411,80,40,SP1007(40),0.5
17/12/2025_07g00_2,2025-12-17,CS2,H6-413,80,40,SP1007(40),0.5
17/12/2025_07g00_2,2025-12-17,CS2,H6-504,106,40,SP1007(40),0.37735849056603776
17/12/2025_07g00_2,2025-12-17,CS2,H6-506,105,40,SP1007(40),0.38095238095238093
17/12/2025_07g00_2,2025-12-17,CS2,H6-510,102,40,SP1007(40),0.39215686274509803
17/12/2025_07g00_2,2025-12-17,CS2,H6-512,105,40,SP1007(40),0.38095238095238093
17/12/2025_07g00_2,2025-12-17,CS2,H6-514,108,40,SP1007(40),0.37037037037037035
17/12/2025_07g00_2,2025-12-17,CS2,H6-516,114,40,SP1007(40),0.3508771929824561
17/12/2025_07g00_2,2025-12-17,CS2,H6-802,120,40,SP1007(40),0.3333333333333333
17/12/2025_07g00_2,2025-12-17,CS2,H6-810,120,40,SP1007(40),0.3333333333333333
17/12/2025_07g00_2,2025-12-17,CS2,H6-811,150,40,SP1007(40),0.26666666666666666
17/12/2025_07g00_2,2025-12-17,CS2,H1-101,138,39,SP1007(39),0.2826086956521739
17/12/2025_07g00_2,2025-12-17,CS2,H1-103,90,39,SP1007(39),0.43333333333333335
17/12/2025_07g00_2,2025-12-17,CS2,H1-104,138,39,SP1007(39),0.2826086956521739
17/12/2025_07g00_2,2025-12-17,CS2,H6-310,80,39,SP1007(39),0.4875
17/12/2025_07g00_2,2025-12-17,CS2,H6-414,80,39,SP1007(39),0.4875
17/12/2025_07g00_2,2025-12-17,CS2,H6-415,80,39,SP1007(39),0.4875
17/12/2025_13g00_1,2025-12-17,CS1,B5-GD,130,124,"CO2003(44), CH2013(42), EE2417(38)",0.9538461538461539
17/12/2025_13g00_1,2025-12-17,CS1,B1-306,84,77,"CO2003(39), ME2123(38)",0.9166666666666666
17/12/2025_13g00_1,2025-12-17,CS1,C5-303,80,73,"CI2095(37), CO3027(36)",0.9125
17/12/2025_13g00_1,2025-12-17,CS1,B4-502,80,71,"EE2417(36), CO1003(35)",0.8875
17/12/2025_13g00_1,2025-12-17,CS1,B4-305,80,66,"CH2013(35), CI2095(31)",0.825
17/12/2025_13g00_1,2025-12-17,CS1,B4-306,80,64,"CH2013(34), CO1003(30)",0.8
17/12/2025_13g00_1,2025-12-17,CS1,B4-302,60,60,"CO1003(30), CO2003(30)",1.0
17/12/2025_13g00_1,2025-12-17,CS1,B8-303,62,60,"CO1003(30), CO2003(30)",0.967741935483871
17/12/2025_13g00_1,2025-12-17,CS1,B1-308,72,60,"CO2003(30), CH2013(30)",0.8333333333333334
17/12/2025_13g00_1,2025-12-17,CS1,B1-309,56,56,"CO2003(30), CI2095(26)",1.0
17/12/2025_13g00_1,2025-12-17,CS1,B1-311,80,60,"CO2003(30), CH2013(30)",0.75
17/12/2025_13g00_1,2025-12-17,CS1,B1-313,56,54,"CO2003(30), CI1003(24)",0.9642857142857143
17/12/2025_13g00_1,2025-12-17,CS1,B1-314,56,54,"CO2003(30), CO1003(24)",0.9642857142857143
17/12/2025_13g00_1,2025-12-17,CS1,B4-403,60,60,"CH2013(30), EE2417(30)",1.0
17/12/2025_13g00_1,2025-12-17,CS1,B6-303,60,60,"EE2417(30), IM3087(30)",1.0
17/12/2025_13g00_1,2025-12-17,CS1,B6-304,60,60,"EE2417(30), ME2123(30)",1.0
17/12/2025_13g00_1,2025-12-17,CS1,B6-305,60,59,"EE2417(30), CO1003(29)",0.9833333333333333
17/12/2025_13g00_1,2025-12-17,CS1,B4-405,60,58,"CH2013(29), TR3143(29)",0.9666666666666667
17/12/2025_13g00_1,2025-12-17,CS1,B4-504,60,54,"EE2417(27), IM3087(27)",0.9
17/12/2025_13g00_1,2025-12-17,CS1,B1-206,48,45,"CO2003(24), ME3011(21)",0.9375
17/12/2025_13g00_1,2025-12-17,CS1,B1-210,48,35,"CO2003(24), CH2013(11)",0.7291666666666666
17/12/2025_13g00_1,2025-12-17,CS1,B1-214,48,24,CO2003(24),0.5
17/12/2025_13g00_2,2025-12-17,CS2,H6-GD,250,246,"ME3011(53), EE1007(48), CI2095(47), CO2003(44), IM3087(43), CI1003(11)",0.984
17/12/2025_13g00_2,2025-12-17,CS2,H6-305,129,123,"CO2003(42), CO3027(41), CI2095(40)",0.9534883720930233
17/12/2025_13g00_2,2025-12-17,CS2,H6-311,135,122,"CO2003(42), CI2095(40), CO1003(40)",0.9037037037037037
17/12/2025_13g00_2,2025-12-17,CS2,H6-412,123,122,"CO2003(42), CI2095(40), CO1003(40)",0.991869918699187
17/12/2025_13g00_2,2025-12-17,CS2,H6-405,120,120,"CO2003(41), CI2095(40), CO1003(39)",1.0
17/12/2025_13g00_2,2025-12-17,CS2,H6-211,126,120,"CI2095(40), CO1003(40), CO2003(40)",0.9523809523809523
17/12/2025_13g00_2,2025-12-17,CS2,H3-303,88,80,"CO1003(40), CO2003(40)",0.9090909090909091
17/12/2025_13g00_2,2025-12-17,CS2,H3-304,88,80,"CO1003(40), CO2003(40)",0.9090909090909091
17/12/2025_13g00_2,2025-12-17,CS2,H3-401,142,141,"CO1003(40), CO2003(40), CO3027(40), EE3167(21)",0.9929577464788732
17/12/2025_13g00_2,2025-12-17,CS2,H3-406,142,120,"CO1003(40), CO2003(40), CO3027(40)",0.8450704225352113
17/12/2025_13g00_2,2025-12-17,CS2,H2-401,156,155,"CH2013(40), EE3075(40), EE3167(40), CI1003(35)",0.9935897435897436
17/12/2025_13g00_2,2025-12-17,CS2,H2-403,93,80,"CH2013(40), IM3087(40)",0.8602150537634409
17/12/2025_13g00_2,2025-12-17,CS2,H2-406,156,155,"CH2013(40), IM3087(40), ME2123(40), CI1003(35)",0.9935897435897436
17/12/2025_13g00_2,2025-12-17,CS2,H6-514,108,105,"IM3087(40), ME2123(40), TR3143(25)",0.9722222222222222
17/12/2025_13g00_2,2025-12-17,CS2,H2-306,156,156,"TR3143(40), CI2095(39), CO1003(39), IM3087(38)",1.0
17/12/2025_13g00_2,2025-12-17,CS2,H6-112,80,78,"CI2095(39), CH2013(39)",0.975
17/12/2025_13g00_2,2025-12-17,CS2,H6-206,80,78,"CI2095(39), EE1007(39)",0.975
17/12/2025_13g00_2,2025-12-17,CS2,H6-212,80,78,"CI2095(39), ME2123(39)",0.975
17/12/2025_13g00_2,2025-12-17,CS2,H2-301,156,147,"TR3143(39), CI2095(37), ME2123(37), CH2013(34)",0.9423076923076923
17/12/2025_13g00_2,2025-12-17,CS2,H2-302,117,97,"TR3143(38), CH2013(30), EE3075(29)",0.8290598290598291
17/12/2025_13g00_2,2025-12-17,CS2,H2-304,93,65,"TR3143(37), IM3087(28)",0.6989247311827957
17/12/2025_15g30_1,2025-12-17,CS1,B5-GD,130,35,CH2045(35),0.2692307692307692
17/12/2025_15g30_2,2025-12-17,CS2,H6-GD,250,48,CH2045(48),0.192
18/12/2025_07g00_1,2025-12-18,CS1,B5-GD,130,129,"SP1039(44), ME1021(29), MA5023(22), CI4193(16), EE5015(14), LA1027(4)",0.9923076923076923
18/12/2025_07g00_1,2025-12-18,CS1,B4-406,108,37,SP1039(37),0.3425925925925926
18/12/2025_07g00_1,2025-12-18,CS1,B4-305,80,34,SP1039(34),0.425
18/12/2025_07g00_1,2025-12-18,CS1,B4-306,80,33,SP1039(33),0.4125
18/12/2025_07g00_1,2025-12-18,CS1,B4-301,60,30,SP1039(30),0.5
18/12/2025_07g00_1,2025-12-18,CS1,B4-302,60,30,SP1039(30),0.5
18/12/2025_07g00_1,2025-12-18,CS1,B4-303,60,30,SP1039(30),0.5
18/12/2025_07g00_1,2025-12-18,CS1,B4-401,60,30,SP1039(30),0.5
18/12/2025_07g00_1,2025-12-18,CS1,B4-402,60,30,SP1039(30),0.5
18/12/2025_07g00_1,2025-12-18,CS1,B4-405,60,30,SP1039(30),0.5
18/12/2025_07g00_1,2025-12-18,CS1,B4-501,80,30,SP1039(30),0.375
18/12/2025_07g00_1,2025-12-18,CS1,B4-502,80,30,SP1039(30),0.375
18/12/2025_07g00_1,2025-12-18,CS1,B4-403,60,29,SP1039(29),0.48333333333333334
18/12/2025_07g00_1,2025-12-18,CS1,B4-504,60,29,SP1039(29),0.48333333333333334
18/12/2025_07g00_1,2025-12-18,CS1,B1-210,48,20,SP1039(20),0.4166666666666667
18/12/2025_07g00_1,2025-12-18,CS1,B1-214,48,18,SP1039(18),0.375
18/12/2025_07g00_1,2025-12-18,CS1,B1-215,48,16,SP1039(16),0.3333333333333333
18/12/2025_07g00_2,2025-12-18,CS2,H6-GD,250,246,"SP1039(48), ME2059(45), CI2159(43), GE1027(40), IM3035(40), IU4021(30)",0.984
18/12/2025_07g00_2,2025-12-18,CS2,H2-302,117,116,"CI2159(40), GE1027(40), SP1039(36)",0.9914529914529915
18/12/2025_07g00_2,2025-12-18,CS2,H6-109,80,62,"SP1039(40), ME4083(22)",0.775
18/12/2025_07g00_2,2025-12-18,CS2,H6-110,80,61,"SP1039(40), GE1027(21)",0.7625
18/12/2025_07g00_2,2025-12-18,CS2,H6-112,80,61,"SP1039(40), IM3035(21)",0.7625
18/12/2025_07g00_2,2025-12-18,CS2,H6-113,129,40,SP1039(40),0.31007751937984496
18/12/2025_07g00_2,2025-12-18,CS2,H6-201,120,40,SP1039(40),0.3333333333333333
18/12/2025_07g00_2,2025-12-18,CS2,H6-205,117,40,SP1039(40),0.3418803418803419
18/12/2025_07g00_2,2025-12-18,CS2,H6-206,80,40,SP1039(40),0.5
18/12/2025_07g00_2,2025-12-18,CS2,H6-208,117,40,SP1039(40),0.3418803418803419
18/12/2025_07g00_2,2025-12-18,CS2,H6-211,126,40,SP1039(40),0.31746031746031744
18/12/2025_07g00_2,2025-12-18,CS2,H6-212,80,40,SP1039(40),0.5
18/12/2025_07g00_2,2025-12-18,CS2,H6-213,80,40,SP1039(40),0.5
18/12/2025_07g00_2,2025-12-18,CS2,H6-214,80,40,SP1039(40),0.5
18/12/2025_07g00_2,2025-12-18,CS2,H6-305,129,40,SP1039(40),0.31007751937984496
18/12/2025_07g00_2,2025-12-18,CS2,H6-306,80,40,SP1039(40),0.5
18/12/2025_07g00_2,2025-12-18,CS2,H6-308,144,40,SP1039(40),0.2777777777777778
18/12/2025_07g00_2,2025-12-18,CS2,H6-311,135,40,SP1039(40),0.2962962962962963
18/12/2025_07g00_2,2025-12-18,CS2,H6-405,120,40,SP1039(40),0.3333333333333333
18/12/2025_07g00_2,2025-12-18,CS2,H6-412,123,40,SP1039(40),0.3252032520325203
18/12/2025_07g00_2,2025-12-18,CS2,H6-504,106,40,SP1039(40),0.37735849056603776
18/12/2025_07g00_2,2025-12-18,CS2,H6-512,105,40,SP1039(40),0.38095238095238093
18/12/2025_07g00_2,2025-12-18,CS2,H6-514,108,40,SP1039(40),0.37037037037037035
18/12/2025_07g00_2,2025-12-18,CS2,H6-516,114,40,SP1039(40),0.3508771929824561
18/12/2025_07g00_2,2025-12-18,CS2,H6-810,120,40,SP1039(40),0.3333333333333333
18/12/2025_07g00_2,2025-12-18,CS2,H6-811,150,40,SP1039(40),0.26666666666666666
18/12/2025_07g00_2,2025-12-18,CS2,H6-210,80,39,SP1039(39),0.4875
18/12/2025_07g00_2,2025-12-18,CS2,H6-310,80,39,SP1039(39),0.4875
18/12/2025_07g00_2,2025-12-18,CS2,H6-312,80,39,SP1039(39),0.4875
18/12/2025_07g00_2,2025-12-18,CS2,H6-313,80,39,SP1039(39),0.4875
18/12/2025_07g00_2,2025-12-18,CS2,H6-506,105,39,SP1039(39),0.37142857142857144
18/12/2025_07g00_2,2025-12-18,CS2,H6-510,102,39,SP1039(39),0.38235294117647056
18/12/2025_07g00_2,2025-12-18,CS2,H6-411,80,38,SP1039(38),0.475
18/12/2025_09g30_1,2025-12-18,CS1,B5-GD,130,39,"IM1033(38), LA3019(1)",0.3
18/12/2025_09g30_1,2025-12-18,CS1,B4-402,60,30,IM1033(30),0.5
18/12/2025_09g30_1,2025-12-18,CS1,B4-403,60,30,IM1033(30),0.5
18/12/2025_09g30_1,2025-12-18,CS1,B4-405,60,30,IM1033(30),0.5
18/12/2025_09g30_2,2025-12-18,CS2,H6-GD,250,85,"IM1033(45), PH1005(40)",0.34
18/12/2025_09g30_2,2025-12-18,CS2,H6-208,117,80,"IM1033(44), PH1005(36)",0.6837606837606838
18/12/2025_09g30_2,2025-12-18,CS2,H6-206,80,59,"IM1033(40), PH1005(19)",0.7375
18/12/2025_09g30_2,2025-12-18,CS2,H6-210,80,40,IM1033(40),0.5
18/12/2025_13g00_1,2025-12-18,CS1,B5-GD,130,130,"EE2033(44), CO2007(43), EE2401(43)",1.0
18/12/2025_13g00_1,2025-12-18,CS1,B1-306,84,82,"CO2007(42), TR1003(40)",0.9761904761904762
18/12/2025_13g00_1,2025-12-18,CS1,B1-311,80,80,"CO2007(42), CI1007(38)",1.0
18/12/2025_13g00_1,2025-12-18,CS1,B1-212,72,64,"CO2007(32), EE2401(32)",0.8888888888888888
18/12/2025_13g00_1,2025-12-18,CS1,B4-501,80,80,"CI1007(30), CO2007(30), CO3137(20)",1.0
18/12/2025_13g00_1,2025-12-18,CS1,B1-302,56,56,"CO2007(30), EE2033(26)",1.0
18/12/2025_13g00_1,2025-12-18,CS1,B1-303,56,52,"CO2007(30), AS2059(22)",0.9285714285714286
18/12/2025_13g00_1,2025-12-18,CS1,B1-305,72,60,"CO2007(30), EE2033(30)",0.8333333333333334
18/12/2025_13g00_1,2025-12-18,CS1,B1-308,72,60,"CO2007(30), EE2033(30)",0.8333333333333334
18/12/2025_13g00_1,2025-12-18,CS1,B1-309,56,51,"CO2007(30), CI1007(21)",0.9107142857142857
18/12/2025_13g00_1,2025-12-18,CS1,B1-313,56,51,"CO2007(30), CH3327(21)",0.9107142857142857
18/12/2025_13g00_1,2025-12-18,CS1,B1-314,56,51,"CO2007(30), ME3009(21)",0.9107142857142857
18/12/2025_13g00_1,2025-12-18,CS1,B1-315,56,49,"CO2007(30), ME3009(19)",0.875
18/12/2025_13g00_1,2025-12-18,CS1,B4-401,60,60,"EE2033(30), EE2401(30)",1.0
18/12/2025_13g00_1,2025-12-18,CS1,B4-402,60,60,"EE2033(30), EE2401(30)",1.0
18/12/2025_13g00_1,2025-12-18,CS1,B4-403,60,60,"EE2033(30), EE2401(30)",1.0
18/12/2025_13g00_1,2025-12-18,CS1,B4-405,60,60,"EE2033(30), EE2401(30)",1.0
18/12/2025_13g00_1,2025-12-18,CS1,B6-305,60,60,"EE2401(30), ME4021(30)",1.0
18/12/2025_13g00_1,2025-12-18,CS1,C6-402,80,76,"TR1003(30), EE2033(27), ME4021(19)",0.95
18/12/2025_13g00_1,2025-12-18,CS1,B1-203,60,27,ME3009(27),0.45
18/12/2025_13g00_2,2025-12-18,CS2,H6-GD,250,249,"TR1003(55), ME4021(45), AS2059(41), CI1007(41), CO2007(40), CO3137(27)",0.996
18/12/2025_13g00_2,2025-12-18,CS2,H6-802,120,120,"CI1007(41), CO2007(40), ME4021(39)",1.0
18/12/2025_13g00_2,2025-12-18,CS2,H6-412,123,120,"CI1007(40), CO2007(40), EE2033(40)",0.975609756097561
18/12/2025_13g00_2,2025-12-18,CS2,H6-504,106,92,"CI1007(40), CO2007(40), CH3327(12)",0.8679245283018868
18/12/2025_13g00_2,2025-12-18,CS2,H6-506,105,80,"CI1007(40), CO2007(40)",0.7619047619047619
18/12/2025_13g00_2,2025-12-18,CS2,H6-514,108,107,"CI1007(40), CO2007(40), EE2033(27)",0.9907407407407407
18/12/2025_13g00_2,2025-12-18,CS2,H6-516,114,113,"CI1007(40), CO2007(40), EE2033(33)",0.9912280701754386
18/12/2025_13g00_2,2025-12-18,CS2,H6-810,120,120,"CI1007(40), EE2033(40), ME3009(40)",1.0
18/12/2025_13g00_2,2025-12-18,CS2,H6-112,80,80,"EE2033(40), ME3009(40)",1.0
18/12/2025_13g00_2,2025-12-18,CS2,H6-113,129,120,"EE2033(40), ME4021(40), TR1003(40)",0.9302325581395349
18/12/2025_13g00_2,2025-12-18,CS2,H6-201,120,119,"EE2033(40), TR1003(40), CO2007(39)",0.9916666666666667
18/12/2025_13g00_2,2025-12-18,CS2,H6-205,117,114,"EE2033(40), CO2007(39), CI1003(35)",0.9743589743589743
18/12/2025_13g00_2,2025-12-18,CS2,H6-206,80,79,"EE2033(40), CO2007(39)",0.9875
18/12/2025_13g00_2,2025-12-18,CS2,H6-208,117,109,"EE2033(40), CI1003(35), CI1007(34)",0.9316239316239316
18/12/2025_13g00_2,2025-12-18,CS2,H6-210,80,75,"EE2033(40), CI1003(35)",0.9375
18/12/2025_13g00_2,2025-12-18,CS2,H6-211,126,107,"EE2033(40), CI1007(34), ME4021(33)",0.8492063492063492
18/12/2025_13g00_2,2025-12-18,CS2,H6-212,80,74,"EE2033(40), CI1007(34)",0.925
18/12/2025_13g00_2,2025-12-18,CS2,H6-213,80,62,"EE2033(40), CI1007(22)",0.775
18/12/2025_13g00_2,2025-12-18,CS2,H6-214,80,40,EE2033(40),0.5
18/12/2025_13g00_2,2025-12-18,CS2,H6-305,129,40,EE2033(40),0.31007751937984496
18/12/2025_13g00_2,2025-12-18,CS2,H6-306,80,40,EE2033(40),0.5
18/12/2025_13g00_2,2025-12-18,CS2,H6-311,135,40,EE2033(40),0.2962962962962963
18/12/2025_13g00_2,2025-12-18,CS2,H6-312,80,31,EE2033(31),0.3875
18/12/2025_15g30_1,2025-12-18,CS1,B5-GD,130,59,"CO3065(30), CI4131(29)",0.45384615384615384
18/12/2025_15g30_1,2025-12-18,CS1,B4-302,60,44,"CO3065(27), CI4131(17)",0.7333333333333333
18/12/2025_15g30_2,2025-12-18,CS2,H6-GD,250,75,"CO3065(40), CI1003(35)",0.3
18/12/2025_15g30_2,2025-12-18,CS2,H6-113,129,73,"CO3065(40), CI1003(33)",0.5658914728682171
18/12/2025_15g30_2,2025-12-18,CS2,H6-110,80,39,CO3065(39),0.4875
19/12/2025_07g00_1,2025-12-19,CS1,B5-GD,130,128,"ME2141(43), IM3063(36), MA5015(27), AS2039(22)",0.9846153846153847
19/12/2025_07g00_1,2025-12-19,CS1,B4-303,60,58,"IM3063(31), EE3015(22), GE2059(5)",0.9666666666666667
19/12/2025_07g00_1,2025-12-19,CS1,B4-302,60,60,"IM3063(30), ME2141(30)",1.0
19/12/2025_07g00_1,2025-12-19,CS1,B4-401,60,44,"CH4113(19), AS3169(14), MA2039(11)",0.7333333333333333
19/12/2025_07g00_2,2025-12-19,CS2,H6-GD,250,235,"ME2161(53), AS3169(51), EE3205(48), AS2039(42), MA4069(41)",0.94
19/12/2025_07g00_2,2025-12-19,CS2,H6-312,80,80,"EE3205(42), EE3015(38)",1.0
19/12/2025_07g00_2,2025-12-19,CS2,H6-308,144,144,"CI3269(40), EE3015(40), EE3057(40), TR4001(24)",1.0
19/12/2025_07g00_2,2025-12-19,CS2,H6-313,80,80,"CI3269(40), EE3015(40)",1.0
19/12/2025_07g00_2,2025-12-19,CS2,H6-208,117,116,"EE3015(40), GE3105(40), ME2141(36)",0.9914529914529915
19/12/2025_07g00_2,2025-12-19,CS2,H6-210,80,80,"EE3015(40), IM3063(40)",1.0
19/12/2025_07g00_2,2025-12-19,CS2,H6-212,80,80,"IM3063(40), ME2141(40)",1.0
19/12/2025_07g00_2,2025-12-19,CS2,H6-305,129,116,"IM3063(40), ME2141(40), EE3015(36)",0.8992248062015504
19/12/2025_07g00_2,2025-12-19,CS2,H6-306,80,79,"IM3063(40), ME2141(39)",0.9875
19/12/2025_07g00_2,2025-12-19,CS2,H6-110,80,70,"EE3015(35), IU3061(35)",0.875
19/12/2025_07g00_2,2025-12-19,CS2,H6-213,80,66,"IM3063(34), GE2059(32)",0.825
19/12/2025_07g00_2,2025-12-19,CS2,H1-101,138,138,"EN3023(30), IM3063(30), CH4113(29), EE3015(26), ME2141(23)",1.0
19/12/2025_07g00_2,2025-12-19,CS2,H1-104,138,80,"CI3251(22), EE3057(20), GE3105(20), MA3103(18)",0.5797101449275363
19/12/2025_09g30_1,2025-12-19,CS1,B5-GD,130,77,"SP1031(45), TR3137(32)",0.5923076923076923
19/12/2025_09g30_1,2025-12-19,CS1,B4-406,108,45,"SP1031(39), TR3137(6)",0.4166666666666667
19/12/2025_09g30_1,2025-12-19,CS1,B1-208,84,37,SP1031(37),0.44047619047619047
19/12/2025_09g30_1,2025-12-19,CS1,B1-306,84,32,SP1031(32),0.38095238095238093
19/12/2025_09g30_1,2025-12-19,CS1,B1-212,72,30,SP1031(30),0.4166666666666667
19/12/2025_09g30_1,2025-12-19,CS1,B1-213,72,30,SP1031(30),0.4166666666666667
19/12/2025_09g30_1,2025-12-19,CS1,B1-301,56,30,SP1031(30),0.5357142857142857
19/12/2025_09g30_1,2025-12-19,CS1,B1-305,72,30,SP1031(30),0.4166666666666667
19/12/2025_09g30_1,2025-12-19,CS1,B1-308,72,30,SP1031(30),0.4166666666666667
19/12/2025_09g30_1,2025-12-19,CS1,B1-309,56,30,SP1031(30),0.5357142857142857
19/12/2025_09g30_1,2025-12-19,CS1,B1-311,80,30,SP1031(30),0.375
19/12/2025_09g30_1,2025-12-19,CS1,B1-313,56,30,SP1031(30),0.5357142857142857
19/12/2025_09g30_1,2025-12-19,CS1,B1-314,56,30,SP1031(30),0.5357142857142857
19/12/2025_09g30_1,2025-12-19,CS1,B1-315,56,30,SP1031(30),0.5357142857142857
19/12/2025_09g30_1,2025-12-19,CS1,B4-301,60,30,SP1031(30),0.5
19/12/2025_09g30_1,2025-12-19,CS1,B4-302,60,30,SP1031(30),0.5
19/12/2025_09g30_1,2025-12-19,CS1,B4-303,60,30,SP1031(30),0.5
19/12/2025_09g30_1,2025-12-19,CS1,B4-305,80,30,SP1031(30),0.375
19/12/2025_09g30_1,2025-12-19,CS1,B4-306,80,30,SP1031(30),0.375
19/12/2025_09g30_1,2025-12-19,CS1,B4-401,60,30,SP1031(30),0.5
19/12/2025_09g30_1,2025-12-19,CS1,B4-402,60,30,SP1031(30),0.5
19/12/2025_09g30_1,2025-12-19,CS1,B4-403,60,30,SP1031(30),0.5
19/12/2025_09g30_1,2025-12-19,CS1,B4-405,60,30,SP1031(30),0.5
19/12/2025_09g30_1,2025-12-19,CS1,B4-501,80,30,SP1031(30),0.375
19/12/2025_09g30_1,2025-12-19,CS1,B4-502,80,30,SP1031(30),0.375
19/12/2025_09g30_1,2025-12-19,CS1,B4-504,60,30,SP1031(30),0.5
19/12/2025_09g30_1,2025-12-19,CS1,B6-302,60,30,SP1031(30),0.5
19/12/2025_09g30_1,2025-12-19,CS1,B6-303,60,30,SP1031(30),0.5
19/12/2025_09g30_1,2025-12-19,CS1,B6-304,60,30,SP1031(30),0.5
19/12/2025_09g30_1,2025-12-19,CS1,B6-305,60,30,SP1031(30),0.5
19/12/2025_09g30_1,2025-12-19,CS1,B6-306,80,30,SP1031(30),0.375
19/12/2025_09g30_1,2025-12-19,CS1,B8-301,66,30,SP1031(30),0.45454545454545453
19/12/2025_09g30_1,2025-12-19,CS1,B8-303,62,30,SP1031(30),0.4838709677419355
19/12/2025_09g30_1,2025-12-19,CS1,B8-304,62,30,SP1031(30),0.4838709677419355
19/12/2025_09g30_1,2025-12-19,CS1,C6-401,80,30,SP1031(30),0.375
19/12/2025_09g30_1,2025-12-19,CS1,C6-402,80,30,SP1031(30),0.375
19/12/2025_09g30_1,2025-12-19,CS1,B1-302,56,29,SP1031(29),0.5178571428571429
19/12/2025_09g30_1,2025-12-19,CS1,B1-303,56,29,SP1031(29),0.5178571428571429
19/12/2025_09g30_2,2025-12-19,CS2,H6-GD,250,137,"TR3137(49), EE3099(48), SP1031(40)",0.548
19/12/2025_09g30_2,2025-12-19,CS2,H2-205,117,40,SP1031(40),0.3418803418803419
19/12/2025_09g30_2,2025-12-19,CS2,H2-207,135,40,SP1031(40),0.2962962962962963
19/12/2025_09g30_2,2025-12-19,CS2,H2-302,117,40,SP1031(40),0.3418803418803419
19/12/2025_09g30_2,2025-12-19,CS2,H2-304,93,40,SP1031(40),0.43010752688172044
19/12/2025_09g30_2,2025-12-19,CS2,H2-307,117,40,SP1031(40),0.3418803418803419
19/12/2025_09g30_2,2025-12-19,CS2,H2-403,93,40,SP1031(40),0.43010752688172044
19/12/2025_09g30_2,2025-12-19,CS2,H2-404,93,40,SP1031(40),0.43010752688172044
19/12/2025_09g30_2,2025-12-19,CS2,H2-406,156,40,SP1031(40),0.2564102564102564
19/12/2025_09g30_2,2025-12-19,CS2,H2-407,84,40,SP1031(40),0.47619047619047616
19/12/2025_09g30_2,2025-12-19,CS2,H6-109,80,40,SP1031(40),0.5
19/12/2025_09g30_2,2025-12-19,CS2,H6-110,80,40,SP1031(40),0.5
19/12/2025_09g30_2,2025-12-19,CS2,H6-112,80,40,SP1031(40),0.5
19/12/2025_09g30_2,2025-12-19,CS2,H6-113,129,40,SP1031(40),0.31007751937984496
19/12/2025_09g30_2,2025-12-19,CS2,H6-205,117,40,SP1031(40),0.3418803418803419
19/12/2025_09g30_2,2025-12-19,CS2,H6-206,80,40,SP1031(40),0.5
19/12/2025_09g30_2,2025-12-19,CS2,H6-208,117,40,SP1031(40),0.3418803418803419
19/12/2025_09g30_2,2025-12-19,CS2,H6-210,80,40,SP1031(40),0.5
19/12/2025_09g30_2,2025-12-19,CS2,H6-211,126,40,SP1031(40),0.31746031746031744
19/12/2025_09g30_2,2025-12-19,CS2,H6-213,80,40,SP1031(40),0.5
19/12/2025_09g30_2,2025-12-19,CS2,H6-214,80,40,SP1031(40),0.5
19/12/2025_09g30_2,2025-12-19,CS2,H6-305,129,40,SP1031(40),0.31007751937984496
19/12/2025_09g30_2,2025-12-19,CS2,H6-306,80,40,SP1031(40),0.5
19/12/2025_09g30_2,2025-12-19,CS2,H6-308,144,40,SP1031(40),0.2777777777777778
19/12/2025_09g30_2,2025-12-19,CS2,H6-310,80,40,SP1031(40),0.5
19/12/2025_09g30_2,2025-12-19,CS2,H6-311,135,40,SP1031(40),0.2962962962962963
19/12/2025_09g30_2,2025-12-19,CS2,H6-312,80,40,SP1031(40),0.5
19/12/2025_09g30_2,2025-12-19,CS2,H6-313,80,40,SP1031(40),0.5
19/12/2025_09g30_2,2025-12-19,CS2,H6-405,120,40,SP1031(40),0.3333333333333333
19/12/2025_09g30_2,2025-12-19,CS2,H6-411,80,40,SP1031(40),0.5
19/12/2025_09g30_2,2025-12-19,CS2,H6-412,123,40,SP1031(40),0.3252032520325203
19/12/2025_09g30_2,2025-12-19,CS2,H6-504,106,40,SP1031(40),0.37735849056603776
19/12/2025_09g30_2,2025-12-19,CS2,H6-506,105,40,SP1031(40),0.38095238095238093
19/12/2025_09g30_2,2025-12-19,CS2,H6-510,102,40,SP1031(40),0.39215686274509803
19/12/2025_09g30_2,2025-12-19,CS2,H6-512,105,40,SP1031(40),0.38095238095238093
19/12/2025_09g30_2,2025-12-19,CS2,H6-514,108,40,SP1031(40),0.37037037037037035
19/12/2025_09g30_2,2025-12-19,CS2,H6-516,114,40,SP1031(40),0.3508771929824561
19/12/2025_09g30_2,2025-12-19,CS2,H6-413,80,39,SP1031(39),0.4875
19/12/2025_09g30_2,2025-12-19,CS2,H6-414,80,39,SP1031(39),0.4875
19/12/2025_09g30_2,2025-12-19,CS2,H6-415,80,39,SP1031(39),0.4875
19/12/2025_09g30_2,2025-12-19,CS2,H6-802,120,39,SP1031(39),0.325
19/12/2025_09g30_2,2025-12-19,CS2,H6-810,120,37,SP1031(37),0.30833333333333335
19/12/2025_09g30_2,2025-12-19,CS2,H1-106,66,35,SP1031(35),0.5303030303030303
19/12/2025_09g30_2,2025-12-19,CS2,H2-305,63,34,SP1031(34),0.5396825396825397
19/12/2025_09g30_2,2025-12-19,CS2,H2-402,63,33,SP1031(33),0.5238095238095238
19/12/2025_09g30_2,2025-12-19,CS2,H2-405,63,27,SP1031(27),0.42857142857142855
19/12/2025_13g00_1,2025-12-19,CS1,B5-GD,130,127,"CO3053(46), IM2017(43), EE2021(38)",0.9769230769230769
19/12/2025_13g00_1,2025-12-19,CS1,B1-311,80,75,"IM2017(40), CH2051(35)",0.9375
19/12/2025_13g00_1,2025-12-19,CS1,B4-406,108,106,"ME2009(34), CH2051(32), EE2021(31), CI2133(9)",0.9814814814814815
19/12/2025_13g00_1,2025-12-19,CS1,B4-501,80,75,"ME2009(32), TR3145(31), CO3053(12)",0.9375
19/12/2025_13g00_1,2025-12-19,CS1,B4-302,60,60,"CH2051(30), EE2021(30)",1.0
19/12/2025_13g00_1,2025-12-19,CS1,B4-303,60,60,"CH2051(30), EE2021(30)",1.0
19/12/2025_13g00_1,2025-12-19,CS1,B1-309,56,56,"IM2017(30), CH2051(26)",1.0
19/12/2025_13g00_1,2025-12-19,CS1,B4-405,60,59,"ME2009(30), CH2051(29)",0.9833333333333333
19/12/2025_13g00_1,2025-12-19,CS1,B4-504,60,53,"ME2009(30), CI2133(23)",0.8833333333333333
19/12/2025_13g00_1,2025-12-19,CS1,B4-402,60,51,"ME2009(29), EE2021(22)",0.85
19/12/2025_13g00_1,2025-12-19,CS1,B4-401,60,44,"ME2009(26), CI1033(18)",0.7333333333333333
19/12/2025_13g00_2,2025-12-19,CS2,H6-GD,250,249,"TR3145(45), CI2133(44), CO3053(40), CH2051(40), EE2021(40), EE3041(40)",0.996
19/12/2025_13g00_2,2025-12-19,CS2,H1-104,138,133,"CI2133(41), TR3145(41), CO3053(40), CI1033(11)",0.9637681159420289
19/12/2025_13g00_2,2025-12-19,CS2,H6-504,106,106,"CI2133(41), CO3053(40), ME2009(25)",1.0
19/12/2025_13g00_2,2025-12-19,CS2,H6-506,105,101,"CI2133(41), CO3053(40), EE2021(20)",0.9619047619047619
19/12/2025_13g00_2,2025-12-19,CS2,H6-512,105,99,"CI2133(40), CH2051(40), TR3145(19)",0.9428571428571428
19/12/2025_13g00_2,2025-12-19,CS2,H2-304,93,80,"CH2051(40), EE2021(40)",0.8602150537634409
19/12/2025_13g00_2,2025-12-19,CS2,H2-307,117,115,"CH2051(40), EE2021(40), CI1033(35)",0.9829059829059829
19/12/2025_13g00_2,2025-12-19,CS2,H6-205,117,117,"EE2021(40), IM2017(40), CH2051(37)",1.0
19/12/2025_13g00_2,2025-12-19,CS2,H6-208,117,115,"EE2021(40), IM2017(40), CI1033(35)",0.9829059829059829
19/12/2025_13g00_2,2025-12-19,CS2,H6-211,126,120,"EE2021(40), IM2017(40), ME2009(40)",0.9523809523809523
19/12/2025_13g00_2,2025-12-19,CS2,H6-308,144,137,"ME2009(40), TR3145(40), CI2133(39), CO3053(18)",0.9513888888888888
19/12/2025_13g00_2,2025-12-19,CS2,H6-310,80,79,"ME2009(40), CI2133(39)",0.9875
19/12/2025_13g00_2,2025-12-19,CS2,H6-405,120,116,"ME2009(40), CO3053(38), IM2017(38)",0.9666666666666667
19/12/2025_13g00_2,2025-12-19,CS2,H6-412,123,110,"ME2009(40), TR3145(38), EE2021(32)",0.8943089430894309
19/12/2025_13g00_2,2025-12-19,CS2,H6-312,80,71,"ME2009(39), EE2021(32)",0.8875
19/12/2025_13g00_2,2025-12-19,CS2,H6-313,80,66,"ME2009(35), EE2021(31)",0.825
19/12/2025_13g00_2,2025-12-19,CS2,H6-413,80,63,"ME2009(32), EE2021(31)",0.7875
19/12/2025_13g00_2,2025-12-19,CS2,H6-212,80,79,"EE2021(31), CH2051(30), EE3041(18)",0.9875
19/12/2025_13g00_2,2025-12-19,CS2,H6-414,80,28,ME2009(28),0.35
19/12/2025_15g30_1,2025-12-19,CS1,B5-GD,130,32,CO3015(32),0.24615384615384617
19/12/2025_15g30_1,2025-12-19,CS1,B4-402,60,30,CO3015(30),0.5
19/12/2025_15g30_2,2025-12-19,CS2,H6-GD,250,40,CO3015(40),0.16
19/12/2025_15g30_2,2025-12-19,CS2,H6-110,80,40,CO3015(40),0.5
19/12/2025_15g30_2,2025-12-19,CS2,H6-113,129,40,CO3015(40),0.31007751937984496
19/12/2025_15g30_2,2025-12-19,CS2,H6-112,80,37,CO3015(37),0.4625
20/12/2025_07g00_2,2025-12-20,CS2,H6-GD,250,66,"LA1057(38), LA1041(28)",0.264
20/12/2025_09g30_1,2025-12-20,CS1,B5-GD,130,19,LA1043(19),0.14615384615384616
20/12/2025_09g30_2,2025-12-20,CS2,H6-GD,250,25,LA1043(25),0.1
20/12/2025_09g30_2,2025-12-20,CS2,H6-113,129,25,LA1043(25),0.1937984496124031
22/12/2025_07g00_1,2025-12-22,CS1,B5-GD,130,125,"PH1003(46), PH1011(38), IM3021(30), CI2139(11)",0.9615384615384616
22/12/2025_07g00_1,2025-12-22,CS1,B4-501,80,72,"PH1003(42), PH1011(30)",0.9
22/12/2025_07g00_1,2025-12-22,CS1,B4-502,80,71,"PH1003(41), PH1011(30)",0.8875
22/12/2025_07g00_1,2025-12-22,CS1,B1-208,84,69,"PH1003(39), PH1011(30)",0.8214285714285714
22/12/2025_07g00_1,2025-12-22,CS1,B1-306,84,69,"PH1003(39), PH1011(30)",0.8214285714285714
22/12/2025_07g00_1,2025-12-22,CS1,B1-311,80,66,"PH1003(39), PH1011(27)",0.825
22/12/2025_07g00_1,2025-12-22,CS1,B4-305,80,64,"PH1003(39), CI2139(25)",0.8
22/12/2025_07g00_1,2025-12-22,CS1,B4-306,80,39,PH1003(39),0.4875
22/12/2025_07g00_1,2025-12-22,CS1,B4-505,120,39,PH1003(39),0.325
22/12/2025_07g00_1,2025-12-22,CS1,B1-305,72,38,PH1003(38),0.5277777777777778
22/12/2025_07g00_1,2025-12-22,CS1,B1-212,72,37,PH1003(37),0.5138888888888888
22/12/2025_07g00_1,2025-12-22,CS1,B1-213,72,36,PH1003(36),0.5
22/12/2025_07g00_1,2025-12-22,CS1,B6-306,80,35,PH1003(35),0.4375
22/12/2025_07g00_1,2025-12-22,CS1,C4-301,80,35,PH1003(35),0.4375
22/12/2025_07g00_1,2025-12-22,CS1,C4-502,80,35,PH1003(35),0.4375
22/12/2025_07g00_1,2025-12-22,CS1,C4-304,80,34,PH1003(34),0.425
22/12/2025_07g00_1,2025-12-22,CS1,C4-402,80,34,PH1003(34),0.425
22/12/2025_07g00_1,2025-12-22,CS1,C4-403,80,34,PH1003(34),0.425
22/12/2025_07g00_1,2025-12-22,CS1,C5-303,80,32,PH1003(32),0.4
22/12/2025_07g00_1,2025-12-22,CS1,C5-401,80,31,PH1003(31),0.3875
22/12/2025_07g00_1,2025-12-22,CS1,C5-403,80,31,PH1003(31),0.3875
22/12/2025_07g00_1,2025-12-22,CS1,B1-301,56,30,PH1003(30),0.5357142857142857
22/12/2025_07g00_1,2025-12-22,CS1,B1-302,56,30,PH1003(30),0.5357142857142857
22/12/2025_07g00_1,2025-12-22,CS1,B1-303,56,30,PH1003(30),0.5357142857142857
22/12/2025_07g00_1,2025-12-22,CS1,B1-308,72,30,PH1003(30),0.4166666666666667
22/12/2025_07g00_1,2025-12-22,CS1,B1-309,56,30,PH1003(30),0.5357142857142857
22/12/2025_07g00_1,2025-12-22,CS1,B1-313,56,30,PH1003(30),0.5357142857142857
22/12/2025_07g00_1,2025-12-22,CS1,B1-314,56,30,PH1003(30),0.5357142857142857
22/12/2025_07g00_1,2025-12-22,CS1,B1-315,56,30,PH1003(30),0.5357142857142857
22/12/2025_07g00_1,2025-12-22,CS1,B4-401,60,30,PH1003(30),0.5
22/12/2025_07g00_1,2025-12-22,CS1,B4-402,60,30,PH1003(30),0.5
22/12/2025_07g00_1,2025-12-22,CS1,B4-403,60,30,PH1003(30),0.5
22/12/2025_07g00_1,2025-12-22,CS1,B4-405,60,30,PH1003(30),0.5
22/12/2025_07g00_1,2025-12-22,CS1,B4-504,60,30,PH1003(30),0.5
22/12/2025_07g00_1,2025-12-22,CS1,B6-302,60,30,PH1003(30),0.5
22/12/2025_07g00_1,2025-12-22,CS1,B6-303,60,30,PH1003(30),0.5
22/12/2025_07g00_1,2025-12-22,CS1,B6-304,60,30,PH1003(30),0.5
22/12/2025_07g00_1,2025-12-22,CS1,B6-305,60,30,PH1003(30),0.5
22/12/2025_07g00_1,2025-12-22,CS1,B8-301,66,30,PH1003(30),0.45454545454545453
22/12/2025_07g00_1,2025-12-22,CS1,B8-303,62,30,PH1003(30),0.4838709677419355
22/12/2025_07g00_1,2025-12-22,CS1,B8-304,62,30,PH1003(30),0.4838709677419355
22/12/2025_07g00_1,2025-12-22,CS1,C5-502,80,30,PH1003(30),0.375
22/12/2025_07g00_1,2025-12-22,CS1,C5-503,80,30,PH1003(30),0.375
22/12/2025_07g00_1,2025-12-22,CS1,B4-301,60,29,PH1003(29),0.48333333333333334
22/12/2025_07g00_1,2025-12-22,CS1,B4-302,60,29,PH1003(29),0.48333333333333334
22/12/2025_07g00_1,2025-12-22,CS1,B4-303,60,29,PH1003(29),0.48333333333333334
22/12/2025_07g00_2,2025-12-22,CS2,H6-GD,250,148,"PH1003(53), CI2139(48), IM3021(47)",0.592
22/12/2025_07g00_2,2025-12-22,CS2,H6-810,120,115,"PH1003(49), CI2139(46), IM3021(20)",0.9583333333333334
22/12/2025_07g00_2,2025-12-22,CS2,H3-301,142,130,"CI2139(45), PH1003(45), IM3021(40)",0.9154929577464789
22/12/2025_07g00_2,2025-12-22,CS2,H6-412,123,122,"PH1003(44), CI2139(40), IM3021(38)",0.991869918699187
22/12/2025_07g00_2,2025-12-22,CS2,H6-201,120,82,"PH1003(42), CI2139(40)",0.6833333333333333
22/12/2025_07g00_2,2025-12-22,CS2,H6-311,135,82,"PH1003(42), CI2139(40)",0.6074074074074074
22/12/2025_07g00_2,2025-12-22,CS2,H2-201,156,40,PH1003(40),0.2564102564102564
22/12/2025_07g00_2,2025-12-22,CS2,H2-202,117,40,PH1003(40),0.3418803418803419
22/12/2025_07g00_2,2025-12-22,CS2,H2-205,117,40,PH1003(40),0.3418803418803419
22/12/2025_07g00_2,2025-12-22,CS2,H2-206,156,40,PH1003(40),0.2564102564102564
22/12/2025_07g00_2,2025-12-22,CS2,H2-207,135,40,PH1003(40),0.2962962962962963
22/12/2025_07g00_2,2025-12-22,CS2,H2-301,156,40,PH1003(40),0.2564102564102564
22/12/2025_07g00_2,2025-12-22,CS2,H2-302,117,40,PH1003(40),0.3418803418803419
22/12/2025_07g00_2,2025-12-22,CS2,H2-304,93,40,PH1003(40),0.43010752688172044
22/12/2025_07g00_2,2025-12-22,CS2,H2-306,156,40,PH1003(40),0.2564102564102564
22/12/2025_07g00_2,2025-12-22,CS2,H2-307,117,40,PH1003(40),0.3418803418803419
22/12/2025_07g00_2,2025-12-22,CS2,H2-401,156,40,PH1003(40),0.2564102564102564
22/12/2025_07g00_2,2025-12-22,CS2,H2-403,93,40,PH1003(40),0.43010752688172044
22/12/2025_07g00_2,2025-12-22,CS2,H2-404,93,40,PH1003(40),0.43010752688172044
22/12/2025_07g00_2,2025-12-22,CS2,H2-406,156,40,PH1003(40),0.2564102564102564
22/12/2025_07g00_2,2025-12-22,CS2,H2-407,84,40,PH1003(40),0.47619047619047616
22/12/2025_07g00_2,2025-12-22,CS2,H6-109,80,40,PH1003(40),0.5
22/12/2025_07g00_2,2025-12-22,CS2,H6-110,80,40,PH1003(40),0.5
22/12/2025_07g00_2,2025-12-22,CS2,H6-112,80,40,PH1003(40),0.5
22/12/2025_07g00_2,2025-12-22,CS2,H6-113,129,40,PH1003(40),0.31007751937984496
22/12/2025_07g00_2,2025-12-22,CS2,H6-205,117,40,PH1003(40),0.3418803418803419
22/12/2025_07g00_2,2025-12-22,CS2,H6-206,80,40,PH1003(40),0.5
22/12/2025_07g00_2,2025-12-22,CS2,H6-208,117,40,PH1003(40),0.3418803418803419
22/12/2025_07g00_2,2025-12-22,CS2,H6-210,80,40,PH1003(40),0.5
22/12/2025_07g00_2,2025-12-22,CS2,H6-211,126,40,PH1003(40),0.31746031746031744
22/12/2025_07g00_2,2025-12-22,CS2,H6-212,80,40,PH1003(40),0.5
22/12/2025_07g00_2,2025-12-22,CS2,H6-214,80,40,PH1003(40),0.5
22/12/2025_07g00_2,2025-12-22,CS2,H6-305,129,40,PH1003(40),0.31007751937984496
22/12/2025_07g00_2,2025-12-22,CS2,H6-306,80,40,PH1003(40),0.5
22/12/2025_07g00_2,2025-12-22,CS2,H6-308,144,40,PH1003(40),0.2777777777777778
22/12/2025_07g00_2,2025-12-22,CS2,H6-405,120,40,PH1003(40),0.3333333333333333
22/12/2025_07g00_2,2025-12-22,CS2,H6-504,106,40,PH1003(40),0.37735849056603776
22/12/2025_07g00_2,2025-12-22,CS2,H6-506,105,40,PH1003(40),0.38095238095238093
22/12/2025_07g00_2,2025-12-22,CS2,H6-510,102,40,PH1003(40),0.39215686274509803
22/12/2025_07g00_2,2025-12-22,CS2,H6-512,105,40,PH1003(40),0.38095238095238093
22/12/2025_07g00_2,2025-12-22,CS2,H6-514,108,40,PH1003(40),0.37037037037037035
22/12/2025_07g00_2,2025-12-22,CS2,H6-516,114,40,PH1003(40),0.3508771929824561
22/12/2025_07g00_2,2025-12-22,CS2,H6-213,80,39,PH1003(39),0.4875
22/12/2025_07g00_2,2025-12-22,CS2,H6-310,80,39,PH1003(39),0.4875
22/12/2025_07g00_2,2025-12-22,CS2,H6-312,80,39,PH1003(39),0.4875
22/12/2025_07g00_2,2025-12-22,CS2,H6-313,80,37,PH1003(37),0.4625
22/12/2025_07g00_2,2025-12-22,CS2,H6-411,80,37,PH1003(37),0.4625
22/12/2025_07g00_2,2025-12-22,CS2,H6-413,80,35,PH1003(35),0.4375
22/12/2025_07g00_2,2025-12-22,CS2,H6-414,80,32,PH1003(32),0.4
22/12/2025_09g30_1,2025-12-22,CS1,B5-GD,130,76,"PH1003(39), IM1003(37)",0.5846153846153846
22/12/2025_09g30_1,2025-12-22,CS1,B4-305,80,62,"IM1003(31), PH1003(31)",0.775
22/12/2025_09g30_1,2025-12-22,CS1,B6-303,60,60,"PH1003(31), IM1003(29)",1.0
22/12/2025_09g30_1,2025-12-22,CS1,B4-302,60,60,"IM1003(30), PH1003(30)",1.0
22/12/2025_09g30_1,2025-12-22,CS1,B6-305,60,53,"PH1003(30), IM1003(23)",0.8833333333333333
22/12/2025_09g30_1,2025-12-22,CS1,B6-301,50,17,PH1003(17),0.34
22/12/2025_09g30_2,2025-12-22,CS2,H6-GD,250,133,"IM1003(52), PH1003(46), CI1003(35)",0.532
22/12/2025_09g30_2,2025-12-22,CS2,H3-306,142,107,"IM1003(49), PH1003(46), CI1003(12)",0.7535211267605634
22/12/2025_09g30_2,2025-12-22,CS2,H2-205,117,85,"PH1003(45), IM1003(40)",0.7264957264957265
22/12/2025_09g30_2,2025-12-22,CS2,H2-206,156,43,PH1003(43),0.27564102564102566
22/12/2025_09g30_2,2025-12-22,CS2,H2-207,135,43,PH1003(43),0.31851851851851853
22/12/2025_09g30_2,2025-12-22,CS2,H2-301,156,40,PH1003(40),0.2564102564102564
22/12/2025_09g30_2,2025-12-22,CS2,H2-302,117,40,PH1003(40),0.3418803418803419
22/12/2025_09g30_2,2025-12-22,CS2,H2-304,93,40,PH1003(40),0.43010752688172044
22/12/2025_09g30_2,2025-12-22,CS2,H2-306,156,40,PH1003(40),0.2564102564102564
22/12/2025_09g30_2,2025-12-22,CS2,H2-401,156,40,PH1003(40),0.2564102564102564
22/12/2025_09g30_2,2025-12-22,CS2,H2-403,93,40,PH1003(40),0.43010752688172044
22/12/2025_09g30_2,2025-12-22,CS2,H2-404,93,40,PH1003(40),0.43010752688172044
22/12/2025_09g30_2,2025-12-22,CS2,H2-406,156,40,PH1003(40),0.2564102564102564
22/12/2025_09g30_2,2025-12-22,CS2,H2-407,84,40,PH1003(40),0.47619047619047616
22/12/2025_09g30_2,2025-12-22,CS2,H6-109,80,40,PH1003(40),0.5
22/12/2025_09g30_2,2025-12-22,CS2,H6-110,80,40,PH1003(40),0.5
22/12/2025_09g30_2,2025-12-22,CS2,H6-112,80,40,PH1003(40),0.5
22/12/2025_09g30_2,2025-12-22,CS2,H6-113,129,40,PH1003(40),0.31007751937984496
22/12/2025_09g30_2,2025-12-22,CS2,H6-201,120,40,PH1003(40),0.3333333333333333
22/12/2025_09g30_2,2025-12-22,CS2,H6-205,117,40,PH1003(40),0.3418803418803419
22/12/2025_09g30_2,2025-12-22,CS2,H6-206,80,40,PH1003(40),0.5
22/12/2025_09g30_2,2025-12-22,CS2,H6-208,117,40,PH1003(40),0.3418803418803419
22/12/2025_09g30_2,2025-12-22,CS2,H6-211,126,40,PH1003(40),0.31746031746031744
22/12/2025_09g30_2,2025-12-22,CS2,H6-305,129,40,PH1003(40),0.31007751937984496
22/12/2025_09g30_2,2025-12-22,CS2,H6-308,144,40,PH1003(40),0.2777777777777778
22/12/2025_09g30_2,2025-12-22,CS2,H6-311,135,40,PH1003(40),0.2962962962962963
22/12/2025_09g30_2,2025-12-22,CS2,H6-312,80,40,PH1003(40),0.5
22/12/2025_09g30_2,2025-12-22,CS2,H6-313,80,40,PH1003(40),0.5
22/12/2025_09g30_2,2025-12-22,CS2,H6-504,106,40,PH1003(40),0.37735849056603776
22/12/2025_09g30_2,2025-12-22,CS2,H6-506,105,40,PH1003(40),0.38095238095238093
22/12/2025_09g30_2,2025-12-22,CS2,H6-512,105,40,PH1003(40),0.38095238095238093
22/12/2025_09g30_2,2025-12-22,CS2,H6-514,108,40,PH1003(40),0.37037037037037035
22/12/2025_09g30_2,2025-12-22,CS2,H6-516,114,40,PH1003(40),0.3508771929824561
22/12/2025_09g30_2,2025-12-22,CS2,H2-307,117,39,PH1003(39),0.3333333333333333
22/12/2025_09g30_2,2025-12-22,CS2,H6-210,80,39,PH1003(39),0.4875
22/12/2025_09g30_2,2025-12-22,CS2,H6-212,80,39,PH1003(39),0.4875
22/12/2025_09g30_2,2025-12-22,CS2,H6-213,80,39,PH1003(39),0.4875
22/12/2025_09g30_2,2025-12-22,CS2,H6-214,80,39,PH1003(39),0.4875
22/12/2025_09g30_2,2025-12-22,CS2,H6-306,80,39,PH1003(39),0.4875
22/12/2025_09g30_2,2025-12-22,CS2,H6-310,80,39,PH1003(39),0.4875
22/12/2025_09g30_2,2025-12-22,CS2,H6-405,120,39,PH1003(39),0.325
22/12/2025_09g30_2,2025-12-22,CS2,H6-510,102,39,PH1003(39),0.38235294117647056
22/12/2025_09g30_2,2025-12-22,CS2,H6-411,80,32,PH1003(32),0.4
22/12/2025_09g30_2,2025-12-22,CS2,H2-402,63,29,PH1003(29),0.4603174603174603
22/12/2025_09g30_2,2025-12-22,CS2,H2-405,63,28,PH1003(28),0.4444444444444444
22/12/2025_09g30_2,2025-12-22,CS2,H2-305,63,10,PH1003(10),0.15873015873015872
22/12/2025_13g00_1,2025-12-22,CS1,B5-GD,130,129,"EE3413(45), ME3015(44), CO3045(40)",0.9923076923076923
22/12/2025_13g00_1,2025-12-22,CS1,B1-311,80,77,"ME4631(39), AS2071(38)",0.9625
22/12/2025_13g00_1,2025-12-22,CS1,B4-406,108,104,"AS2071(37), EE4441(34), CH4051(33)",0.9629629629629629
22/12/2025_13g00_1,2025-12-22,CS1,B4-502,80,66,"AS2071(36), CH4051(30)",0.825
22/12/2025_13g00_1,2025-12-22,CS1,B4-501,80,80,"AS2071(35), CH4051(30), CH3021(15)",1.0
22/12/2025_13g00_1,2025-12-22,CS1,B1-305,72,71,"EE3413(30), CH4051(26), MA3111(15)",0.9861111111111112
22/12/2025_13g00_1,2025-12-22,CS1,B4-301,60,47,"TR3003(24), CH4051(23)",0.7833333333333333
22/12/2025_13g00_1,2025-12-22,CS1,B4-504,60,49,"AS2071(19), MA4169(15), ME3015(15)",0.8166666666666667
22/12/2025_13g00_2,2025-12-22,CS2,H6-GD,250,248,"ME3015(52), CH4051(49), CH3021(44), EE3203(44), AS2071(40), IM3029(19)",0.992
22/12/2025_13g00_2,2025-12-22,CS2,H6-208,117,116,"CH4051(47), CO3045(40), ME3215(29)",0.9914529914529915
22/12/2025_13g00_2,2025-12-22,CS2,H6-312,80,80,"CO3045(40), CH3021(40)",1.0
22/12/2025_13g00_2,2025-12-22,CS2,H6-201,120,120,"CH4051(40), EE3071(40), MA4091(40)",1.0
22/12/2025_13g00_2,2025-12-22,CS2,H6-205,117,117,"CH4051(40), EE3071(40), CI1069(37)",1.0
22/12/2025_13g00_2,2025-12-22,CS2,H6-206,80,80,"CH4051(40), EE3071(40)",1.0
22/12/2025_13g00_2,2025-12-22,CS2,H6-412,123,118,"ME3299(40), AS2071(39), IM3029(39)",0.959349593495935
22/12/2025_13g00_2,2025-12-22,CS2,H6-109,80,73,"EE3027(37), EE3203(36)",0.9125
22/12/2025_13g00_2,2025-12-22,CS2,H6-411,80,78,"ME3299(36), GE3219(34), ME3031(8)",0.975
22/12/2025_13g00_2,2025-12-22,CS2,H6-210,80,78,"CH4051(30), TR3061(29), MA4091(19)",0.975
22/12/2025_13g00_2,2025-12-22,CS2,H6-214,80,80,"AS2071(27), IU4025(27), MA2013(26)",1.0
22/12/2025_13g00_2,2025-12-22,CS2,H6-512,105,57,"IM2031(24), CI1069(18), CI3301(15)",0.5428571428571428
22/12/2025_15g30_1,2025-12-22,CS1,B5-GD,130,33,LA1007(33),0.25384615384615383
22/12/2025_15g30_1,2025-12-22,CS1,B4-306,80,31,LA1007(31),0.3875
22/12/2025_15g30_1,2025-12-22,CS1,B4-303,60,29,LA1007(29),0.48333333333333334
22/12/2025_15g30_2,2025-12-22,CS2,H6-GD,250,46,LA1007(46),0.184
22/12/2025_15g30_2,2025-12-22,CS2,H6-211,126,45,LA1007(45),0.35714285714285715
22/12/2025_15g30_2,2025-12-22,CS2,H6-305,129,45,LA1007(45),0.3488372093023256
22/12/2025_15g30_2,2025-12-22,CS2,H6-113,129,43,LA1007(43),0.3333333333333333
22/12/2025_15g30_2,2025-12-22,CS2,H6-205,117,40,LA1007(40),0.3418803418803419
22/12/2025_15g30_2,2025-12-22,CS2,H6-208,117,40,LA1007(40),0.3418803418803419
22/12/2025_15g30_2,2025-12-22,CS2,H6-308,144,40,LA1007(40),0.2777777777777778
22/12/2025_15g30_2,2025-12-22,CS2,H6-504,106,40,LA1007(40),0.37735849056603776
22/12/2025_15g30_2,2025-12-22,CS2,H6-506,105,40,LA1007(40),0.38095238095238093
22/12/2025_15g30_2,2025-12-22,CS2,H6-510,102,40,LA1007(40),0.39215686274509803
22/12/2025_15g30_2,2025-12-22,CS2,H6-514,108,40,LA1007(40),0.37037037037037035
22/12/2025_15g30_2,2025-12-22,CS2,H6-516,114,40,LA1007(40),0.3508771929824561
22/12/2025_15g30_2,2025-12-22,CS2,H6-512,105,39,LA1007(39),0.37142857142857144
22/12/2025_15g30_2,2025-12-22,CS2,H6-109,80,38,LA1007(38),0.475
22/12/2025_15g30_2,2025-12-22,CS2,H6-110,80,38,LA1007(38),0.475
22/12/2025_15g30_2,2025-12-22,CS2,H6-206,80,36,LA1007(36),0.45
22/12/2025_15g30_2,2025-12-22,CS2,H6-210,80,36,LA1007(36),0.45
22/12/2025_15g30_2,2025-12-22,CS2,H6-112,80,35,LA1007(35),0.4375
22/12/2025_15g30_2,2025-12-22,CS2,H6-212,80,34,LA1007(34),0.425
22/12/2025_15g30_2,2025-12-22,CS2,H6-214,80,33,LA1007(33),0.4125
22/12/2025_15g30_2,2025-12-22,CS2,H6-213,80,32,LA1007(32),0.4
22/12/2025_15g30_2,2025-12-22,CS2,H6-306,80,32,LA1007(32),0.4
22/12/2025_15g30_2,2025-12-22,CS2,H6-312,80,31,LA1007(31),0.3875
22/12/2025_15g30_2,2025-12-22,CS2,H6-310,80,30,LA1007(30),0.375
22/12/2025_18g15_1,2025-12-22,CS1,B5-GD,130,130,"CO5087(41), EE5191(32), CI5403(30), CH5703(27)",1.0
22/12/2025_18g15_1,2025-12-22,CS1,B4-305,80,79,"CH5703(30), IM5127(28), CI5251(21)",0.9875
22/12/2025_18g15_1,2025-12-22,CS1,B4-402,60,56,"ME5269(24), CH5407(14), CO5161(9), TR5063(9)",0.9333333333333333
22/12/2025_18g15_1,2025-12-22,CS1,B4-302,60,8,MA5097(8),0.13333333333333333
23/12/2025_07g00_1,2025-12-23,CS1,B5-GD,130,103,"MT1003(41), MT1019(41), IM3109(21)",0.7923076923076923
23/12/2025_07g00_1,2025-12-23,CS1,B4-406,108,71,"MT1003(41), MT1019(30)",0.6574074074074074
23/12/2025_07g00_1,2025-12-23,CS1,B6-306,80,70,"MT1003(40), MT1019(30)",0.875
23/12/2025_07g00_1,2025-12-23,CS1,C4-301,80,70,"MT1003(40), MT1019(30)",0.875
23/12/2025_07g00_1,2025-12-23,CS1,C4-304,80,68,"MT1003(40), MT1019(28)",0.85
23/12/2025_07g00_1,2025-12-23,CS1,C4-402,80,64,"MT1003(40), MT1019(24)",0.8
23/12/2025_07g00_1,2025-12-23,CS1,C4-403,80,39,MT1003(39),0.4875
23/12/2025_07g00_1,2025-12-23,CS1,C4-502,80,39,MT1003(39),0.4875
23/12/2025_07g00_1,2025-12-23,CS1,C5-303,80,38,MT1003(38),0.475
23/12/2025_07g00_1,2025-12-23,CS1,C5-401,80,38,MT1003(38),0.475
23/12/2025_07g00_1,2025-12-23,CS1,C5-403,80,38,MT1003(38),0.475
23/12/2025_07g00_1,2025-12-23,CS1,C5-503,80,37,MT1003(37),0.4625
23/12/2025_07g00_1,2025-12-23,CS1,C5-502,80,36,MT1003(36),0.45
23/12/2025_07g00_1,2025-12-23,CS1,C6-401,80,36,MT1003(36),0.45
23/12/2025_07g00_1,2025-12-23,CS1,C6-402,80,34,MT1003(34),0.425
23/12/2025_07g00_1,2025-12-23,CS1,B1-208,84,33,MT1003(33),0.39285714285714285
23/12/2025_07g00_1,2025-12-23,CS1,C6-403,80,33,MT1003(33),0.4125
23/12/2025_07g00_1,2025-12-23,CS1,B1-306,84,31,MT1003(31),0.36904761904761907
23/12/2025_07g00_1,2025-12-23,CS1,B1-212,72,30,MT1003(30),0.4166666666666667
23/12/2025_07g00_1,2025-12-23,CS1,B1-213,72,30,MT1003(30),0.4166666666666667
23/12/2025_07g00_1,2025-12-23,CS1,B1-301,56,30,MT1003(30),0.5357142857142857
23/12/2025_07g00_1,2025-12-23,CS1,B1-303,56,30,MT1003(30),0.5357142857142857
23/12/2025_07g00_1,2025-12-23,CS1,B1-305,72,30,MT1003(30),0.4166666666666667
23/12/2025_07g00_1,2025-12-23,CS1,B1-308,72,30,MT1003(30),0.4166666666666667
23/12/2025_07g00_1,2025-12-23,CS1,B1-309,56,30,MT1003(30),0.5357142857142857
23/12/2025_07g00_1,2025-12-23,CS1,B1-311,80,30,MT1003(30),0.375
23/12/2025_07g00_1,2025-12-23,CS1,B1-313,56,30,MT1003(30),0.5357142857142857
23/12/2025_07g00_1,2025-12-23,CS1,B1-314,56,30,MT1003(30),0.5357142857142857
23/12/2025_07g00_1,2025-12-23,CS1,B1-315,56,30,MT1003(30),0.5357142857142857
23/12/2025_07g00_1,2025-12-23,CS1,B4-301,60,30,MT1003(30),0.5
23/12/2025_07g00_1,2025-12-23,CS1,B4-302,60,30,MT1003(30),0.5
23/12/2025_07g00_1,2025-12-23,CS1,B4-303,60,30,MT1003(30),0.5
23/12/2025_07g00_1,2025-12-23,CS1,B4-305,80,30,MT1003(30),0.375
23/12/2025_07g00_1,2025-12-23,CS1,B4-401,60,30,MT1003(30),0.5
23/12/2025_07g00_1,2025-12-23,CS1,B6-302,60,30,MT1003(30),0.5
23/12/2025_07g00_1,2025-12-23,CS1,B6-303,60,30,MT1003(30),0.5
23/12/2025_07g00_1,2025-12-23,CS1,B6-304,60,30,MT1003(30),0.5
23/12/2025_07g00_1,2025-12-23,CS1,B6-305,60,30,MT1003(30),0.5
23/12/2025_07g00_1,2025-12-23,CS1,B8-301,66,30,MT1003(30),0.45454545454545453
23/12/2025_07g00_1,2025-12-23,CS1,B8-303,62,30,MT1003(30),0.4838709677419355
23/12/2025_07g00_1,2025-12-23,CS1,B10-203,70,29,MT1003(29),0.4142857142857143
23/12/2025_07g00_1,2025-12-23,CS1,B1-302,56,29,MT1003(29),0.5178571428571429
23/12/2025_07g00_1,2025-12-23,CS1,B4-402,60,29,MT1003(29),0.48333333333333334
23/12/2025_07g00_1,2025-12-23,CS1,B8-304,62,29,MT1003(29),0.46774193548387094
23/12/2025_07g00_1,2025-12-23,CS1,B9-201,60,29,MT1003(29),0.48333333333333334
23/12/2025_07g00_1,2025-12-23,CS1,B1-203,60,27,MT1003(27),0.45
23/12/2025_07g00_1,2025-12-23,CS1,B9-202,54,27,MT1003(27),0.5
23/12/2025_07g00_1,2025-12-23,CS1,C4-303,50,26,MT1003(26),0.52
23/12/2025_07g00_2,2025-12-23,CS2,H6-GD,250,166,"EE3025(51), MT1003(49), CH2019(40), IM3109(26)",0.664
23/12/2025_07g00_2,2025-12-23,CS2,H3-306,142,118,"EE3025(51), MT1003(46), CH2019(21)",0.8309859154929577
23/12/2025_07g00_2,2025-12-23,CS2,H2-205,117,85,"MT1003(44), EE3025(41)",0.7264957264957265
23/12/2025_07g00_2,2025-12-23,CS2,H2-206,156,84,"MT1003(44), EE3025(40)",0.5384615384615384
23/12/2025_07g00_2,2025-12-23,CS2,H3-304,88,80,"EE3025(40), MT1003(40)",0.9090909090909091
23/12/2025_07g00_2,2025-12-23,CS2,H2-301,156,70,"MT1003(40), EE3025(30)",0.44871794871794873
23/12/2025_07g00_2,2025-12-23,CS2,H2-302,117,40,MT1003(40),0.3418803418803419
23/12/2025_07g00_2,2025-12-23,CS2,H2-304,93,40,MT1003(40),0.43010752688172044
23/12/2025_07g00_2,2025-12-23,CS2,H2-306,156,40,MT1003(40),0.2564102564102564
23/12/2025_07g00_2,2025-12-23,CS2,H2-307,117,40,MT1003(40),0.3418803418803419
23/12/2025_07g00_2,2025-12-23,CS2,H2-401,156,40,MT1003(40),0.2564102564102564
23/12/2025_07g00_2,2025-12-23,CS2,H2-403,93,40,MT1003(40),0.43010752688172044
23/12/2025_07g00_2,2025-12-23,CS2,H2-404,93,40,MT1003(40),0.43010752688172044
23/12/2025_07g00_2,2025-12-23,CS2,H2-406,156,40,MT1003(40),0.2564102564102564
23/12/2025_07g00_2,2025-12-23,CS2,H2-407,84,40,MT1003(40),0.47619047619047616
23/12/2025_07g00_2,2025-12-23,CS2,H6-109,80,40,MT1003(40),0.5
23/12/2025_07g00_2,2025-12-23,CS2,H6-110,80,40,MT1003(40),0.5
23/12/2025_07g00_2,2025-12-23,CS2,H6-112,80,40,MT1003(40),0.5
23/12/2025_07g00_2,2025-12-23,CS2,H6-113,129,40,MT1003(40),0.31007751937984496
23/12/2025_07g00_2,2025-12-23,CS2,H6-201,120,40,MT1003(40),0.3333333333333333
23/12/2025_07g00_2,2025-12-23,CS2,H6-205,117,40,MT1003(40),0.3418803418803419
23/12/2025_07g00_2,2025-12-23,CS2,H6-206,80,40,MT1003(40),0.5
23/12/2025_07g00_2,2025-12-23,CS2,H6-208,117,40,MT1003(40),0.3418803418803419
23/12/2025_07g00_2,2025-12-23,CS2,H6-210,80,40,MT1003(40),0.5
23/12/2025_07g00_2,2025-12-23,CS2,H6-211,126,40,MT1003(40),0.31746031746031744
23/12/2025_07g00_2,2025-12-23,CS2,H6-212,80,40,MT1003(40),0.5
23/12/2025_07g00_2,2025-12-23,CS2,H6-214,80,40,MT1003(40),0.5
23/12/2025_07g00_2,2025-12-23,CS2,H6-305,129,40,MT1003(40),0.31007751937984496
23/12/2025_07g00_2,2025-12-23,CS2,H6-308,144,40,MT1003(40),0.2777777777777778
23/12/2025_07g00_2,2025-12-23,CS2,H6-311,135,40,MT1003(40),0.2962962962962963
23/12/2025_07g00_2,2025-12-23,CS2,H6-405,120,40,MT1003(40),0.3333333333333333
23/12/2025_07g00_2,2025-12-23,CS2,H6-412,123,40,MT1003(40),0.3252032520325203
23/12/2025_07g00_2,2025-12-23,CS2,H6-504,106,40,MT1003(40),0.37735849056603776
23/12/2025_07g00_2,2025-12-23,CS2,H6-506,105,40,MT1003(40),0.38095238095238093
23/12/2025_07g00_2,2025-12-23,CS2,H6-510,102,40,MT1003(40),0.39215686274509803
23/12/2025_07g00_2,2025-12-23,CS2,H6-512,105,40,MT1003(40),0.38095238095238093
23/12/2025_07g00_2,2025-12-23,CS2,H6-514,108,40,MT1003(40),0.37037037037037035
23/12/2025_07g00_2,2025-12-23,CS2,H6-516,114,40,MT1003(40),0.3508771929824561
23/12/2025_07g00_2,2025-12-23,CS2,H6-306,80,39,MT1003(39),0.4875
23/12/2025_07g00_2,2025-12-23,CS2,H6-310,80,39,MT1003(39),0.4875
23/12/2025_07g00_2,2025-12-23,CS2,H6-312,80,39,MT1003(39),0.4875
23/12/2025_07g00_2,2025-12-23,CS2,H6-313,80,39,MT1003(39),0.4875
23/12/2025_07g00_2,2025-12-23,CS2,H6-213,80,38,MT1003(38),0.475
23/12/2025_07g00_2,2025-12-23,CS2,H6-411,80,38,MT1003(38),0.475
23/12/2025_07g00_2,2025-12-23,CS2,H6-413,80,37,MT1003(37),0.4625
23/12/2025_07g00_2,2025-12-23,CS2,H6-414,80,31,MT1003(31),0.3875
23/12/2025_07g00_2,2025-12-23,CS2,H6-415,80,29,MT1003(29),0.3625
23/12/2025_07g00_2,2025-12-23,CS2,H2-305,63,28,MT1003(28),0.4444444444444444
23/12/2025_09g30_1,2025-12-23,CS1,B5-GD,130,130,"MT1003(44), MT1017(38), MT1015(33), CO3071(15)",1.0
23/12/2025_09g30_1,2025-12-23,CS1,B4-502,80,63,"TR3055(32), MT1003(31)",0.7875
23/12/2025_09g30_1,2025-12-23,CS1,B6-302,60,60,"MT1015(31), MT1017(29)",1.0
23/12/2025_09g30_1,2025-12-23,CS1,B4-306,80,78,"MT1017(31), ME4645(30), MT1003(17)",0.975
23/12/2025_09g30_1,2025-12-23,CS1,B8-304,62,60,"ME4645(30), MT1003(30)",0.967741935483871
23/12/2025_09g30_1,2025-12-23,CS1,B4-403,60,60,"MT1003(30), MT1015(30)",1.0
23/12/2025_09g30_1,2025-12-23,CS1,B6-304,60,60,"MT1015(30), MT1017(30)",1.0
23/12/2025_09g30_1,2025-12-23,CS1,B6-305,60,52,"MT1015(28), MT1017(24)",0.8666666666666667
23/12/2025_09g30_1,2025-12-23,CS1,B6-301,50,42,"MT1015(25), MT1003(17)",0.84
23/12/2025_09g30_2,2025-12-23,CS2,H6-GD,250,175,"MT1003(49), ME4645(45), CO3071(41), MT1017(40)",0.7
23/12/2025_09g30_2,2025-12-23,CS2,H2-202,117,111,"MT1003(45), ME4645(40), MT1017(26)",0.9487179487179487
23/12/2025_09g30_2,2025-12-23,CS2,H2-205,117,83,"MT1003(43), MT1017(40)",0.7094017094017094
23/12/2025_09g30_2,2025-12-23,CS2,H2-206,156,116,"MT1003(40), MT1017(40), CO3071(36)",0.7435897435897436
23/12/2025_09g30_2,2025-12-23,CS2,H2-207,135,40,MT1003(40),0.2962962962962963
23/12/2025_09g30_2,2025-12-23,CS2,H2-301,156,40,MT1003(40),0.2564102564102564
23/12/2025_09g30_2,2025-12-23,CS2,H2-302,117,40,MT1003(40),0.3418803418803419
23/12/2025_09g30_2,2025-12-23,CS2,H2-304,93,40,MT1003(40),0.43010752688172044
23/12/2025_09g30_2,2025-12-23,CS2,H2-306,156,40,MT1003(40),0.2564102564102564
23/12/2025_09g30_2,2025-12-23,CS2,H2-307,117,40,MT1003(40),0.3418803418803419
23/12/2025_09g30_2,2025-12-23,CS2,H2-401,156,40,MT1003(40),0.2564102564102564
23/12/2025_09g30_2,2025-12-23,CS2,H2-403,93,40,MT1003(40),0.43010752688172044
23/12/2025_09g30_2,2025-12-23,CS2,H2-404,93,40,MT1003(40),0.43010752688172044
23/12/2025_09g30_2,2025-12-23,CS2,H2-406,156,40,MT1003(40),0.2564102564102564
23/12/2025_09g30_2,2025-12-23,CS2,H2-407,84,40,MT1003(40),0.47619047619047616
23/12/2025_09g30_2,2025-12-23,CS2,H6-109,80,40,MT1003(40),0.5
23/12/2025_09g30_2,2025-12-23,CS2,H6-110,80,40,MT1003(40),0.5
23/12/2025_09g30_2,2025-12-23,CS2,H6-113,129,40,MT1003(40),0.31007751937984496
23/12/2025_09g30_2,2025-12-23,CS2,H6-201,120,40,MT1003(40),0.3333333333333333
23/12/2025_09g30_2,2025-12-23,CS2,H6-205,117,40,MT1003(40),0.3418803418803419
23/12/2025_09g30_2,2025-12-23,CS2,H6-211,126,40,MT1003(40),0.31746031746031744
23/12/2025_09g30_2,2025-12-23,CS2,H6-305,129,40,MT1003(40),0.31007751937984496
23/12/2025_09g30_2,2025-12-23,CS2,H6-308,144,40,MT1003(40),0.2777777777777778
23/12/2025_09g30_2,2025-12-23,CS2,H6-311,135,40,MT1003(40),0.2962962962962963
23/12/2025_09g30_2,2025-12-23,CS2,H6-405,120,40,MT1003(40),0.3333333333333333
23/12/2025_09g30_2,2025-12-23,CS2,H6-412,123,40,MT1003(40),0.3252032520325203
23/12/2025_09g30_2,2025-12-23,CS2,H6-504,106,40,MT1003(40),0.37735849056603776
23/12/2025_09g30_2,2025-12-23,CS2,H6-506,105,40,MT1003(40),0.38095238095238093
23/12/2025_09g30_2,2025-12-23,CS2,H6-510,102,40,MT1003(40),0.39215686274509803
23/12/2025_09g30_2,2025-12-23,CS2,H6-512,105,40,MT1003(40),0.38095238095238093
23/12/2025_09g30_2,2025-12-23,CS2,H6-514,108,40,MT1003(40),0.37037037037037035
23/12/2025_09g30_2,2025-12-23,CS2,H6-516,114,40,MT1003(40),0.3508771929824561
23/12/2025_09g30_2,2025-12-23,CS2,H6-802,120,40,MT1003(40),0.3333333333333333
23/12/2025_09g30_2,2025-12-23,CS2,H6-810,120,40,MT1003(40),0.3333333333333333
23/12/2025_09g30_2,2025-12-23,CS2,H6-811,150,40,MT1003(40),0.26666666666666666
23/12/2025_09g30_2,2025-12-23,CS2,H6-112,80,39,MT1003(39),0.4875
23/12/2025_09g30_2,2025-12-23,CS2,H6-206,80,39,MT1003(39),0.4875
23/12/2025_09g30_2,2025-12-23,CS2,H6-208,117,39,MT1003(39),0.3333333333333333
23/12/2025_09g30_2,2025-12-23,CS2,H6-210,80,39,MT1003(39),0.4875
23/12/2025_09g30_2,2025-12-23,CS2,H6-212,80,39,MT1003(39),0.4875
23/12/2025_09g30_2,2025-12-23,CS2,H6-214,80,39,MT1003(39),0.4875
23/12/2025_09g30_2,2025-12-23,CS2,H6-306,80,39,MT1003(39),0.4875
23/12/2025_09g30_2,2025-12-23,CS2,H6-213,80,37,MT1003(37),0.4625
23/12/2025_09g30_2,2025-12-23,CS2,H6-310,80,37,MT1003(37),0.4625
23/12/2025_09g30_2,2025-12-23,CS2,H6-312,80,35,MT1003(35),0.4375
23/12/2025_09g30_2,2025-12-23,CS2,H6-313,80,35,MT1003(35),0.4375
23/12/2025_09g30_2,2025-12-23,CS2,H6-411,80,32,MT1003(32),0.4
23/12/2025_09g30_2,2025-12-23,CS2,H2-305,63,31,MT1003(31),0.49206349206349204
23/12/2025_09g30_2,2025-12-23,CS2,H2-402,63,27,MT1003(27),0.42857142857142855
23/12/2025_13g00_1,2025-12-23,CS1,B5-GD,130,130,"TR3135(42), CH4085(37), CO3143(34), AS3105(17)",1.0
23/12/2025_13g00_1,2025-12-23,CS1,B4-502,80,80,"CH3049(31), ME4201(31), LA1009(18)",1.0
23/12/2025_13g00_1,2025-12-23,CS1,B4-303,60,60,"CO3143(30), EE3403(30)",1.0
23/12/2025_13g00_1,2025-12-23,CS1,B4-401,60,58,"LA1009(30), CI1003(28)",0.9666666666666667
23/12/2025_13g00_1,2025-12-23,CS1,B4-301,60,56,"ME4201(20), EE3403(19), EE4053(17)",0.9333333333333333
23/12/2025_13g00_2,2025-12-23,CS2,H6-GD,250,250,"EE3077(56), AS3105(55), CI4165(54), ME4201(45), CH4085(40)",1.0
23/12/2025_13g00_2,2025-12-23,CS2,H6-113,129,126,"LA1009(43), TR3135(43), CH4085(40)",0.9767441860465116
23/12/2025_13g00_2,2025-12-23,CS2,H6-208,117,105,"LA1009(43), CH4085(34), AS3015(28)",0.8974358974358975
23/12/2025_13g00_2,2025-12-23,CS2,H6-308,144,131,"LA1009(41), EE3133(26), ME3207(23), CH3049(21), CH3403(20)",0.9097222222222222
23/12/2025_13g00_2,2025-12-23,CS2,H6-109,80,56,"LA1009(40), IM1015(16)",0.7
23/12/2025_13g00_2,2025-12-23,CS2,H6-110,80,40,LA1009(40),0.5
23/12/2025_13g00_2,2025-12-23,CS2,H6-201,120,40,LA1009(40),0.3333333333333333
23/12/2025_13g00_2,2025-12-23,CS2,H6-205,117,40,LA1009(40),0.3418803418803419
23/12/2025_13g00_2,2025-12-23,CS2,H6-206,80,40,LA1009(40),0.5
23/12/2025_13g00_2,2025-12-23,CS2,H6-210,80,40,LA1009(40),0.5
23/12/2025_13g00_2,2025-12-23,CS2,H6-305,129,40,LA1009(40),0.31007751937984496
23/12/2025_13g00_2,2025-12-23,CS2,H6-311,135,40,LA1009(40),0.2962962962962963
23/12/2025_13g00_2,2025-12-23,CS2,H6-112,80,39,LA1009(39),0.4875
23/12/2025_13g00_2,2025-12-23,CS2,H6-212,80,38,LA1009(38),0.475
23/12/2025_13g00_2,2025-12-23,CS2,H6-213,80,32,LA1009(32),0.4
23/12/2025_13g00_2,2025-12-23,CS2,H6-214,80,28,LA1009(28),0.35
23/12/2025_13g00_2,2025-12-23,CS2,H6-306,80,28,LA1009(28),0.35
23/12/2025_13g00_2,2025-12-23,CS2,H6-310,80,24,LA1009(24),0.3
23/12/2025_13g00_2,2025-12-23,CS2,H6-312,80,24,LA1009(24),0.3
23/12/2025_13g00_2,2025-12-23,CS2,H6-313,80,21,LA1009(21),0.2625
23/12/2025_15g30_1,2025-12-23,CS1,B5-GD,130,45,ME2151(45),0.34615384615384615
23/12/2025_15g30_1,2025-12-23,CS1,B4-405,60,30,ME2151(30),0.5
23/12/2025_15g30_2,2025-12-23,CS2,H6-GD,250,40,EE2017(40),0.16
23/12/2025_15g30_2,2025-12-23,CS2,H6-113,129,39,EE2017(39),0.3023255813953488
23/12/2025_15g30_2,2025-12-23,CS2,H6-110,80,36,EE2017(36),0.45
23/12/2025_15g30_2,2025-12-23,CS2,H6-109,80,21,EE2017(21),0.2625
23/12/2025_18g15_1,2025-12-23,CS1,B5-GD,130,128,"GK5025(40), CI5407(31), CH5603(30), IM5067(27)",0.9846153846153847
23/12/2025_18g15_1,2025-12-23,CS1,B4-301,60,55,"GK5025(30), EE5193(25)",0.9166666666666666
23/12/2025_18g15_1,2025-12-23,CS1,B4-302,60,60,"GK5025(30), CH5603(16), CI5137(14)",1.0
23/12/2025_18g15_1,2025-12-23,CS1,B4-303,60,44,"GK5025(30), TR5067(8), TR5089(6)",0.7333333333333333
24/12/2025_07g00_1,2025-12-24,CS1,B5-GD,130,125,"CH2113(44), CO1005(42), CI2135(39)",0.9615384615384616
24/12/2025_07g00_1,2025-12-24,CS1,B4-305,80,78,"CH2113(39), EE2409(39)",0.975
24/12/2025_07g00_1,2025-12-24,CS1,C4-301,80,80,"ME2179(37), CH2113(33), CI2135(10)",1.0
24/12/2025_07g00_1,2025-12-24,CS1,B1-306,84,82,"CO1005(31), CO3049(30), ME3281(21)",0.9761904761904762
24/12/2025_07g00_1,2025-12-24,CS1,B1-212,72,60,"CO1005(30), CH2113(30)",0.8333333333333334
24/12/2025_07g00_1,2025-12-24,CS1,B1-301,56,56,"CO1005(30), CH2113(26)",1.0
24/12/2025_07g00_1,2025-12-24,CS1,B1-302,56,56,"CO1005(30), IM2019(26)",1.0
24/12/2025_07g00_1,2025-12-24,CS1,B1-305,72,60,"CO1005(30), CH2113(30)",0.8333333333333334
24/12/2025_07g00_1,2025-12-24,CS1,B1-308,72,60,"CO1005(30), CH2113(30)",0.8333333333333334
24/12/2025_07g00_1,2025-12-24,CS1,B1-309,56,55,"CO1005(30), EE1009(25)",0.9821428571428571
24/12/2025_07g00_1,2025-12-24,CS1,B1-311,80,80,"CO1005(30), CH2113(30), CO3049(20)",1.0
24/12/2025_07g00_1,2025-12-24,CS1,B1-313,56,55,"CO1005(30), EE1009(25)",0.9821428571428571
24/12/2025_07g00_1,2025-12-24,CS1,B1-314,56,54,"CO1005(30), IM2019(24)",0.9642857142857143
24/12/2025_07g00_1,2025-12-24,CS1,B1-315,56,51,"CO1005(30), ME3281(21)",0.9107142857142857
24/12/2025_07g00_1,2025-12-24,CS1,B4-402,60,60,"CH2113(30), EE1009(30)",1.0
24/12/2025_07g00_1,2025-12-24,CS1,B4-502,80,80,"EE1009(30), IM2019(30), CO1005(20)",1.0
24/12/2025_07g00_1,2025-12-24,CS1,B4-504,60,60,"EE1009(30), IM2019(30)",1.0
24/12/2025_07g00_1,2025-12-24,CS1,B4-505,120,118,"EE1009(30), ME2179(30), CO1005(29), CH2113(29)",0.9833333333333333
24/12/2025_07g00_1,2025-12-24,CS1,B6-302,60,60,"EE1009(30), ME2179(30)",1.0
24/12/2025_07g00_1,2025-12-24,CS1,B6-303,60,60,"EE1009(30), ME2179(30)",1.0
24/12/2025_07g00_1,2025-12-24,CS1,B6-306,80,69,"EE1009(30), CO1005(21), ME2179(18)",0.8625
24/12/2025_07g00_1,2025-12-24,CS1,B1-206,48,19,EE1009(19),0.3958333333333333
24/12/2025_07g00_1,2025-12-24,CS1,B6-301,50,19,EE1009(19),0.38
24/12/2025_07g00_1,2025-12-24,CS1,B1-215,48,15,EE1009(15),0.3125
24/12/2025_07g00_2,2025-12-24,CS2,H6-GD,250,248,"ME2103(57), ME2179(53), EE1009(49), CO1005(48), ME3281(41)",0.992
24/12/2025_07g00_2,2025-12-24,CS2,H2-201,156,156,"CH2113(45), EE1009(45), ME2103(41), IM3095(25)",1.0
24/12/2025_07g00_2,2025-12-24,CS2,H3-504,88,81,"ME2179(41), CI2135(40)",0.9204545454545454
24/12/2025_07g00_2,2025-12-24,CS2,H2-401,156,156,"CI2135(40), CO1005(40), CO3049(40), CH2113(36)",1.0
24/12/2025_07g00_2,2025-12-24,CS2,H2-403,93,80,"CI2135(40), CO1005(40)",0.8602150537634409
24/12/2025_07g00_2,2025-12-24,CS2,H2-404,93,80,"CI2135(40), CO1005(40)",0.8602150537634409
24/12/2025_07g00_2,2025-12-24,CS2,H2-406,156,155,"CI2135(40), CO1005(40), CO3049(40), EE1009(35)",0.9935897435897436
24/12/2025_07g00_2,2025-12-24,CS2,H6-510,102,98,"CO1005(40), CH2113(40), CH3421(18)",0.9607843137254902
24/12/2025_07g00_2,2025-12-24,CS2,H6-512,105,105,"CO1005(40), CH2113(40), ME3281(25)",1.0
24/12/2025_07g00_2,2025-12-24,CS2,H6-514,108,108,"CO1005(40), CH2113(40), CO3083(28)",1.0
24/12/2025_07g00_2,2025-12-24,CS2,H2-207,135,120,"CH2113(40), EE1009(40), IM2019(40)",0.8888888888888888
24/12/2025_07g00_2,2025-12-24,CS2,H2-301,156,155,"CH2113(40), EE1009(40), IM2019(40), CO3049(35)",0.9935897435897436
24/12/2025_07g00_2,2025-12-24,CS2,H6-112,80,80,"EE1009(40), IM2019(40)",1.0
24/12/2025_07g00_2,2025-12-24,CS2,H6-201,120,120,"EE1009(40), IM3095(40), ME3281(40)",1.0
24/12/2025_07g00_2,2025-12-24,CS2,H6-206,80,80,"EE1009(40), ME3281(40)",1.0
24/12/2025_07g00_2,2025-12-24,CS2,H6-208,117,116,"EE1009(40), CI2135(39), ME3281(37)",0.9914529914529915
24/12/2025_07g00_2,2025-12-24,CS2,H6-210,80,79,"EE1009(40), CO1005(39)",0.9875
24/12/2025_07g00_2,2025-12-24,CS2,H6-211,126,118,"EE1009(40), CO1005(39), CH2113(39)",0.9365079365079365
24/12/2025_07g00_2,2025-12-24,CS2,H6-212,80,79,"EE1009(40), CH2113(39)",0.9875
24/12/2025_07g00_2,2025-12-24,CS2,H6-213,80,79,"EE1009(40), ME3281(39)",0.9875
24/12/2025_07g00_2,2025-12-24,CS2,H6-214,80,75,"EE1009(40), CO3049(35)",0.9375
24/12/2025_07g00_2,2025-12-24,CS2,H6-305,129,90,"EE1009(40), ME2015(26), IM2019(24)",0.6976744186046512
24/12/2025_07g00_2,2025-12-24,CS2,H6-306,80,40,EE1009(40),0.5
